Datetime,Tweet Id,original_text,geo,retweet_count,reply_count,like_count,author_id,context_annotations
2022-05-07 11:30:08+00:00,1522901592864927744,"#nanopores @labgenpath: 'One week already since the @labgenpath  deployed the mobile lab with an MK1C for the sequencing of Ebola positive cases in Mbandaka. The run of the third positive sample has been launched with t… https://t.co/WubJElMMeW, see more https://t.co/aSBVBTKTPt",,0,0,0,335246117,"[{'domain': {'id': '123', 'name': 'Ongoing News Story', 'description': ""Ongoing News Stories like 'Brexit'""}, 'entity': {'id': '1220701888179359745', 'name': 'COVID-19'}}]"
2022-05-07 11:28:08+00:00,1522901087983910913,Another person died in the Ebola epidemic in the Democratic Republic of the Congo - #republic https://t.co/yUWnGAZHad,,0,0,0,1452730505787551750,[]
2022-05-07 11:23:47+00:00,1522899993379676162,Which of the pandemic? Ebola abi corona?😂😂😂. #Archangels #AngelJBSmith https://t.co/Eo6VKzxNk5,,2,6,17,1510807175530221570,"[{'domain': {'id': '10', 'name': 'Person', 'description': 'Named people in the world like Nelson Mandela'}, 'entity': {'id': '1455789953187602432', 'name': 'Angel JB Smith'}}, {'domain': {'id': '58', 'name': 'Entertainment Personality', 'description': 'An entertainment personality in the world, like Anderson Cooper or Miranda Sings'}, 'entity': {'id': '1455789953187602432', 'name': 'Angel JB Smith'}}, {'domain': {'id': '123', 'name': 'Ongoing News Story', 'description': ""Ongoing News Stories like 'Brexit'""}, 'entity': {'id': '1220701888179359745', 'name': 'COVID-19'}}, {'domain': {'id': '29', 'name': 'Events [Entity Service]', 'description': 'Entity Service related Events domain'}, 'entity': {'id': '1219057585707315201', 'name': 'COVID-19: Latest news updates from around the world', 'description': 'This page is a timeline of Tweets with the latest information and updates on COVID-19 from experts, journalists, health authorities and other trusted sources from around the world. For more on COVID-19, visit: twitter.com/explore/tabs/covid-19'}}]"
2022-05-07 11:18:15+00:00,1522898600921112576,"IJMS, Vol. 23, Pages 5228: Ebola Virus Encodes Two microRNAs in Huh7-Infected Cells https://t.co/4N8XQnfJ3u",,0,0,0,52728374,[]
2022-05-07 11:18:06+00:00,1522898564808073217,"https://t.co/WmEJMhTUsm Chief pushers of
Bill Gates propaganda using
Ebola like scaremongering pictures
to terrify poor people to get the 💉
#BillGates #AlJazeera 
PPE gowns come in Zuby colours now  @ZubyMusic #ZubyMusic https://t.co/VtXV9zRkfd",,0,0,0,1288385048706789376,"[{'domain': {'id': '45', 'name': 'Brand Vertical', 'description': 'Top level entities that describe a Brands industry'}, 'entity': {'id': '781974597310615553', 'name': 'Entertainment'}}, {'domain': {'id': '46', 'name': 'Brand Category', 'description': 'Categories within Brand Verticals that narrow down the scope of Brands'}, 'entity': {'id': '781974597105094656', 'name': 'TV/Movies Related'}}, {'domain': {'id': '47', 'name': 'Brand', 'description': 'Brands and Companies'}, 'entity': {'id': '1066123894476570624', 'name': 'Al Jazeera', 'description': 'Al Jazeera'}}, {'domain': {'id': '10', 'name': 'Person', 'description': 'Named people in the world like Nelson Mandela'}, 'entity': {'id': '806574543888232448', 'name': 'Bill Gates', 'description': 'Bill Gates'}}, {'domain': {'id': '65', 'name': 'Interests and Hobbies Vertical', 'description': 'Top level interests and hobbies groupings, like Food or Travel'}, 'entity': {'id': '781974596148793345', 'name': 'Business & finance'}}, {'domain': {'id': '65', 'name': 'Interests and Hobbies Vertical', 'description': 'Top level interests and hobbies groupings, like Food or Travel'}, 'entity': {'id': '781974596148793345', 'name': 'Business & finance'}}, {'domain': {'id': '30', 'name': 'Entities [Entity Service]', 'description': 'Entity Service top level domain, every item that is in Entity Service should be in this domain'}, 'entity': {'id': '857879456773357569', 'name': 'Technology', 'description': 'Technology'}}]"
2022-05-07 11:16:13+00:00,1522898090180575233,There's a drought of Pepsi amid the Ebola pandemic,,0,0,0,1307842037253918721,"[{'domain': {'id': '45', 'name': 'Brand Vertical', 'description': 'Top level entities that describe a Brands industry'}, 'entity': {'id': '781974596740190208', 'name': 'CPG'}}, {'domain': {'id': '46', 'name': 'Brand Category', 'description': 'Categories within Brand Verticals that narrow down the scope of Brands'}, 'entity': {'id': '781974596656304128', 'name': 'Beverage'}}, {'domain': {'id': '47', 'name': 'Brand', 'description': 'Brands and Companies'}, 'entity': {'id': '10026288001', 'name': 'Pepsi'}}, {'domain': {'id': '30', 'name': 'Entities [Entity Service]', 'description': 'Entity Service top level domain, every item that is in Entity Service should be in this domain'}, 'entity': {'id': '825047692124442624', 'name': 'Food', 'description': 'Food'}}, {'domain': {'id': '67', 'name': 'Interests and Hobbies', 'description': 'Interests, opinions, and behaviors of individuals, groups, or cultures; like Speciality Cooking or Theme Parks'}, 'entity': {'id': '850143755873140737', 'name': 'Soda', 'description': 'Soda'}}, {'domain': {'id': '123', 'name': 'Ongoing News Story', 'description': ""Ongoing News Stories like 'Brexit'""}, 'entity': {'id': '1220701888179359745', 'name': 'COVID-19'}}]"
2022-05-07 10:41:56+00:00,1522889464565051393,Cabal Do any of you use Puzzling Ebola  Artificial Intelligence Terminal bort mayonnaise samsung I will Fallopian Tube fockin mayonnaise @pauljac3_  cky 4 mustard song. Johnny,,1,1,0,1492220485945470982,"[{'domain': {'id': '47', 'name': 'Brand', 'description': 'Brands and Companies'}, 'entity': {'id': '1174344555111469057', 'name': 'Samsung Indonesia'}}, {'domain': {'id': '47', 'name': 'Brand', 'description': 'Brands and Companies'}, 'entity': {'id': '10026364234', 'name': 'Samsung '}}, {'domain': {'id': '48', 'name': 'Product', 'description': 'Products created by Brands.  Examples: Ford Explorer, Apple iPhone.'}, 'entity': {'id': '10045298641', 'name': 'Samsung USA'}}]"
2022-05-07 10:33:46+00:00,1522887407061905411,"Join us for our Speakers Event series!

👩SPEAKERS: #Woman
🩺MEDICAL: #MSFclinic #UKdoctor
🔬HEALTH: #Epidemiologist #HealthSurveillanceSystem #Malaria #Ebola #Measles #Diphtheria #Zoology
🚑FIELDS: #Bangladesh #Congo #Ethiopia #Iraq #Niger #SouthSudan #Sudan #Syria #Venezuela https://t.co/YXJzOXgpSM",,2,0,2,1181933186550566913,"[{'domain': {'id': '30', 'name': 'Entities [Entity Service]', 'description': 'Entity Service top level domain, every item that is in Entity Service should be in this domain'}, 'entity': {'id': '854692455005921281', 'name': 'Science', 'description': 'Science'}}, {'domain': {'id': '30', 'name': 'Entities [Entity Service]', 'description': 'Entity Service top level domain, every item that is in Entity Service should be in this domain'}, 'entity': {'id': '847896837532995585', 'name': 'Biology', 'description': 'Biology'}}, {'domain': {'id': '30', 'name': 'Entities [Entity Service]', 'description': 'Entity Service top level domain, every item that is in Entity Service should be in this domain'}, 'entity': {'id': '1354786660328693765', 'name': 'Zoology'}}, {'domain': {'id': '164', 'name': 'Fields of study', 'description': 'for all fields of study, e.g., futurology, microbiology '}, 'entity': {'id': '854692455005921281', 'name': 'Science', 'description': 'Science'}}]"
2022-05-07 10:32:43+00:00,1522887142472437761,"Join us for our Speakers Event series!
🩺MEDICAL: #Paediatrics #MSFclinic #UKDoctor 
🔬HEALTH: #Epidemiologist #HealthSurveillanceSystem #Malaria #Ebola #Measles #Diphtheria #Zoology
🚑FIELDS: #Bangladesh #Congo(DRC) #Ethiopia #Iraq #Niger #SouthSudan #Sudan #Syria #Venezuela https://t.co/5iOyW9Itgd",,2,0,1,1181933186550566913,"[{'domain': {'id': '30', 'name': 'Entities [Entity Service]', 'description': 'Entity Service top level domain, every item that is in Entity Service should be in this domain'}, 'entity': {'id': '854692455005921281', 'name': 'Science', 'description': 'Science'}}, {'domain': {'id': '30', 'name': 'Entities [Entity Service]', 'description': 'Entity Service top level domain, every item that is in Entity Service should be in this domain'}, 'entity': {'id': '847896837532995585', 'name': 'Biology', 'description': 'Biology'}}, {'domain': {'id': '30', 'name': 'Entities [Entity Service]', 'description': 'Entity Service top level domain, every item that is in Entity Service should be in this domain'}, 'entity': {'id': '1354786660328693765', 'name': 'Zoology'}}, {'domain': {'id': '164', 'name': 'Fields of study', 'description': 'for all fields of study, e.g., futurology, microbiology '}, 'entity': {'id': '854692455005921281', 'name': 'Science', 'description': 'Science'}}]"
2022-05-07 10:30:00+00:00,1522886460797448193,Third Ebola patient dies in northwest Democratic Republic of Congo. https://t.co/giylIxNA1h https://t.co/iUt8mIlrxz,,11,0,13,25387183,"[{'domain': {'id': '46', 'name': 'Brand Category', 'description': 'Categories within Brand Verticals that narrow down the scope of Brands'}, 'entity': {'id': '781974596157181956', 'name': 'Online Site'}}, {'domain': {'id': '47', 'name': 'Brand', 'description': 'Brands and Companies'}, 'entity': {'id': '10047963346', 'name': 'Reuters', 'description': 'Reuters'}}]"
2022-05-07 10:23:27+00:00,1522884812188663809,"That is not at all new.

Not to call you crazy but you're crazy. It aint so terrible, we're all crazy and only notice whaat we're primed to notice. But I can assure you that these trails, whenever they are made of - ice crystals or ebola - have been around for years. https://t.co/31hWhgIJnr",,2,0,1,1521449320406470658,[]
2022-05-07 10:11:41+00:00,1522881850481463297,"Dr. Muyembe reassured people in the #DRC that the Ebola pandemic is no longer a threat because the country now has an Ebola vaccine and medicines.

https://t.co/78Z6U69vG9",,1,0,1,760945459141701632,"[{'domain': {'id': '123', 'name': 'Ongoing News Story', 'description': ""Ongoing News Stories like 'Brexit'""}, 'entity': {'id': '1220701888179359745', 'name': 'COVID-19'}}]"
2022-05-07 10:00:11+00:00,1522878955182776320,"Over the past four years the Democratic Republic of Congo has gone through a change in political power, an outbreak of Ebola and continuous fighting between rebel groups. Click to read about some of Team Hope’s work there. https://t.co/AtofGPfeTI https://t.co/JnFO8eorU8",,0,0,0,808751629,[]
2022-05-07 09:54:34+00:00,1522877541706575872,Third Ebola patient dies in northwest Democratic Republic of Congo https://t.co/lrj8u3uAIQ,,0,0,0,854313612915097600,[]
2022-05-07 09:47:09+00:00,1522875674196856832,AIDS H1N1 Ebola Zika Koveds 2 Weeks Lockdowns Censorship Dashboards BLM Face Nappies PCR Work From Home Granny Jabs QR Codes Restrictions Bariants Suez CRT Booster Genders Booster VAIDS YouKrane Gas Fuel Heating Inflation Sudden Death Abortion Vasectomy What’s up next any guess?,,1,0,1,24513229,"[{'domain': {'id': '66', 'name': 'Interests and Hobbies Category', 'description': 'A grouping of interests and hobbies entities, like Novelty Food or Destinations'}, 'entity': {'id': '1237833500474003461', 'name': 'Remote work'}}, {'domain': {'id': '67', 'name': 'Interests and Hobbies', 'description': 'Interests, opinions, and behaviors of individuals, groups, or cultures; like Speciality Cooking or Theme Parks'}, 'entity': {'id': '1486458201117642754', 'name': 'Inflation'}}, {'domain': {'id': '123', 'name': 'Ongoing News Story', 'description': ""Ongoing News Stories like 'Brexit'""}, 'entity': {'id': '1220701888179359745', 'name': 'COVID-19'}}]"
2022-05-07 09:34:43+00:00,1522872546546184192,"As the world spirals toward chaos, Amy Cooper fights to stop the evolution of a deadly virus. When her beliefs disagree with the Administration’s agenda, she is put on trial. #virus #ebola #coronavirus #religion #persecution Midnight Hour: https://t.co/pRdHFd6wuE",,1,0,1,195016054,"[{'domain': {'id': '123', 'name': 'Ongoing News Story', 'description': ""Ongoing News Stories like 'Brexit'""}, 'entity': {'id': '1220701888179359745', 'name': 'COVID-19'}}, {'domain': {'id': '29', 'name': 'Events [Entity Service]', 'description': 'Entity Service related Events domain'}, 'entity': {'id': '1219057585707315201', 'name': 'COVID-19: Latest news updates from around the world', 'description': 'This page is a timeline of Tweets with the latest information and updates on COVID-19 from experts, journalists, health authorities and other trusted sources from around the world. For more on COVID-19, visit: twitter.com/explore/tabs/covid-19'}}]"
2022-05-07 09:22:34+00:00,1522869489976676353,"for some reason, everyone forgot about Covid-19, attention is focused on Ukraine and @Spacex, and in Africa, the Ebola virus has returned again, what would it be for🧐",,0,0,0,1496735736963424258,"[{'domain': {'id': '46', 'name': 'Brand Category', 'description': 'Categories within Brand Verticals that narrow down the scope of Brands'}, 'entity': {'id': '872801340224806912', 'name': 'Aerospace', 'description': 'Aerospace'}}, {'domain': {'id': '47', 'name': 'Brand', 'description': 'Brands and Companies'}, 'entity': {'id': '872801738394279936', 'name': 'SpaceX', 'description': 'SpaceX'}}, {'domain': {'id': '30', 'name': 'Entities [Entity Service]', 'description': 'Entity Service top level domain, every item that is in Entity Service should be in this domain'}, 'entity': {'id': '854692455005921281', 'name': 'Science', 'description': 'Science'}}, {'domain': {'id': '66', 'name': 'Interests and Hobbies Category', 'description': 'A grouping of interests and hobbies entities, like Novelty Food or Destinations'}, 'entity': {'id': '847899255880564736', 'name': 'Space', 'description': 'Space and astronomy'}}, {'domain': {'id': '123', 'name': 'Ongoing News Story', 'description': ""Ongoing News Stories like 'Brexit'""}, 'entity': {'id': '1220701888179359745', 'name': 'COVID-19'}}, {'domain': {'id': '123', 'name': 'Ongoing News Story', 'description': ""Ongoing News Stories like 'Brexit'""}, 'entity': {'id': '1484601166080081920', 'name': 'Russo-Ukrainian conflict'}}, {'domain': {'id': '164', 'name': 'Fields of study', 'description': 'for all fields of study, e.g., futurology, microbiology '}, 'entity': {'id': '854692455005921281', 'name': 'Science', 'description': 'Science'}}, {'domain': {'id': '29', 'name': 'Events [Entity Service]', 'description': 'Entity Service related Events domain'}, 'entity': {'id': '1219057585707315201', 'name': 'COVID-19: Latest news updates from around the world', 'description': 'This page is a timeline of Tweets with the latest information and updates on COVID-19 from experts, journalists, health authorities and other trusted sources from around the world. For more on COVID-19, visit: twitter.com/explore/tabs/covid-19'}}]"
2022-05-07 09:22:27+00:00,1522869460444581888,Third Ebola patient dies in northwest Democratic Republic of Congo https://t.co/4myFCYknKP,,0,0,0,347990355,[]
2022-05-07 09:16:19+00:00,1522867916051415040,There's a surplus of Pepsi amid the Ebola pandemic,,0,0,0,1307842037253918721,"[{'domain': {'id': '45', 'name': 'Brand Vertical', 'description': 'Top level entities that describe a Brands industry'}, 'entity': {'id': '781974596740190208', 'name': 'CPG'}}, {'domain': {'id': '46', 'name': 'Brand Category', 'description': 'Categories within Brand Verticals that narrow down the scope of Brands'}, 'entity': {'id': '781974596656304128', 'name': 'Beverage'}}, {'domain': {'id': '47', 'name': 'Brand', 'description': 'Brands and Companies'}, 'entity': {'id': '10026288001', 'name': 'Pepsi'}}, {'domain': {'id': '30', 'name': 'Entities [Entity Service]', 'description': 'Entity Service top level domain, every item that is in Entity Service should be in this domain'}, 'entity': {'id': '825047692124442624', 'name': 'Food', 'description': 'Food'}}, {'domain': {'id': '67', 'name': 'Interests and Hobbies', 'description': 'Interests, opinions, and behaviors of individuals, groups, or cultures; like Speciality Cooking or Theme Parks'}, 'entity': {'id': '850143755873140737', 'name': 'Soda', 'description': 'Soda'}}, {'domain': {'id': '123', 'name': 'Ongoing News Story', 'description': ""Ongoing News Stories like 'Brexit'""}, 'entity': {'id': '1220701888179359745', 'name': 'COVID-19'}}]"
2022-05-07 09:13:00+00:00,1522867082433822720,"Stop #coronavirus RT!

Call for the resignation of Tedros Adhanom Ghebreyesus, #WHO Director General
⬇⬇✒
https://t.co/NkaCorRIb5

#coronaviruschina #Pndahugger

#coronachan #corona_chan #コロナちゃん #コロナウィルスちゃん #Ebola #ebolachan #エボラちゃん
https://t.co/aH7GNGE3rw",,0,0,0,331916700,"[{'domain': {'id': '123', 'name': 'Ongoing News Story', 'description': ""Ongoing News Stories like 'Brexit'""}, 'entity': {'id': '1220701888179359745', 'name': 'COVID-19'}}]"
2022-05-07 09:00:10+00:00,1522863852496564226,"Ebola came from bats, this also, with one step in between came across from bats,"" said @BillGates. https://t.co/O8NIPbYq0L",,8,2,7,1316523898989617153,"[{'domain': {'id': '10', 'name': 'Person', 'description': 'Named people in the world like Nelson Mandela'}, 'entity': {'id': '806574543888232448', 'name': 'Bill Gates', 'description': 'Bill Gates'}}, {'domain': {'id': '65', 'name': 'Interests and Hobbies Vertical', 'description': 'Top level interests and hobbies groupings, like Food or Travel'}, 'entity': {'id': '781974596148793345', 'name': 'Business & finance'}}, {'domain': {'id': '65', 'name': 'Interests and Hobbies Vertical', 'description': 'Top level interests and hobbies groupings, like Food or Travel'}, 'entity': {'id': '781974596148793345', 'name': 'Business & finance'}}, {'domain': {'id': '30', 'name': 'Entities [Entity Service]', 'description': 'Entity Service top level domain, every item that is in Entity Service should be in this domain'}, 'entity': {'id': '857879456773357569', 'name': 'Technology', 'description': 'Technology'}}]"
2022-05-07 08:48:33+00:00,1522860927514685442,my arm itches I think i have Ebola,,0,0,0,2747394897,[]
2022-05-07 08:45:21+00:00,1522860122954948608,"The third ebola patient in northwest Democratic Republic of Congo has died, the World Health Organization (WHO) said on Friday,  becoming the first fatality in an outbreak first reported last month. #news @LivePretoria https://t.co/YFC4L1CF9n",,0,0,0,1189409898754387969,[]
2022-05-07 08:34:59+00:00,1522857513036972032,Third Ebola patient dies in northwest Democratic Republic of Congo https://t.co/FNxzpORvqx,,0,0,0,1506833330683400200,[]
2022-05-07 08:32:59+00:00,1522857009556635649,"SAY IT WITH ME 
REMDESIVIR -FAILED EBOLA STUDY MONTHS PRIOR TO COVID RELEASED
MY KILLED 37% WITHIN 10 DAYS OF ALL PATIENTS! 
ONLY COUNTRY TO PRESCRIBE THIS THE COVID AGAINST WHO ORDERS KING
FAUCCI https://t.co/SJakfeSh2p",,0,0,0,1513283879322501128,"[{'domain': {'id': '123', 'name': 'Ongoing News Story', 'description': ""Ongoing News Stories like 'Brexit'""}, 'entity': {'id': '1220701888179359745', 'name': 'COVID-19'}}, {'domain': {'id': '29', 'name': 'Events [Entity Service]', 'description': 'Entity Service related Events domain'}, 'entity': {'id': '1219057585707315201', 'name': 'COVID-19: Latest news updates from around the world', 'description': 'This page is a timeline of Tweets with the latest information and updates on COVID-19 from experts, journalists, health authorities and other trusted sources from around the world. For more on COVID-19, visit: twitter.com/explore/tabs/covid-19'}}]"
2022-05-07 08:25:28+00:00,1522855118504443905,Third Ebola patient dies in northwest Democratic Republic of Congo https://t.co/bYkPpZmehj,,0,0,0,1052470995456471040,[]
2022-05-07 08:25:26+00:00,1522855112955338753,Third Ebola patient dies in northwest Democratic Republic of Congo https://t.co/iIyOvbQXHE,,0,0,0,1328609899211796480,[]
2022-05-07 08:25:25+00:00,1522855105921495040,Third Ebola patient dies in northwest Democratic Republic of Congo https://t.co/bwmyw8efSG,,0,0,0,3374384854,[]
2022-05-07 08:25:23+00:00,1522855100070387712,Third Ebola patient dies in northwest Democratic Republic of Congo https://t.co/8Zjp0fxbne,,0,0,0,715335430149967879,[]
2022-05-07 08:18:25+00:00,1522853345400176640,"Third case of #Ebola detected in northwestern #DRC, #WHO says - CNN https://t.co/E4kmiKQ2Z7",,0,0,0,3444025579,"[{'domain': {'id': '45', 'name': 'Brand Vertical', 'description': 'Top level entities that describe a Brands industry'}, 'entity': {'id': '781974597310615553', 'name': 'Entertainment'}}, {'domain': {'id': '46', 'name': 'Brand Category', 'description': 'Categories within Brand Verticals that narrow down the scope of Brands'}, 'entity': {'id': '781974596157181956', 'name': 'Online Site'}}, {'domain': {'id': '46', 'name': 'Brand Category', 'description': 'Categories within Brand Verticals that narrow down the scope of Brands'}, 'entity': {'id': '781974597105094656', 'name': 'TV/Movies Related'}}, {'domain': {'id': '47', 'name': 'Brand', 'description': 'Brands and Companies'}, 'entity': {'id': '10040667043', 'name': 'CNN'}}]"
2022-05-07 08:16:59+00:00,1522852983502950401,"You forgot to mention 9/11, mad cow disease, bird flu, swine flu, Ebola and Covid19. https://t.co/06DgmytUF8",,4,1,4,1921215018,"[{'domain': {'id': '123', 'name': 'Ongoing News Story', 'description': ""Ongoing News Stories like 'Brexit'""}, 'entity': {'id': '1220701888179359745', 'name': 'COVID-19'}}]"
2022-05-07 08:14:14+00:00,1522852293607100417,"Here is a link to a recent paper on filoviruses (ebola family) in bats in Hungary, with experiments in a BSL4/P4 at Univ. of Pecs:
https://t.co/4S6p3vAGZp https://t.co/UNejY40q1b",,0,2,2,892417074642997248,[]
2022-05-07 08:10:25+00:00,1522851332813574144,"Remember nursing is a sacrificial profession under rain, sun, covid, ebola and Ukraine war, hospitals across the world must function unfortunately. Just take it one patient at a time and never forget to ask for help as it's team work. Happy nurses week. https://t.co/gjh012EESc",,0,0,1,1249319556243308545,"[{'domain': {'id': '123', 'name': 'Ongoing News Story', 'description': ""Ongoing News Stories like 'Brexit'""}, 'entity': {'id': '1220701888179359745', 'name': 'COVID-19'}}, {'domain': {'id': '123', 'name': 'Ongoing News Story', 'description': ""Ongoing News Stories like 'Brexit'""}, 'entity': {'id': '1484601166080081920', 'name': 'Russo-Ukrainian conflict'}}]"
2022-05-07 08:06:10+00:00,1522850263081574400,The Ebola virus kills 4 out of every 5 humans it infects.,,0,0,0,1128063316511866881,[]
2022-05-07 08:04:33+00:00,1522849857165160449,WHO Confirms Death of 3rd Ebola Patient in DR Congo https://t.co/rmhypl8Wwd,,0,0,0,476667223,[]
2022-05-07 07:42:43+00:00,1522844361410723840,DR Congo confirms third case of Ebola https://t.co/VX1U03JVK0,,0,0,0,3130656076,[]
2022-05-07 07:38:22+00:00,1522843265602813952,"NEVER FORGET!
Then Morrison and DUTTON criticise the Qld government for BUILDING ONE!
Something THE FEDERAL GOVERNMENT was responsible for!
If EBOLA or a DEADLIER COVID variant arrives to our doorstep WE NEED THESE!
THINK IT WONT HAPPEN??
THINK AGAIN! https://t.co/Vvyp4Y4i6a",,6,0,5,1420889966037532675,"[{'domain': {'id': '123', 'name': 'Ongoing News Story', 'description': ""Ongoing News Stories like 'Brexit'""}, 'entity': {'id': '1220701888179359745', 'name': 'COVID-19'}}]"
2022-05-07 07:24:58+00:00,1522839893915074560,"Can you imagine an Australia with HIM as PM, and EBOLA sitting on our doorstep?
Sleep well! https://t.co/j2H5mv854j",,9,3,24,1420889966037532675,[]
2022-05-07 07:02:17+00:00,1522834184544346114,"""Bird flu"", ""swine flu"", ""mad cow disease"", all for the purpose of destroying food for humans + ""vaccination"" - ""depopulation"", ie.  genocide against humanity.  HIV, Ebola, etc. They do it all on purpose.",,7,1,21,710569211899351041,"[{'domain': {'id': '123', 'name': 'Ongoing News Story', 'description': ""Ongoing News Stories like 'Brexit'""}, 'entity': {'id': '1220701888179359745', 'name': 'COVID-19'}}]"
2022-05-07 06:54:35+00:00,1522832246541271040,"My fafther broke his arm byu [playing Star Fox Zero, For The Nintendo Wii U. the controls gave my wife Ebola",,0,0,0,3165276322,"[{'domain': {'id': '45', 'name': 'Brand Vertical', 'description': 'Top level entities that describe a Brands industry'}, 'entity': {'id': '781974597310615553', 'name': 'Entertainment'}}, {'domain': {'id': '46', 'name': 'Brand Category', 'description': 'Categories within Brand Verticals that narrow down the scope of Brands'}, 'entity': {'id': '781974597218340864', 'name': 'Video Games'}}, {'domain': {'id': '47', 'name': 'Brand', 'description': 'Brands and Companies'}, 'entity': {'id': '10026713294', 'name': 'Nintendo'}}, {'domain': {'id': '78', 'name': 'Video Game Publisher', 'description': ""A Video Game Publisher like 'Activision'""}, 'entity': {'id': '10026713294', 'name': 'Nintendo'}}, {'domain': {'id': '79', 'name': 'Video Game Hardware', 'description': 'Video Game Hardware'}, 'entity': {'id': '10024011469', 'name': 'Nintendo Wii'}}]"
2022-05-07 06:48:39+00:00,1522830753758908418,"Third Ebola case confirmed in northwest #Congo, WHO says https://t.co/0hyn9aQCpS",,0,0,0,991891092,[]
2022-05-07 06:31:39+00:00,1522826475812302850,"Ebola virus (#EBOV) is a hemorrhagic virus endemic to Africa, which can spread rapidly in populated areas and has a high rate of fatality into the dangerous disease.",,0,0,0,1385202923261497348,[]
2022-05-07 06:26:48+00:00,1522825254288064512,DR Congo confirms third case of Ebola https://t.co/gxivYiGC00 https://t.co/iMyrRcJhmi,,0,0,0,821195870,[]
