Datetime,Tweet Id,original_text,geo,retweet_count,reply_count,like_count,author_id,context_annotations
2022-08-07 06:07:44+00:00,1556160143393296385,"""The Nipah virus has a lethality of more than 60%, more than that of Ebola, although it’s less transmissible than the latter virus since it isn’t airborne, the expert said at the hearing. The Nipah virus is also about 60 times deadlier than COVID-19.""
https://t.co/xLC6OjeQtb",,0,0,0,1524991048329662465,"[{'domain': {'id': '123', 'name': 'Ongoing News Story', 'description': ""Ongoing News Stories like 'Brexit'""}, 'entity': {'id': '1220701888179359745', 'name': 'COVID-19'}}, {'domain': {'id': '131', 'name': 'Unified Twitter Taxonomy', 'description': 'A taxonomy view into the Semantic Core knowledge graph'}, 'entity': {'id': '1220701888179359745', 'name': 'COVID-19'}}, {'domain': {'id': '29', 'name': 'Events [Entity Service]', 'description': 'Entity Service related Events domain'}, 'entity': {'id': '1219057585707315201', 'name': 'COVID-19: Latest news updates from around the world', 'description': 'This page is a timeline of Tweets with the latest information and updates on COVID-19 from experts, journalists, health authorities and other trusted sources from around the world. For more on COVID-19, visit: twitter.com/explore/tabs/covid-19'}}]"
2022-08-07 06:00:08+00:00,1556158230266511361,"So, like, actually it is 3 because of a new cousin of Ebola. https://t.co/ijFc8mYz4J",,0,1,2,294420379,[]
2022-08-07 05:49:16+00:00,1556155493038817281,tbh ebola is probably just another mononoke,,0,0,0,2864407958,[]
2022-08-07 05:43:37+00:00,1556154073845342208,Did you know that pigeons are the main cause of Stroke? Virus experts from all across India agreed that in 2019 pigeons came first in the cause of the condition that led to Ebola virus disease,,0,0,0,1093043265526411265,[]
2022-08-07 05:40:24+00:00,1556153263430549507,W.H.O. &amp; U.N. exposed in the Congo sex abuse Ebola crisis scandal https://t.co/86KVp8NjxU,,0,0,0,748117585770622976,[]
2022-08-07 05:40:24+00:00,1556153262193115136,W.H.O. &amp; U.N. exposed in the Congo sex abuse Ebola crisis scandal https://t.co/O44VKT4hvw,,0,0,1,884260730559754240,[]
2022-08-07 05:40:24+00:00,1556153261975130112,W.H.O. &amp; U.N. exposed in the Congo sex abuse Ebola crisis scandal https://t.co/WTFD87ce4n,,0,0,0,1467955288737296388,[]
2022-08-07 05:40:24+00:00,1556153261924777987,W.H.O. &amp; U.N. exposed in the Congo sex abuse Ebola crisis scandal https://t.co/DcsI85bjqY,,0,0,0,169199327,[]
2022-08-07 05:40:24+00:00,1556153261895426048,W.H.O. &amp; U.N. exposed in the Congo sex abuse Ebola crisis scandal https://t.co/IF32w6cJds,,0,0,0,1114196340362436609,[]
2022-08-07 05:40:23+00:00,1556153260611870720,W.H.O. &amp; U.N. exposed in the Congo sex abuse Ebola crisis scandal https://t.co/k0j7xwaeiv,,0,0,0,1467959277662920706,[]
2022-08-07 05:40:23+00:00,1556153260402155520,W.H.O. &amp; U.N. exposed in the Congo sex abuse Ebola crisis scandal https://t.co/Ydy2J0uNaD,,0,0,2,1135428483721629696,[]
2022-08-07 05:34:27+00:00,1556151763723599872,"Fauci and Other Health ‘experts’ are Messing Up Monkeypox Just as They Did COVID, Ebola and AIDS; Americans Lost Fundamental Freedoms During Covid — But Halting Gay Orgies To Stop Monkeypox Is Too Far? and other C-Virus related stories  https://t.co/StBGlMPPfv",,3,0,6,220797812,[]
2022-08-07 04:49:32+00:00,1556140462129287169,"Dude, you scared the shit out of me! When you say contamination, I mean, I'm thinkin' like, uh, like an ebola leak, or something.",,0,0,0,1549779300894793729,[]
2022-08-07 04:46:18+00:00,1556139650124615681,"Absolutly true
Fauci and other health 'experts' are messing up monkeypox just as they did COVID, Ebola and AIDS https://t.co/mq05FSpPEU via @nypost",,0,0,0,1519765416049922049,"[{'domain': {'id': '47', 'name': 'Brand', 'description': 'Brands and Companies'}, 'entity': {'id': '1065654169002885120', 'name': 'New York Post', 'description': 'New York Post'}}, {'domain': {'id': '123', 'name': 'Ongoing News Story', 'description': ""Ongoing News Stories like 'Brexit'""}, 'entity': {'id': '1220701888179359745', 'name': 'COVID-19'}}, {'domain': {'id': '131', 'name': 'Unified Twitter Taxonomy', 'description': 'A taxonomy view into the Semantic Core knowledge graph'}, 'entity': {'id': '1065654169002885120', 'name': 'New York Post', 'description': 'New York Post'}}, {'domain': {'id': '131', 'name': 'Unified Twitter Taxonomy', 'description': 'A taxonomy view into the Semantic Core knowledge graph'}, 'entity': {'id': '1196447117297905665', 'name': 'News outlets'}}, {'domain': {'id': '131', 'name': 'Unified Twitter Taxonomy', 'description': 'A taxonomy view into the Semantic Core knowledge graph'}, 'entity': {'id': '1220701888179359745', 'name': 'COVID-19'}}, {'domain': {'id': '29', 'name': 'Events [Entity Service]', 'description': 'Entity Service related Events domain'}, 'entity': {'id': '1219057585707315201', 'name': 'COVID-19: Latest news updates from around the world', 'description': 'This page is a timeline of Tweets with the latest information and updates on COVID-19 from experts, journalists, health authorities and other trusted sources from around the world. For more on COVID-19, visit: twitter.com/explore/tabs/covid-19'}}]"
2022-08-07 04:38:01+00:00,1556137564909629441,"Just for education I decided to see if ebola could be spread by airborne transmission. 

Sigh.  I should have not looked that up. 

BTW- CIDRAP does not seem to have been infected by the “everything is mild” virus going on out there.  

https://t.co/vaXb3Rg99Z https://t.co/PmhRbotQmM",,0,0,0,36507186,[]
2022-08-07 04:31:12+00:00,1556135849842155520,Ebola is in Dallas? At least the Dallas Cowboys don't have to worry about it. They can't catch anything.,,0,0,2,410667722,"[{'domain': {'id': '3', 'name': 'TV Shows', 'description': 'Television shows from around the world'}, 'entity': {'id': '10000612773', 'name': 'NFL Football', 'description': 'Football action from around the National Football League.'}}, {'domain': {'id': '3', 'name': 'TV Shows', 'description': 'Television shows from around the world'}, 'entity': {'id': '10033407327', 'name': 'Futebol NFL'}}, {'domain': {'id': '3', 'name': 'TV Shows', 'description': 'Television shows from around the world'}, 'entity': {'id': '10042261464', 'name': 'Fútbol Americano de la NFL'}}, {'domain': {'id': '11', 'name': 'Sport', 'description': 'Types of sports, like soccer and basketball'}, 'entity': {'id': '689566306014617600', 'name': 'American football'}}, {'domain': {'id': '12', 'name': 'Sports Team', 'description': 'A sports team organization, like Arsenal and the Boston Celtics'}, 'entity': {'id': '689566298049683458', 'name': 'Dallas Cowboys'}}, {'domain': {'id': '26', 'name': 'Sports League', 'description': ''}, 'entity': {'id': '689566314835259392', 'name': 'NFL'}}, {'domain': {'id': '131', 'name': 'Unified Twitter Taxonomy', 'description': 'A taxonomy view into the Semantic Core knowledge graph'}, 'entity': {'id': '689566298049683458', 'name': 'Dallas Cowboys'}}, {'domain': {'id': '131', 'name': 'Unified Twitter Taxonomy', 'description': 'A taxonomy view into the Semantic Core knowledge graph'}, 'entity': {'id': '689566306014617600', 'name': 'American football'}}, {'domain': {'id': '131', 'name': 'Unified Twitter Taxonomy', 'description': 'A taxonomy view into the Semantic Core knowledge graph'}, 'entity': {'id': '689566314835259392', 'name': 'NFL'}}, {'domain': {'id': '131', 'name': 'Unified Twitter Taxonomy', 'description': 'A taxonomy view into the Semantic Core knowledge graph'}, 'entity': {'id': '847900493514891265', 'name': 'Sports', 'description': 'Sports'}}]"
2022-08-07 04:27:12+00:00,1556134842504515584,"Dr Fauci and other health 'experts' are messing up monkeypox just as they did COVID, Ebola and AIDS by causing a pandemic crisis and now we have this Monkeypox outbreak which is caused by bisexual gay mem in United States of America https://t.co/HBbtbnNPdl via @nypost",,0,0,0,1550680494949507072,"[{'domain': {'id': '47', 'name': 'Brand', 'description': 'Brands and Companies'}, 'entity': {'id': '1065654169002885120', 'name': 'New York Post', 'description': 'New York Post'}}, {'domain': {'id': '123', 'name': 'Ongoing News Story', 'description': ""Ongoing News Stories like 'Brexit'""}, 'entity': {'id': '1220701888179359745', 'name': 'COVID-19'}}, {'domain': {'id': '131', 'name': 'Unified Twitter Taxonomy', 'description': 'A taxonomy view into the Semantic Core knowledge graph'}, 'entity': {'id': '1065654169002885120', 'name': 'New York Post', 'description': 'New York Post'}}, {'domain': {'id': '131', 'name': 'Unified Twitter Taxonomy', 'description': 'A taxonomy view into the Semantic Core knowledge graph'}, 'entity': {'id': '1196447117297905665', 'name': 'News outlets'}}, {'domain': {'id': '131', 'name': 'Unified Twitter Taxonomy', 'description': 'A taxonomy view into the Semantic Core knowledge graph'}, 'entity': {'id': '1220701888179359745', 'name': 'COVID-19'}}, {'domain': {'id': '29', 'name': 'Events [Entity Service]', 'description': 'Entity Service related Events domain'}, 'entity': {'id': '1219057585707315201', 'name': 'COVID-19: Latest news updates from around the world', 'description': 'This page is a timeline of Tweets with the latest information and updates on COVID-19 from experts, journalists, health authorities and other trusted sources from around the world. For more on COVID-19, visit: twitter.com/explore/tabs/covid-19'}}]"
2022-08-07 04:26:48+00:00,1556134742034067456,"Experimental Vaxx Rollout Of The Flu, Monkeypox, And Ebola Set To Deploy https://t.co/TLsfu0xeK1",,0,0,0,1050379118351593473,[]
2022-08-07 04:25:45+00:00,1556134477587431424,10 Places to Hide From the Flesh-Eating #Ebola Plague https://t.co/a85M6t9lyw #theebolaepidemic,,0,0,0,2600774869,[]
2022-08-07 04:19:14+00:00,1556132834733363200,How to give Vanitas Drop kicking ebola,,0,0,0,2806258580,[]
2022-08-07 04:16:00+00:00,1556132024456425474,"Covid couldn’t have come from nature…

I’m wondering if the same reckless gain of function virologists who created this also created the Black Death (1340s), the Justinian Plague (c 540), the Antonine Plague (165), the 1976 Ebola outbreak in Sudan, and the Spanish Flu of 1918? https://t.co/HEPVjFOK0N",,0,4,27,16292216,"[{'domain': {'id': '123', 'name': 'Ongoing News Story', 'description': ""Ongoing News Stories like 'Brexit'""}, 'entity': {'id': '1220701888179359745', 'name': 'COVID-19'}}, {'domain': {'id': '131', 'name': 'Unified Twitter Taxonomy', 'description': 'A taxonomy view into the Semantic Core knowledge graph'}, 'entity': {'id': '1220701888179359745', 'name': 'COVID-19'}}, {'domain': {'id': '29', 'name': 'Events [Entity Service]', 'description': 'Entity Service related Events domain'}, 'entity': {'id': '1219057585707315201', 'name': 'COVID-19: Latest news updates from around the world', 'description': 'This page is a timeline of Tweets with the latest information and updates on COVID-19 from experts, journalists, health authorities and other trusted sources from around the world. For more on COVID-19, visit: twitter.com/explore/tabs/covid-19'}}]"
2022-08-07 03:49:04+00:00,1556125246540771328,How to spread ebola to Vanitas,,0,0,0,2806258580,[]
2022-08-07 03:40:20+00:00,1556123045655326723,The GOP would purposely contract Ebola to own the libs if the Dems came out against it,,0,2,17,173571258,[]
2022-08-07 03:03:25+00:00,1556113757776089088,is it the ebola https://t.co/IITm8qOjVP,,0,0,0,1546280488045789184,[]
2022-08-07 03:00:00+00:00,1556112896874070017,"Fauci messing up monkeypox just like COVID, Ebola and AIDS 
https://t.co/z0R3g5fth0",,0,0,0,44357949,"[{'domain': {'id': '123', 'name': 'Ongoing News Story', 'description': ""Ongoing News Stories like 'Brexit'""}, 'entity': {'id': '1220701888179359745', 'name': 'COVID-19'}}, {'domain': {'id': '131', 'name': 'Unified Twitter Taxonomy', 'description': 'A taxonomy view into the Semantic Core knowledge graph'}, 'entity': {'id': '1220701888179359745', 'name': 'COVID-19'}}]"
2022-08-07 02:18:27+00:00,1556102441204125698,mfs told me i was a genetic mutation of ebola &amp; everybody should be cautious i still ain’t revover https://t.co/rNw8cOwyHD,,0,0,5,709711392,"[{'domain': {'id': '65', 'name': 'Interests and Hobbies Vertical', 'description': 'Top level interests and hobbies groupings, like Food or Travel'}, 'entity': {'id': '864925500627484672', 'name': 'Family and life stages', 'description': 'Family and Life Stages'}}, {'domain': {'id': '66', 'name': 'Interests and Hobbies Category', 'description': 'A grouping of interests and hobbies entities, like Novelty Food or Destinations'}, 'entity': {'id': '864926035569135616', 'name': 'Parenting K-6 kids', 'description': 'Parenting K-6 kids'}}]"
2022-08-07 02:16:45+00:00,1556102012944601088,There's a bountiful of Sprite amid the Ebola pandemic,,0,0,0,1307842037253918721,"[{'domain': {'id': '45', 'name': 'Brand Vertical', 'description': 'Top level entities that describe a Brands industry'}, 'entity': {'id': '781974596740190208', 'name': 'CPG'}}, {'domain': {'id': '46', 'name': 'Brand Category', 'description': 'Categories within Brand Verticals that narrow down the scope of Brands'}, 'entity': {'id': '781974596656304128', 'name': 'Beverage'}}, {'domain': {'id': '47', 'name': 'Brand', 'description': 'Brands and Companies'}, 'entity': {'id': '10026302007', 'name': 'Sprite'}}, {'domain': {'id': '65', 'name': 'Interests and Hobbies Vertical', 'description': 'Top level interests and hobbies groupings, like Food or Travel'}, 'entity': {'id': '834828264786898945', 'name': 'Drinks', 'description': 'Drinks'}}, {'domain': {'id': '66', 'name': 'Interests and Hobbies Category', 'description': 'A grouping of interests and hobbies entities, like Novelty Food or Destinations'}, 'entity': {'id': '834828445238431744', 'name': 'Generic Drinks', 'description': 'Generic Drinks'}}, {'domain': {'id': '67', 'name': 'Interests and Hobbies', 'description': 'Interests, opinions, and behaviors of individuals, groups, or cultures; like Speciality Cooking or Theme Parks'}, 'entity': {'id': '850143755873140737', 'name': 'Soda', 'description': 'Soda'}}, {'domain': {'id': '123', 'name': 'Ongoing News Story', 'description': ""Ongoing News Stories like 'Brexit'""}, 'entity': {'id': '1220701888179359745', 'name': 'COVID-19'}}, {'domain': {'id': '131', 'name': 'Unified Twitter Taxonomy', 'description': 'A taxonomy view into the Semantic Core knowledge graph'}, 'entity': {'id': '1220701888179359745', 'name': 'COVID-19'}}, {'domain': {'id': '45', 'name': 'Brand Vertical', 'description': 'Top level entities that describe a Brands industry'}, 'entity': {'id': '781974596740190208', 'name': 'CPG'}}, {'domain': {'id': '46', 'name': 'Brand Category', 'description': 'Categories within Brand Verticals that narrow down the scope of Brands'}, 'entity': {'id': '781974596656304128', 'name': 'Beverage'}}, {'domain': {'id': '47', 'name': 'Brand', 'description': 'Brands and Companies'}, 'entity': {'id': '10026302007', 'name': 'Sprite'}}, {'domain': {'id': '131', 'name': 'Unified Twitter Taxonomy', 'description': 'A taxonomy view into the Semantic Core knowledge graph'}, 'entity': {'id': '10026302007', 'name': 'Sprite'}}]"
2022-08-07 02:05:11+00:00,1556099103649476608,"Experimental Vaxx Rollout Of The Flu, Monkeypox, And Ebola Set To Deploy – Stew Peters https://t.co/kSX9CIVTVh",,0,0,0,1366459003916722185,[]
2022-08-07 02:01:43+00:00,1556098230307328001,"How many more pandemics before #BlueMAGA / #BlueNovember realize all the Democrats care about is increasing bottom lines for the wealthy elite, i.e., themselves? And do you think Ebola would do it? Cholera? Plague?",,4,7,18,1493454375024398340,[]
2022-08-07 01:55:44+00:00,1556096723533336576,You can kill the Ebola virus before it enters your system by simply following these few steps. https://t.co/akmc2lGGTL #Ebola PennNewsFile,,0,0,0,2824585513,[]
2022-08-07 01:54:52+00:00,1556096504485625857,"Imagine Pandemic with a 90% fatality rate &amp; 90% infection rate.

Ebola in Africa kills 90% of the ppl it infects… you could tweak it and make it highly infectious or airborne.

That’s just one way the world ends. 

I think private island sounds nice 😊",,0,0,0,351459148,"[{'domain': {'id': '123', 'name': 'Ongoing News Story', 'description': ""Ongoing News Stories like 'Brexit'""}, 'entity': {'id': '1220701888179359745', 'name': 'COVID-19'}}, {'domain': {'id': '131', 'name': 'Unified Twitter Taxonomy', 'description': 'A taxonomy view into the Semantic Core knowledge graph'}, 'entity': {'id': '1220701888179359745', 'name': 'COVID-19'}}]"
2022-08-07 01:45:06+00:00,1556094047126802433,"I am happy to give the antidoth to your diseases ebola and coronavirus, hope you contributed thything is collected in my offer, yes human what did you giveth the son alien prince written to enter enternal life....",,0,0,0,1553720038661693442,"[{'domain': {'id': '123', 'name': 'Ongoing News Story', 'description': ""Ongoing News Stories like 'Brexit'""}, 'entity': {'id': '1220701888179359745', 'name': 'COVID-19'}}, {'domain': {'id': '131', 'name': 'Unified Twitter Taxonomy', 'description': 'A taxonomy view into the Semantic Core knowledge graph'}, 'entity': {'id': '1220701888179359745', 'name': 'COVID-19'}}]"
2022-08-07 01:43:48+00:00,1556093721023680513,"I am convinced that even if Ebola start spreading, people will still go to restaurants to eat indoor. Eating inside a restaurant gives meaning to life. https://t.co/ClZCRRQEEb",,0,0,1,703754868,"[{'domain': {'id': '30', 'name': 'Entities [Entity Service]', 'description': 'Entity Service top level domain, every item that is in Entity Service should be in this domain'}, 'entity': {'id': '825047692124442624', 'name': 'Food', 'description': 'Food'}}, {'domain': {'id': '67', 'name': 'Interests and Hobbies', 'description': 'Interests, opinions, and behaviors of individuals, groups, or cultures; like Speciality Cooking or Theme Parks'}, 'entity': {'id': '1006277774384828416', 'name': 'Food experience', 'description': 'Conversation about eating'}}]"
2022-08-07 01:31:28+00:00,1556090615070220288,"By the way, PRC scientists stole Nipah and Ebola viruses from NML in 2019:
https://t.co/Mk0Hl3QteT https://t.co/c5xV1ndzQI",,34,3,55,1441723412368420868,"[{'domain': {'id': '131', 'name': 'Unified Twitter Taxonomy', 'description': 'A taxonomy view into the Semantic Core knowledge graph'}, 'entity': {'id': '854692455005921281', 'name': 'Science', 'description': 'Science'}}]"
2022-08-07 01:18:01+00:00,1556087230439071744,I can’t believe I survived the Ebola jokes that was a tough time to be African,,0,0,2,1435955781225132036,[]
2022-08-07 01:13:17+00:00,1556086039760224256,"Stop #coronavirus RT!

Call for the resignation of Tedros Adhanom Ghebreyesus, #WHO Director General
⬇⬇✏
https://t.co/NkaCorRIb5

#coronaviruschina #Pndahugger

#coronachan #corona_chan #コロナちゃん #コロナウィルスちゃん #Ebola #ebolachan #エボラちゃん
https://t.co/LlU679nFvC",,0,0,0,331916700,"[{'domain': {'id': '123', 'name': 'Ongoing News Story', 'description': ""Ongoing News Stories like 'Brexit'""}, 'entity': {'id': '1220701888179359745', 'name': 'COVID-19'}}, {'domain': {'id': '131', 'name': 'Unified Twitter Taxonomy', 'description': 'A taxonomy view into the Semantic Core knowledge graph'}, 'entity': {'id': '1220701888179359745', 'name': 'COVID-19'}}]"
2022-08-07 00:49:44+00:00,1556080112474488833,"Ebola virus disease, is a serious and often fatal illness in humans and nonhuman primates caused by infection with one of six Ebola virus species, four of which can infect humans.

Take our accredited Ebola Nursing CE course and earn 2 ANCC contact hours. https://t.co/7ZbrP2yXLc",,0,0,1,896088355296993281,[]
2022-08-07 00:29:34+00:00,1556075038746578944,And has killed hundreds of thousands..maybe you shoukd look into his AIDS research....or all the people in Africa he killed while researching  Ebola...again...you know nothing..you read headlines and click bait...you do ZERO actual research...GROW UP https://t.co/viMiSitZ0o,,1,0,4,2710061300,"[{'domain': {'id': '10', 'name': 'Person', 'description': 'Named people in the world like Nelson Mandela'}, 'entity': {'id': '1278290678099763200', 'name': 'Lauren Boebert'}}, {'domain': {'id': '35', 'name': 'Politician', 'description': 'Politicians in the world, like Joe Biden'}, 'entity': {'id': '1278290678099763200', 'name': 'Lauren Boebert'}}, {'domain': {'id': '131', 'name': 'Unified Twitter Taxonomy', 'description': 'A taxonomy view into the Semantic Core knowledge graph'}, 'entity': {'id': '847878884917886977', 'name': 'Politics', 'description': 'Politics'}}, {'domain': {'id': '131', 'name': 'Unified Twitter Taxonomy', 'description': 'A taxonomy view into the Semantic Core knowledge graph'}, 'entity': {'id': '1070032753834438656', 'name': 'Political figures', 'description': 'Politician'}}, {'domain': {'id': '131', 'name': 'Unified Twitter Taxonomy', 'description': 'A taxonomy view into the Semantic Core knowledge graph'}, 'entity': {'id': '1278290678099763200', 'name': 'Lauren Boebert'}}]"
2022-08-07 00:22:25+00:00,1556073239238959107,"So, HIV/Aids, Ebola and now Monkey Pox came out of Africa
COVID, SARS, Swine flu, and Avian flus came out of Asia.
All in past 40 yrs.
Kinda makes you go Hhhmmm...
Just saying.",,0,1,1,1108052306509983744,"[{'domain': {'id': '123', 'name': 'Ongoing News Story', 'description': ""Ongoing News Stories like 'Brexit'""}, 'entity': {'id': '1220701888179359745', 'name': 'COVID-19'}}, {'domain': {'id': '131', 'name': 'Unified Twitter Taxonomy', 'description': 'A taxonomy view into the Semantic Core knowledge graph'}, 'entity': {'id': '1220701888179359745', 'name': 'COVID-19'}}, {'domain': {'id': '29', 'name': 'Events [Entity Service]', 'description': 'Entity Service related Events domain'}, 'entity': {'id': '1219057585707315201', 'name': 'COVID-19: Latest news updates from around the world', 'description': 'This page is a timeline of Tweets with the latest information and updates on COVID-19 from experts, journalists, health authorities and other trusted sources from around the world. For more on COVID-19, visit: twitter.com/explore/tabs/covid-19'}}]"
2022-08-07 00:19:08+00:00,1556072414127071232,In the pristine waters of ebola gulley gultch... https://t.co/631KEf2rAb,,0,0,0,4600674980,[]
2022-08-07 00:05:00+00:00,1556068855939796992,"#Coronavirus, #SARS, Spanish flu, Ebola, #H1N1, #H5N1, #Chickenpox, #Influenza; stuck at home, in a #Quarantine, and bored out of your mind? Time for #SocialDistancing? Time to watch a few random #Horror and #HorrorAdjacent films!  https://t.co/A5tfUDOaTA",,0,0,2,1241905632,"[{'domain': {'id': '123', 'name': 'Ongoing News Story', 'description': ""Ongoing News Stories like 'Brexit'""}, 'entity': {'id': '1220701888179359745', 'name': 'COVID-19'}}, {'domain': {'id': '131', 'name': 'Unified Twitter Taxonomy', 'description': 'A taxonomy view into the Semantic Core knowledge graph'}, 'entity': {'id': '1220701888179359745', 'name': 'COVID-19'}}]"
2022-08-06 23:42:44+00:00,1556063255311052800,"Your tweet gave me
- a cold
- ebola
- probably every illness in the entire world",,0,0,0,2288402650,"[{'domain': {'id': '46', 'name': 'Brand Category', 'description': 'Categories within Brand Verticals that narrow down the scope of Brands'}, 'entity': {'id': '781974596752842752', 'name': 'Services'}}, {'domain': {'id': '47', 'name': 'Brand', 'description': 'Brands and Companies'}, 'entity': {'id': '10045225402', 'name': 'Twitter'}}]"
2022-08-06 23:22:19+00:00,1556058113752678401,"In the early twenty-first century, the average human is far more likely to die from bingeing at McDonalds than from drought, Ebola or an al-Qaeda attack.-Yuval Noah Harari",,0,0,0,1555505054492536832,"[{'domain': {'id': '131', 'name': 'Unified Twitter Taxonomy', 'description': 'A taxonomy view into the Semantic Core knowledge graph'}, 'entity': {'id': '847543836330958848', 'name': 'Global security & terrorism', 'description': 'Global conversation about threats of terrorism, response of governments, and national security  '}}, {'domain': {'id': '131', 'name': 'Unified Twitter Taxonomy', 'description': 'A taxonomy view into the Semantic Core knowledge graph'}, 'entity': {'id': '847878884917886977', 'name': 'Politics', 'description': 'Politics'}}, {'domain': {'id': '131', 'name': 'Unified Twitter Taxonomy', 'description': 'A taxonomy view into the Semantic Core knowledge graph'}, 'entity': {'id': '900740740468191232', 'name': 'Political issues', 'description': 'Political issues'}}, {'domain': {'id': '45', 'name': 'Brand Vertical', 'description': 'Top level entities that describe a Brands industry'}, 'entity': {'id': '781974596161376261', 'name': 'Dining'}}, {'domain': {'id': '46', 'name': 'Brand Category', 'description': 'Categories within Brand Verticals that narrow down the scope of Brands'}, 'entity': {'id': '781974597017083904', 'name': 'QSR'}}, {'domain': {'id': '47', 'name': 'Brand', 'description': 'Brands and Companies'}, 'entity': {'id': '10026319212', 'name': ""McDonald's""}}, {'domain': {'id': '30', 'name': 'Entities [Entity Service]', 'description': 'Entity Service top level domain, every item that is in Entity Service should be in this domain'}, 'entity': {'id': '825047692124442624', 'name': 'Food', 'description': 'Food'}}, {'domain': {'id': '131', 'name': 'Unified Twitter Taxonomy', 'description': 'A taxonomy view into the Semantic Core knowledge graph'}, 'entity': {'id': '10026319212', 'name': ""McDonald's""}}, {'domain': {'id': '152', 'name': 'Food', 'description': 'Topics about food, like Donuts or Brunch'}, 'entity': {'id': '847865239886417922', 'name': 'Fast food Restaurants', 'description': 'Fast food'}}]"
