Datetime,Tweet Id,original_text,geo,retweet_count,reply_count,like_count,author_id,context_annotations
2022-05-12 07:25:54+00:00,1524652069336014848,"which disease would you like to contract next?

⚫️ Mad cow disease
⚫️ Ebola
⚫️ Bacterial meningitis
⚫️ Whatever it is that makes Prince Charles’s fingers look like bloated sunburnt corpses https://t.co/WtZGhKwb45",,1,0,3,1100875623654965249,"[{'domain': {'id': '10', 'name': 'Person', 'description': 'Named people in the world like Nelson Mandela'}, 'entity': {'id': '989173596768501761', 'name': 'Prince Charles', 'description': 'Prince Charles'}}, {'domain': {'id': '10', 'name': 'Person', 'description': 'Named people in the world like Nelson Mandela'}, 'entity': {'id': '1070735166069334017', 'name': 'Keir Starmer', 'description': 'British politician and lawyer'}}, {'domain': {'id': '35', 'name': 'Politician', 'description': 'Politicians in the world, like Joe Biden'}, 'entity': {'id': '1070735166069334017', 'name': 'Keir Starmer', 'description': 'British politician and lawyer'}}]"
2022-05-12 06:49:06+00:00,1524642806681247747,"Today I will be at the International Conference on #planetaryhealth , online,  12:00 Spanish time
What we have learnt from #Ebola and #covid19 in West Africa regarding health systems and  climate change?
Don't miss it ;-)
@JordiSwiss @JeannineLemaire 
https://t.co/rhUpGHUFV2",,0,0,1,184747556,"[{'domain': {'id': '123', 'name': 'Ongoing News Story', 'description': ""Ongoing News Stories like 'Brexit'""}, 'entity': {'id': '1220701888179359745', 'name': 'COVID-19'}}, {'domain': {'id': '29', 'name': 'Events [Entity Service]', 'description': 'Entity Service related Events domain'}, 'entity': {'id': '1219057585707315201', 'name': 'COVID-19: Latest news updates from around the world', 'description': 'This page is a timeline of Tweets with the latest information and updates on COVID-19 from experts, journalists, health authorities and other trusted sources from around the world. For more on COVID-19, visit: twitter.com/explore/tabs/covid-19'}}]"
2022-05-12 06:48:05+00:00,1524642551449358336,"Happy #InternationalNursesDay to all Nurses across the world ! Especially to countless nurses who are toiling day and night to provide care even in the midst of dangerous conditions like war, civil conflicts, terrorism ; diseases like covid, ebola; lack of funding and equipment!",,0,0,0,1501958801507090434,"[{'domain': {'id': '29', 'name': 'Events [Entity Service]', 'description': 'Entity Service related Events domain'}, 'entity': {'id': '1492244749507432451', 'name': 'International Nurses Day'}}, {'domain': {'id': '123', 'name': 'Ongoing News Story', 'description': ""Ongoing News Stories like 'Brexit'""}, 'entity': {'id': '1220701888179359745', 'name': 'COVID-19'}}, {'domain': {'id': '29', 'name': 'Events [Entity Service]', 'description': 'Entity Service related Events domain'}, 'entity': {'id': '1219057585707315201', 'name': 'COVID-19: Latest news updates from around the world', 'description': 'This page is a timeline of Tweets with the latest information and updates on COVID-19 from experts, journalists, health authorities and other trusted sources from around the world. For more on COVID-19, visit: twitter.com/explore/tabs/covid-19'}}]"
2022-05-12 06:36:32+00:00,1524639647241957376,Only 1 College soccer teams will have a season due to Ebola,,0,0,0,1307854014596493319,"[{'domain': {'id': '11', 'name': 'Sport', 'description': 'Types of sports, like soccer and basketball'}, 'entity': {'id': '733756536430809088', 'name': 'Soccer'}}]"
2022-05-12 06:09:14+00:00,1524632774833020928,How will the world end? Flying ebola.,,0,0,0,917427265843159042,[]
2022-05-12 05:54:00+00:00,1524628941109346304,Ben the Quiet died from Ebola in 1701.,,0,0,0,4893877534,[]
2022-05-12 05:09:27+00:00,1524617728157491200,"Build up your nutritional status and boost your immune system now against: 

-all the strains  covid
-influenza 
-rsv 
-parainfluenza 
-Marburg and Hanta viruses. 
-Maybe Ebola

Use promo code: Patriot546
https://t.co/W0M7trynNN",,0,0,1,146053880,"[{'domain': {'id': '123', 'name': 'Ongoing News Story', 'description': ""Ongoing News Stories like 'Brexit'""}, 'entity': {'id': '1220701888179359745', 'name': 'COVID-19'}}]"
2022-05-12 05:04:40+00:00,1524616524685725698,Ben the Weird died from Ebola in 1941.,,0,0,0,4893877534,[]
2022-05-12 05:04:39+00:00,1524616523515502593,Designing a novel multi‑epitope vaccine against Ebola virus using reverse vaccinology approach https://t.co/aDAfvkoOga,,0,0,0,1450673432350265348,"[{'domain': {'id': '123', 'name': 'Ongoing News Story', 'description': ""Ongoing News Stories like 'Brexit'""}, 'entity': {'id': '1220701888179359745', 'name': 'COVID-19'}}]"
2022-05-12 04:44:56+00:00,1524611558957105152,"Wanna study smarter? 😉

➡️ see my profile 🔴

Happiness Definition Essay
The Hart-Cellar Act: The Immigration And Naturalization Act Of 1965
Conflict In The Book Thief
Americans Concern Over Ebola Analysis https://t.co/7KziumTCy9",,0,0,0,1517798922160381954,[]
2022-05-12 04:21:48+00:00,1524605739439951872,"It took Palestine, Rwanda, Iraq, Libya etc and Covid, Ebola etc to show that the UN &amp; WHO are utterly useless.",,0,0,0,169847630,"[{'domain': {'id': '123', 'name': 'Ongoing News Story', 'description': ""Ongoing News Stories like 'Brexit'""}, 'entity': {'id': '1220701888179359745', 'name': 'COVID-19'}}, {'domain': {'id': '45', 'name': 'Brand Vertical', 'description': 'Top level entities that describe a Brands industry'}, 'entity': {'id': '781974596157251587', 'name': 'Government/Education'}}, {'domain': {'id': '46', 'name': 'Brand Category', 'description': 'Categories within Brand Verticals that narrow down the scope of Brands'}, 'entity': {'id': '781974597226729473', 'name': 'Non-profit'}}, {'domain': {'id': '47', 'name': 'Brand', 'description': 'Brands and Companies'}, 'entity': {'id': '10044311823', 'name': 'United Nations', 'description': 'Global conversation about the United Nations and all related efforts.'}}, {'domain': {'id': '88', 'name': 'Political Body', 'description': 'A section of a government, like The Supreme Court'}, 'entity': {'id': '10044311823', 'name': 'United Nations', 'description': 'Global conversation about the United Nations and all related efforts.'}}, {'domain': {'id': '29', 'name': 'Events [Entity Service]', 'description': 'Entity Service related Events domain'}, 'entity': {'id': '1219057585707315201', 'name': 'COVID-19: Latest news updates from around the world', 'description': 'This page is a timeline of Tweets with the latest information and updates on COVID-19 from experts, journalists, health authorities and other trusted sources from around the world. For more on COVID-19, visit: twitter.com/explore/tabs/covid-19'}}]"
2022-05-12 04:19:08+00:00,1524605067047084039,tbh ebola is probably just another mononoke,,0,0,0,2864407958,[]
2022-05-12 04:12:58+00:00,1524603515754418176,"Stop #coronavirus RT!

Call for the resignation of #Tedros Adhanom Ghebreyesus, #WHO Director General
⬇⬇
✏
https://t.co/NkaCorRIb5

#coronaviruschina #Pndahugger

#coronachan #COVIDー19 #コロナちゃん #コロナウィルスちゃん #Ebola #ebolachan #エボラちゃん
https://t.co/NQLozAHV1E",,0,0,0,331916700,"[{'domain': {'id': '123', 'name': 'Ongoing News Story', 'description': ""Ongoing News Stories like 'Brexit'""}, 'entity': {'id': '1220701888179359745', 'name': 'COVID-19'}}]"
2022-05-12 03:46:25+00:00,1524596833686761472,"WHO health emergencies declarations and oversight.
Did you know there is an ebola vaccine ready to go?
https://t.co/05qBZ77ERr https://t.co/AEe2JM6b08",,0,0,0,1515193147801759747,"[{'domain': {'id': '123', 'name': 'Ongoing News Story', 'description': ""Ongoing News Stories like 'Brexit'""}, 'entity': {'id': '1220701888179359745', 'name': 'COVID-19'}}]"
2022-05-12 03:37:56+00:00,1524594700400832512,"Can't stop laughing. Now get infected with ebola, small pox and i will believe it. Photo proof required! https://t.co/vLiPCBXa3J",,0,0,0,244438531,"[{'domain': {'id': '123', 'name': 'Ongoing News Story', 'description': ""Ongoing News Stories like 'Brexit'""}, 'entity': {'id': '1220701888179359745', 'name': 'COVID-19'}}, {'domain': {'id': '10', 'name': 'Person', 'description': 'Named people in the world like Nelson Mandela'}, 'entity': {'id': '806574543888232448', 'name': 'Bill Gates', 'description': 'Bill Gates'}}, {'domain': {'id': '65', 'name': 'Interests and Hobbies Vertical', 'description': 'Top level interests and hobbies groupings, like Food or Travel'}, 'entity': {'id': '781974596148793345', 'name': 'Business & finance'}}, {'domain': {'id': '65', 'name': 'Interests and Hobbies Vertical', 'description': 'Top level interests and hobbies groupings, like Food or Travel'}, 'entity': {'id': '781974596148793345', 'name': 'Business & finance'}}, {'domain': {'id': '30', 'name': 'Entities [Entity Service]', 'description': 'Entity Service top level domain, every item that is in Entity Service should be in this domain'}, 'entity': {'id': '857879456773357569', 'name': 'Technology', 'description': 'Technology'}}]"
2022-05-12 03:36:33+00:00,1524594350805557248,New out break of Ebola in Australia leads to millions infected!,,0,0,0,1306281589589127169,[]
2022-05-12 03:19:08+00:00,1524589966893871109,W.H.O. &amp; U.N. exposed in the Congo sex abuse Ebola crisis scandal https://t.co/k0j7xwrPa3,,0,0,0,1467959277662920706,[]
2022-05-12 03:19:08+00:00,1524589966893805568,W.H.O. &amp; U.N. exposed in the Congo sex abuse Ebola crisis scandal https://t.co/DcsI85sUiw,,0,0,0,169199327,[]
2022-05-12 03:19:08+00:00,1524589966742892544,W.H.O. &amp; U.N. exposed in the Congo sex abuse Ebola crisis scandal https://t.co/WTFD87tOVV,,2,0,1,1467955288737296388,[]
2022-05-12 03:19:08+00:00,1524589966696730625,W.H.O. &amp; U.N. exposed in the Congo sex abuse Ebola crisis scandal https://t.co/O44VKSMG6W,,0,0,0,884260730559754240,[]
2022-05-12 03:19:08+00:00,1524589965891407872,W.H.O. &amp; U.N. exposed in the Congo sex abuse Ebola crisis scandal https://t.co/IF32w5V7OS,,0,0,0,1114196340362436609,[]
2022-05-12 03:19:07+00:00,1524589964880658435,W.H.O. &amp; U.N. exposed in the Congo sex abuse Ebola crisis scandal https://t.co/Log0eSVCwZ,,0,0,0,1469810570559959042,[]
2022-05-12 03:19:07+00:00,1524589964763320321,W.H.O. &amp; U.N. exposed in the Congo sex abuse Ebola crisis scandal https://t.co/Ydy2J0uNaD,,0,0,0,1135428483721629696,[]
2022-05-12 03:19:07+00:00,1524589963504984064,W.H.O. &amp; U.N. exposed in the Congo sex abuse Ebola crisis scandal https://t.co/i9pV8EIaJE,,0,0,0,748613567499251712,[]
2022-05-12 03:19:07+00:00,1524589963412754434,W.H.O. &amp; U.N. exposed in the Congo sex abuse Ebola crisis scandal https://t.co/7GJygXKIc4,,0,0,0,1438311602835570696,[]
2022-05-12 03:19:07+00:00,1524589962804486145,W.H.O. &amp; U.N. exposed in the Congo sex abuse Ebola crisis scandal https://t.co/86KVp8NjxU,,0,0,0,748117585770622976,[]
2022-05-12 03:16:47+00:00,1524589378252718080,"W.H.O. - The outbreak of Ebola virus disease (EVD) in the DRC continues with a new confirmed case reported on 4 May 2022 in Motema Pemba Health Area, Mbandaka Health Zone, Equateur Province. https://t.co/kuWsRSaLNK h/t Pathfinder",,0,0,3,19087092,[]
2022-05-12 03:03:07+00:00,1524585937002393600,"#PlantHealthDay 

From wanting to be a virologist that works on ebola to becoming a forest pathologist that works on fungi, plants have played an incredible role in shaping my career. Now I'm helping shape their future.

@FAO @FAOForestry @ippcnews 
@Fabiteam1 @scion_research https://t.co/Ba6xhZ1NHV",,0,1,18,2798465804,[]
2022-05-12 02:49:26+00:00,1524582494586032128,"Nurses were there for the Spanish Flu, for Polio, for Ebola, and now, they stand between COVID-19 and the rest of the world. Hats off to their selfless service.@NCC_Dte_Gujarat @NCC_Dte_Delhi @1gctrncc #NursesDay @AshokNa02653637 @ArvindKapoorTYG @MoHFW_INDIA https://t.co/ARQUva9uCY",,17,0,23,147841706,"[{'domain': {'id': '123', 'name': 'Ongoing News Story', 'description': ""Ongoing News Stories like 'Brexit'""}, 'entity': {'id': '1220701888179359745', 'name': 'COVID-19'}}]"
2022-05-12 02:19:00+00:00,1524574834025725953,How to give Vanitas Drop kicking ebola,,0,0,0,2806258580,[]
2022-05-12 01:59:03+00:00,1524569814089355264,Ebola relative virus capable of infecting humans found in bats sparks new pandemic fears  https://t.co/Y1kR8ZTM0e,,1,0,0,1091857187935264769,"[{'domain': {'id': '123', 'name': 'Ongoing News Story', 'description': ""Ongoing News Stories like 'Brexit'""}, 'entity': {'id': '1220701888179359745', 'name': 'COVID-19'}}]"
2022-05-12 01:55:44+00:00,1524568978441445377,You can kill the Ebola virus before it enters your system by simply following these few steps. https://t.co/akmc2loxFD #Ebola PennNewsFile,,0,0,0,2824585513,[]
2022-05-12 01:48:58+00:00,1524567277970296833,How to spread ebola to Vanitas,,0,0,0,2806258580,[]
2022-05-12 01:40:48+00:00,1524565219816607744,"Not a virologist or a mouse. 

Virology is all about understanding viruses – from more common infections such as chicken pox to new and emerging infections like Zika and Ebola.",,0,0,0,1493483053980667905,"[{'domain': {'id': '30', 'name': 'Entities [Entity Service]', 'description': 'Entity Service top level domain, every item that is in Entity Service should be in this domain'}, 'entity': {'id': '854692455005921281', 'name': 'Science', 'description': 'Science'}}, {'domain': {'id': '30', 'name': 'Entities [Entity Service]', 'description': 'Entity Service top level domain, every item that is in Entity Service should be in this domain'}, 'entity': {'id': '847896837532995585', 'name': 'Biology', 'description': 'Biology'}}]"
2022-05-12 01:22:19+00:00,1524560569772167170,"This was me with the DRC throughout 2019. You’d think it’s all bush, rebels, Ebola &amp; gunshots BUT go to Kinshasa - beautiful and full of life. Hell, even Lubumbashi &amp; Kolwezi are far from what the media shows you. https://t.co/z2S6NjWriG",,0,0,5,1414946623998791688,"[{'domain': {'id': '29', 'name': 'Events [Entity Service]', 'description': 'Entity Service related Events domain'}, 'entity': {'id': '1517623051860414465', 'name': 'World Environment Day'}}]"
2022-05-12 00:50:57+00:00,1524552674204598272,"Long COVID isn't a thing. You don't have long flu, long ebola, long mumps. It's just another attempt to drag this bs out and profit off the funding. People need to let go and move on, return to ""Norms"".",,0,0,1,520836568,"[{'domain': {'id': '123', 'name': 'Ongoing News Story', 'description': ""Ongoing News Stories like 'Brexit'""}, 'entity': {'id': '1220701888179359745', 'name': 'COVID-19'}}]"
2022-05-12 00:36:37+00:00,1524549067522465792,Kanye West reveal him and his family had Ebola this year,,0,0,0,1306666336668573697,"[{'domain': {'id': '10', 'name': 'Person', 'description': 'Named people in the world like Nelson Mandela'}, 'entity': {'id': '806561823407239169', 'name': 'Kanye West', 'description': 'Kanye West'}}, {'domain': {'id': '54', 'name': 'Musician', 'description': 'A musician in the world, like Adele or Bob Dylan'}, 'entity': {'id': '806561823407239169', 'name': 'Kanye West', 'description': 'Kanye West'}}, {'domain': {'id': '55', 'name': 'Music Genre', 'description': 'A category for a musical style, like Pop, Rock, or Rap'}, 'entity': {'id': '810937888334487552', 'name': 'Rap', 'description': 'Hip-Hop/Rap'}}]"
2022-05-12 00:34:20+00:00,1524548495243452416,"📷 sciviz: Ebola virus David S Goodsell, RCSB Protein Data Bank Very different in style from the images of the ebola virus I shared by Alexey Kashpersky, but this illustration does a wonderful job of clearly illustrating the complexity of... https://t.co/fx0xnV1fAp",,0,0,0,1325327444,"[{'domain': {'id': '65', 'name': 'Interests and Hobbies Vertical', 'description': 'Top level interests and hobbies groupings, like Food or Travel'}, 'entity': {'id': '847868745150119936', 'name': 'Family & relationships', 'description': 'Hobbies and interests'}}]"
2022-05-11 23:59:00+00:00,1524539601469255683,Third Ebola patient dies in northwest Democratic Republic of Congo https://t.co/pIuS8eeOL7,,0,0,0,1091857187935264769,[]
2022-05-11 23:50:44+00:00,1524537523145302016,"Congrats Dr. @Sarah_vanTol! Really thorough study on Ebola VP35 ubiquitination and how it impacts immune evasion, viral RNA synthesis and nucleocapsid assembly. https://t.co/Ry4Ra30qaT",,0,0,3,1212241349287612416,[]
2022-05-11 23:18:36+00:00,1524529436133314560,my arm itches I think i have Ebola,,0,0,0,2747394897,[]
2022-05-11 23:13:03+00:00,1524528039631065089,"Tedros, You're fired!
✒⬇
https://t.co/NkaCos8Ld5

#coronaviruschina #Pndahugger
#coronachan #corona_chan #コロナちゃん #コロナウイルスちゃん #WuhanVirus #武漢 #wuflu #Ebola #ebolachan #ebola_chan #WuhanCoronavirus #Wuhan #coronavirusoutbreak #coronavirus
https://t.co/GGhfZLo3Vw",,0,0,0,331916700,"[{'domain': {'id': '123', 'name': 'Ongoing News Story', 'description': ""Ongoing News Stories like 'Brexit'""}, 'entity': {'id': '1220701888179359745', 'name': 'COVID-19'}}]"
2022-05-11 22:59:40+00:00,1524524669319016449,"#MIMG102XL Yesterday we talked about the current cases of Ebola in DRC. Here is a good example of the  local detection/sequencing, and how incredibly fast it can confirm new cases https://t.co/7ED4fqtagW",,0,0,0,1054536521833824256,"[{'domain': {'id': '123', 'name': 'Ongoing News Story', 'description': ""Ongoing News Stories like 'Brexit'""}, 'entity': {'id': '1220701888179359745', 'name': 'COVID-19'}}]"
2022-05-11 22:44:15+00:00,1524520792297410560,"Do people really think ""endemic"" means ""mild""?  It really means ""is always lurking"", you're just hoping Covid will stay mild after we failed to eradicate it.  Ebola is endemic in certain areas, and it's not exactly mild.",,0,1,1,709367408,"[{'domain': {'id': '123', 'name': 'Ongoing News Story', 'description': ""Ongoing News Stories like 'Brexit'""}, 'entity': {'id': '1220701888179359745', 'name': 'COVID-19'}}]"
2022-05-11 22:36:39+00:00,1524518877140373504,Ebola attack warning from the Lord. Pray!,,0,0,1,1500215300217659396,[]
2022-05-11 22:04:16+00:00,1524510728102633474,Peyton Manning the Vicious died from Ebola in 1282.,,0,0,0,4893877534,"[{'domain': {'id': '10', 'name': 'Person', 'description': 'Named people in the world like Nelson Mandela'}, 'entity': {'id': '884438614309879809', 'name': 'Peyton Manning', 'description': 'Peyton Manning'}}, {'domain': {'id': '60', 'name': 'Athlete', 'description': 'An athlete in the world, like Serena Williams or Lionel Messi'}, 'entity': {'id': '884438614309879809', 'name': 'Peyton Manning', 'description': 'Peyton Manning'}}, {'domain': {'id': '92', 'name': 'Sports Personality', 'description': ""A Sports Personality like 'Skip Bayless'""}, 'entity': {'id': '884438614309879809', 'name': 'Peyton Manning', 'description': 'Peyton Manning'}}]"
2022-05-11 22:00:34+00:00,1524509797386752001,"Three confirmed cases of Ebola Virus Disease associated with two deaths and 345 contacts, 59.7% of contacts vaccinated, in  Mbandaka, and Wangata in Equateur were confirmed in the Democratic Republic of the Congo as of May 4, 2022. (OCHA 5/4/2022) #Zusia https://t.co/wjTjUWRrcW",,0,0,0,3118529657,"[{'domain': {'id': '123', 'name': 'Ongoing News Story', 'description': ""Ongoing News Stories like 'Brexit'""}, 'entity': {'id': '1220701888179359745', 'name': 'COVID-19'}}]"
2022-05-11 21:27:34+00:00,1524501491892981760,It’s funny that the evil bastard thinks any one cares. He should let us know when he catches Ebola or develops cancer. Then we have something to look forward to…….like a better world. https://t.co/SnY40a1DR3,,1,1,3,2341589400,[]
2022-05-11 21:02:03+00:00,1524495073697837056,"The task is your to finish human are you worthy to complete,the antidoth is remaining with me until i decide distributing cure as ebola and corona,A peasants should learn mannerism emulating correct attitudes of equal justice, for i am not joking distoring a country bilineal.",,0,0,0,1161244288568713216,"[{'domain': {'id': '123', 'name': 'Ongoing News Story', 'description': ""Ongoing News Stories like 'Brexit'""}, 'entity': {'id': '1220701888179359745', 'name': 'COVID-19'}}]"
2022-05-11 20:54:01+00:00,1524493050554159104,Damn. Really need to return home before Ebola outbreak. 🥲 https://t.co/FmPeun6LNh,,0,0,4,1362305278922788864,"[{'domain': {'id': '123', 'name': 'Ongoing News Story', 'description': ""Ongoing News Stories like 'Brexit'""}, 'entity': {'id': '1220701888179359745', 'name': 'COVID-19'}}, {'domain': {'id': '29', 'name': 'Events [Entity Service]', 'description': 'Entity Service related Events domain'}, 'entity': {'id': '1219057585707315201', 'name': 'COVID-19: Latest news updates from around the world', 'description': 'This page is a timeline of Tweets with the latest information and updates on COVID-19 from experts, journalists, health authorities and other trusted sources from around the world. For more on COVID-19, visit: twitter.com/explore/tabs/covid-19'}}]"
2022-05-11 20:43:08+00:00,1524490312567058432,This bitch said “I’ll be damned if I ever get caught with a std” then says she has Ebola.... WTFFF https://t.co/y14lAmKuL3,,0,0,0,1370654141517688834,[]
2022-05-11 20:41:10+00:00,1524489815902892032,"When Ebola                     When Trina 
    Flirts ☹️                             Flirts 😍

#GH #Sprina 
#Spencer https://t.co/SfI5qxIfrW",,7,8,65,93129411,[]
2022-05-11 20:25:39+00:00,1524485909311332353,dO yoU haVe EboLa????? https://t.co/6M74MVJQN3,,1,0,2,1064944246061498370,[]
2022-05-11 20:19:25+00:00,1524484341740539909,"I saw this on vanguard online news.
Dear #PresidentBuhari #MuhammaduBuhari #thesenate Pls confer the same posthumous award on late #NurseJustinaEjelonu, a 25-year-old pregnant nurse, who died of #ebolavirus.  https://t.co/3DY29YSg6L",,1,1,1,1126564194692861953,"[{'domain': {'id': '10', 'name': 'Person', 'description': 'Named people in the world like Nelson Mandela'}, 'entity': {'id': '907355784366850053', 'name': 'Muhammadu Buhari', 'description': 'President of Nigeria Muhammadu Buhari'}}, {'domain': {'id': '35', 'name': 'Politician', 'description': 'Politicians in the world, like Joe Biden'}, 'entity': {'id': '907355784366850053', 'name': 'Muhammadu Buhari', 'description': 'President of Nigeria Muhammadu Buhari'}}]"
2022-05-11 20:12:01+00:00,1524482479754780673,Related Ebola virus capable of infecting humans found in bats sparks new pandemic fears | Science | News https://t.co/MEs0ygfyLd,,0,0,0,1449936386245607430,"[{'domain': {'id': '123', 'name': 'Ongoing News Story', 'description': ""Ongoing News Stories like 'Brexit'""}, 'entity': {'id': '1220701888179359745', 'name': 'COVID-19'}}, {'domain': {'id': '30', 'name': 'Entities [Entity Service]', 'description': 'Entity Service top level domain, every item that is in Entity Service should be in this domain'}, 'entity': {'id': '854692455005921281', 'name': 'Science', 'description': 'Science'}}]"
2022-05-11 20:12:00+00:00,1524482475333984256,Related Ebola virus capable of infecting humans found in bats sparks new pandemic fears | Science | News https://t.co/FOndc66EMq,,0,0,0,1293423098079768576,"[{'domain': {'id': '123', 'name': 'Ongoing News Story', 'description': ""Ongoing News Stories like 'Brexit'""}, 'entity': {'id': '1220701888179359745', 'name': 'COVID-19'}}, {'domain': {'id': '30', 'name': 'Entities [Entity Service]', 'description': 'Entity Service top level domain, every item that is in Entity Service should be in this domain'}, 'entity': {'id': '854692455005921281', 'name': 'Science', 'description': 'Science'}}]"
2022-05-11 20:06:20+00:00,1524481051678048257,"Pestilence's point to the last days and the soon return of Christ! 

🦠Coronavirus (COVID-19)
🦠 H3N8 bird flu 
🦠 H5 bird flu has infected a human
🦠 Unexplainable Hepatitis
🦠 Japanese Encephalitis
🦠 Ebola
🦠 Mystery Horse Disease In Colorado",,0,0,0,32372034,"[{'domain': {'id': '123', 'name': 'Ongoing News Story', 'description': ""Ongoing News Stories like 'Brexit'""}, 'entity': {'id': '1220701888179359745', 'name': 'COVID-19'}}, {'domain': {'id': '159', 'name': 'States', 'description': 'States, provinces, or prefectures, like California or Fukushima Prefecture'}, 'entity': {'id': '856862177474433024', 'name': 'Colorado', 'description': 'Colorado'}}]"
2022-05-11 20:02:00+00:00,1524479958718033920,"The #Ebola virus can 'hide out' in the brain after treatment and cause recurrent infections https://t.co/ULvFlA0vV9

 a través de 
@ConversationUS",,0,0,0,1089157733767675904,[]
2022-05-11 19:45:53+00:00,1524475905510363140,Magnolia solja im sick like ebola jus me an stunna ridin in a range rover,,0,0,0,1694004546,"[{'domain': {'id': '45', 'name': 'Brand Vertical', 'description': 'Top level entities that describe a Brands industry'}, 'entity': {'id': '781972125171060736', 'name': 'Auto'}}, {'domain': {'id': '46', 'name': 'Brand Category', 'description': 'Categories within Brand Verticals that narrow down the scope of Brands'}, 'entity': {'id': '781972125179518977', 'name': 'Auto Manufacturer'}}, {'domain': {'id': '47', 'name': 'Brand', 'description': 'Brands and Companies'}, 'entity': {'id': '10026488870', 'name': 'Land Rover'}}, {'domain': {'id': '48', 'name': 'Product', 'description': 'Products created by Brands.  Examples: Ford Explorer, Apple iPhone.'}, 'entity': {'id': '10027978341', 'name': 'Land Rover - Range Rover'}}]"
2022-05-11 19:45:33+00:00,1524475819011104768,"Transcriptomic signatures induced by the Ebola virus vaccine rVSVΔG-ZEBOV-GP in adult cohorts in Europe, Africa, and North America: a molecular biomarker study https://t.co/82bi5B9cjA",,0,0,0,2849742042,"[{'domain': {'id': '123', 'name': 'Ongoing News Story', 'description': ""Ongoing News Stories like 'Brexit'""}, 'entity': {'id': '1220701888179359745', 'name': 'COVID-19'}}]"
