Datetime,Tweet Id,original_text,geo,retweet_count,reply_count,like_count,author_id,context_annotations
2022-06-20 07:17:49+00:00,1538783162372722693,"As the world spirals toward chaos, Amy Cooper fights to stop the evolution of a deadly virus. When her beliefs disagree with the Administration’s agenda, she is put on trial. #virus #ebola #coronavirus #religion #persecution Midnight Hour: https://t.co/pRdHFd6wuE",,0,0,1,195016054,"[{'domain': {'id': '123', 'name': 'Ongoing News Story', 'description': ""Ongoing News Stories like 'Brexit'""}, 'entity': {'id': '1220701888179359745', 'name': 'COVID-19'}}, {'domain': {'id': '29', 'name': 'Events [Entity Service]', 'description': 'Entity Service related Events domain'}, 'entity': {'id': '1219057585707315201', 'name': 'COVID-19: Latest news updates from around the world', 'description': 'This page is a timeline of Tweets with the latest information and updates on COVID-19 from experts, journalists, health authorities and other trusted sources from around the world. For more on COVID-19, visit: twitter.com/explore/tabs/covid-19'}}]"
2022-06-20 07:06:12+00:00,1538780238091390977,"Ebola-infected bat chomps on some fruit —&gt; chimp snacks on said fruit —&gt; human eats that chimp —&gt; Ebola flourishes in human host. 

Ebola’s really out here hopping and skipping all over the place, like, calm down. 😮‍💨 https://t.co/mFXIk4pHci",,0,0,0,2391800132,[]
2022-06-20 07:01:29+00:00,1538779052839997441,"99% survival rate, &gt;80% asymptomatic rate. You're acting like it's ebola; it's an influenza virus!
How about the ones who got the shots and died? The risk of death from a vaccine shouldn't be higher than the risk of death from the virus itself. But these shots are GENE THERAPY... https://t.co/Kvw0b3df5C",,0,0,0,1520125145142202369,"[{'domain': {'id': '65', 'name': 'Interests and Hobbies Vertical', 'description': 'Top level interests and hobbies groupings, like Food or Travel'}, 'entity': {'id': '903303816698671104', 'name': 'Wellness and health', 'description': 'Wellness & Health'}}, {'domain': {'id': '66', 'name': 'Interests and Hobbies Category', 'description': 'A grouping of interests and hobbies entities, like Novelty Food or Destinations'}, 'entity': {'id': '918538847302041600', 'name': 'Community Health', 'description': 'Community Health'}}, {'domain': {'id': '67', 'name': 'Interests and Hobbies', 'description': 'Interests, opinions, and behaviors of individuals, groups, or cultures; like Speciality Cooking or Theme Parks'}, 'entity': {'id': '920768310152593408', 'name': 'Common Medication', 'description': 'Common Medication'}}, {'domain': {'id': '123', 'name': 'Ongoing News Story', 'description': ""Ongoing News Stories like 'Brexit'""}, 'entity': {'id': '1220701888179359745', 'name': 'COVID-19'}}]"
2022-06-20 06:49:25+00:00,1538776012028264448,Just remembered that Ebola la la la la video. Edgy white kids were having the time of their lives in 2012-2014,,0,1,0,1144495901987102720,[]
2022-06-20 06:47:50+00:00,1538775616299732992,Like and Retweet if not YOU WILL GET EBOLA,,0,0,0,984568257561743360,[]
2022-06-20 06:36:38+00:00,1538772795458326530,Zac Effron reveal him and his family had Ebola this year,,0,0,0,1306666336668573697,"[{'domain': {'id': '10', 'name': 'Person', 'description': 'Named people in the world like Nelson Mandela'}, 'entity': {'id': '806970913233084417', 'name': 'Zac Efron', 'description': 'Zac Efron'}}, {'domain': {'id': '56', 'name': 'Actor', 'description': 'An actor or actress in the world, like Kate Winslet or Leonardo DiCaprio'}, 'entity': {'id': '806970913233084417', 'name': 'Zac Efron', 'description': 'Zac Efron'}}]"
2022-06-20 06:23:05+00:00,1538769385128464386,My Dad told me that I started Ebola,,0,0,0,3010876592,[]
2022-06-20 06:18:58+00:00,1538768351287476224,How to give Vanitas Drop kicking ebola,,0,0,0,2806258580,[]
2022-06-20 05:49:01+00:00,1538760813606866944,How to spread ebola to Vanitas,,0,0,0,2806258580,[]
2022-06-20 05:45:19+00:00,1538759884849786881,"safe the houses, save the whale
save a cracker

ringing rinbus Ebola Demetrius 

Sailing to Tintinnabulum

be shoddied, throttle me, fine me cowheel for ever,  Mykolaiovych 
usquebauched the ersewild aleconner, for bringing Ivan briar, his his Trawniki card
 seig heil https://t.co/938BgUXACw",,0,0,0,1046659672017711104,[]
2022-06-20 05:38:05+00:00,1538758064559468544,"The Hot Zone: The Chilling True Story of an Ebola Outbreak [4AS09TZ]

https://t.co/5pMz3sLlXk",,0,0,0,1523164005795303424,[]
2022-06-20 05:34:58+00:00,1538757278714712064,"It takes a pathological hate to convince half of the United States population to avoid vaccinating against deadly contagions, an attitude that persists to this day. Good luck to us with the next Ebola.
Of the many sins of Donald Trump, this was the most unforgivable.",,6,3,23,943899225309548545,"[{'domain': {'id': '10', 'name': 'Person', 'description': 'Named people in the world like Nelson Mandela'}, 'entity': {'id': '799022225751871488', 'name': 'Donald Trump', 'description': '45th US President, Donald Trump'}}, {'domain': {'id': '35', 'name': 'Politician', 'description': 'Politicians in the world, like Joe Biden'}, 'entity': {'id': '799022225751871488', 'name': 'Donald Trump', 'description': '45th US President, Donald Trump'}}]"
2022-06-20 05:12:29+00:00,1538751619528945664,"Humans apparently decided traumatic insemination with HIV, Ebola and SARS and maggots was salvation. It's a Church thing. Diet of Worms. Now go subpoena my Walgreens and Med Express shit in Delaware. You'll vomit at what Church is there. https://t.co/qlrg6wLXzG",,0,0,0,1528155132818608137,"[{'domain': {'id': '159', 'name': 'States', 'description': 'States, provinces, or prefectures, like California or Fukushima Prefecture'}, 'entity': {'id': '1004435667005333504', 'name': 'Delaware', 'description': 'Delaware'}}, {'domain': {'id': '45', 'name': 'Brand Vertical', 'description': 'Top level entities that describe a Brands industry'}, 'entity': {'id': '781974596706635776', 'name': 'Retail'}}, {'domain': {'id': '46', 'name': 'Brand Category', 'description': 'Categories within Brand Verticals that narrow down the scope of Brands'}, 'entity': {'id': '781974596157251584', 'name': 'Grocery/Convenience'}}, {'domain': {'id': '47', 'name': 'Brand', 'description': 'Brands and Companies'}, 'entity': {'id': '10026414254', 'name': 'Walgreens'}}, {'domain': {'id': '65', 'name': 'Interests and Hobbies Vertical', 'description': 'Top level interests and hobbies groupings, like Food or Travel'}, 'entity': {'id': '847868745150119936', 'name': 'Family & relationships', 'description': 'Hobbies and interests'}}]"
2022-06-20 05:05:16+00:00,1538749805588975617,i tried to watch a tv series inspired by the spread of ebola but it triggered me so badly i stopped after 10 minutes :'),,0,0,0,1460505343952252931,[]
2022-06-20 04:44:06+00:00,1538744478202142721,Ben the Great died from Ebola in 300 AD.,,0,0,0,4893877534,[]
2022-06-20 04:34:26+00:00,1538742045438640128,Ivan the Funny died from Ebola in 1582.,,0,0,0,4893877534,[]
2022-06-20 04:32:12+00:00,1538741482752028672,WERE SCROUNGING UP THE MOST GAG INDUCING EBOLA CAUSING EYE WATERING CRUSTY SHIT WR CAN FIND,,0,1,1,1337537261487992833,[]
2022-06-20 03:54:39+00:00,1538732031391289344,Eyes a haven for Ebola and other viruses https://t.co/8lTGpKyM9k,,0,0,0,1493187605823127556,[]
2022-06-20 03:46:35+00:00,1538730001326931968,There's a bountiful of Mt. Dew amid the Ebola pandemic,,0,0,0,1307842037253918721,"[{'domain': {'id': '45', 'name': 'Brand Vertical', 'description': 'Top level entities that describe a Brands industry'}, 'entity': {'id': '781974596740190208', 'name': 'CPG'}}, {'domain': {'id': '46', 'name': 'Brand Category', 'description': 'Categories within Brand Verticals that narrow down the scope of Brands'}, 'entity': {'id': '781974596656304128', 'name': 'Beverage'}}, {'domain': {'id': '47', 'name': 'Brand', 'description': 'Brands and Companies'}, 'entity': {'id': '10026377951', 'name': 'Mountain Dew'}}, {'domain': {'id': '65', 'name': 'Interests and Hobbies Vertical', 'description': 'Top level interests and hobbies groupings, like Food or Travel'}, 'entity': {'id': '834828264786898945', 'name': 'Drinks', 'description': 'Drinks'}}, {'domain': {'id': '66', 'name': 'Interests and Hobbies Category', 'description': 'A grouping of interests and hobbies entities, like Novelty Food or Destinations'}, 'entity': {'id': '834828445238431744', 'name': 'Generic Drinks', 'description': 'Generic Drinks'}}, {'domain': {'id': '67', 'name': 'Interests and Hobbies', 'description': 'Interests, opinions, and behaviors of individuals, groups, or cultures; like Speciality Cooking or Theme Parks'}, 'entity': {'id': '850143755873140737', 'name': 'Soda', 'description': 'Soda'}}, {'domain': {'id': '123', 'name': 'Ongoing News Story', 'description': ""Ongoing News Stories like 'Brexit'""}, 'entity': {'id': '1220701888179359745', 'name': 'COVID-19'}}, {'domain': {'id': '45', 'name': 'Brand Vertical', 'description': 'Top level entities that describe a Brands industry'}, 'entity': {'id': '781974596740190208', 'name': 'CPG'}}, {'domain': {'id': '46', 'name': 'Brand Category', 'description': 'Categories within Brand Verticals that narrow down the scope of Brands'}, 'entity': {'id': '781974596656304128', 'name': 'Beverage'}}, {'domain': {'id': '47', 'name': 'Brand', 'description': 'Brands and Companies'}, 'entity': {'id': '10026377951', 'name': 'Mountain Dew'}}]"
2022-06-20 03:28:03+00:00,1538725337760251904,"Key Russian lawmaker reveals illicit Ebola, smallpox research at US-run Ukraine biolabs
https://t.co/QQp49SWuaH",,0,0,0,1316899347087450113,"[{'domain': {'id': '123', 'name': 'Ongoing News Story', 'description': ""Ongoing News Stories like 'Brexit'""}, 'entity': {'id': '1484601166080081920', 'name': 'Russo-Ukrainian conflict'}}]"
2022-06-20 03:18:36+00:00,1538722960491806721,my arm itches I think i have Ebola,,0,0,0,2747394897,[]
2022-06-20 03:13:00+00:00,1538721552896000000,"Stop #coronavirus RT!

Call for the resignation of Tedros Adhanom Ghebreyesus, #WHO Director General
⬇⬇✒
https://t.co/NkaCorRIb5

#coronaviruschina #Pndahugger

#coronachan #corona_chan #コロナちゃん #コロナウィルスちゃん #Ebola #ebolachan #エボラちゃん
https://t.co/aH7GNGE3rw",,0,0,0,331916700,"[{'domain': {'id': '123', 'name': 'Ongoing News Story', 'description': ""Ongoing News Stories like 'Brexit'""}, 'entity': {'id': '1220701888179359745', 'name': 'COVID-19'}}]"
2022-06-20 02:39:52+00:00,1538713211112931328,"What is NIPAH Virus...or HENDRA Virus..and does it exist?? HEN-dra-NIPAH=HENIPAH
Did BC LAB SEND 33 Live EBOLA VIRUSES TO WUHAN :LAB... INCLUDING: HENIPAH? 
YES
Could this be used with ebola as a vaccine..injected worldwide bioterrorism weapoon on humanity?
YES https://t.co/KENPbZDbv3",,0,2,2,1488278303131807745,"[{'domain': {'id': '123', 'name': 'Ongoing News Story', 'description': ""Ongoing News Stories like 'Brexit'""}, 'entity': {'id': '1220701888179359745', 'name': 'COVID-19'}}]"
2022-06-20 02:11:46+00:00,1538706139709333509,"One time I was in a picture aka plagiarizing tweets so 1790's France get so it's Ebola
 She's the way.",,0,0,0,933163406751879168,"[{'domain': {'id': '46', 'name': 'Brand Category', 'description': 'Categories within Brand Verticals that narrow down the scope of Brands'}, 'entity': {'id': '781974596752842752', 'name': 'Services'}}, {'domain': {'id': '47', 'name': 'Brand', 'description': 'Brands and Companies'}, 'entity': {'id': '10045225402', 'name': 'Twitter'}}]"
2022-06-20 01:14:38+00:00,1538691764281741312,DIDN'T DIE FROM EBOLA EITHER: https://t.co/2z6uK5Oddp,,0,1,1,1301920782038134784,[]
2022-06-20 00:40:35+00:00,1538683193427218433,"because of my art block, I can only do sketches...but I have an idea for a next drawing that will talk about the Filovirus sisters!(chapter)
(I know there are other hemorrhagic diseases, but now I'll just focus on Filoviruses)
#art #originaloc #oc #ebola #Marburg #virus https://t.co/7oDhYGPuqs",,4,0,10,1454898669015248897,"[{'domain': {'id': '65', 'name': 'Interests and Hobbies Vertical', 'description': 'Top level interests and hobbies groupings, like Food or Travel'}, 'entity': {'id': '1280550787207147521', 'name': 'Arts & culture'}}, {'domain': {'id': '66', 'name': 'Interests and Hobbies Category', 'description': 'A grouping of interests and hobbies entities, like Novelty Food or Destinations'}, 'entity': {'id': '1046577790353428480', 'name': 'Visual arts', 'description': 'Visual Arts'}}, {'domain': {'id': '123', 'name': 'Ongoing News Story', 'description': ""Ongoing News Stories like 'Brexit'""}, 'entity': {'id': '1220701888179359745', 'name': 'COVID-19'}}, {'domain': {'id': '67', 'name': 'Interests and Hobbies', 'description': 'Interests, opinions, and behaviors of individuals, groups, or cultures; like Speciality Cooking or Theme Parks'}, 'entity': {'id': '847869251595542528', 'name': 'Drawing & illustration', 'description': 'Drawing and sketching'}}]"
2022-06-20 00:37:16+00:00,1538682359893184512,Study reveals risk factors for Ebola persistence in semen - https://t.co/Ic3LOpMfjJ,,0,0,0,360220091,[]
2022-06-19 23:19:13+00:00,1538662715690225664,tbh ebola is probably just another mononoke,,0,0,0,2864407958,[]
2022-06-19 22:53:05+00:00,1538656142242459648,"6-19-2022:  When vaccinating against Ebola, only a very small % of the total population receives the vaccine:
https://t.co/y8MD0wBZAw
https://t.co/6gcwXvViiq
https://t.co/BXUNw503td
https://t.co/MPzRIa9Li2
https://t.co/KNjOFZCdEP
https://t.co/nSPlRemTKv
https://t.co/Bgldm118Nf",,0,0,0,3268963694,"[{'domain': {'id': '123', 'name': 'Ongoing News Story', 'description': ""Ongoing News Stories like 'Brexit'""}, 'entity': {'id': '1220701888179359745', 'name': 'COVID-19'}}]"
2022-06-19 22:23:29+00:00,1538648692135186432,Going to finesse some random Ebola diagnosis so I can skip work and read ASOIAF https://t.co/oCF3FN0wEU,,0,1,7,1523057586634989569,[]
2022-06-19 22:12:54+00:00,1538646028836282368,"Stop #coronavirus

Call for the resignation of Tedros Adhanom Ghebreyesus, #WHO Director General
⬇⬇✒
https://t.co/NkaCorRIb5

#coronaviruschina #Pndahugger

#coronachan #corona_chan #コロナちゃん #コロナウィルスちゃん #WuhanVirus #武漢 #Ebola #ebolachan
https://t.co/VbjFzkepRI",,0,0,0,331916700,"[{'domain': {'id': '123', 'name': 'Ongoing News Story', 'description': ""Ongoing News Stories like 'Brexit'""}, 'entity': {'id': '1220701888179359745', 'name': 'COVID-19'}}]"
2022-06-19 21:50:09+00:00,1538640304420495360,africas funniest ebola videos,,0,0,0,227569911,[]
2022-06-19 21:29:36+00:00,1538635133200347138,Oh Man! You guys keep buying! Thank you! Lola Ebola | The 24th Street Sessions: Film Set https://t.co/5QuzhdmwgV https://t.co/t05aVhQyI8,,0,0,2,4417184178,[]
2022-06-19 21:20:17+00:00,1538632785539354624,"Unfortunately we can't live with SARS,MERS,HIV,Ebola
and other "" viruses "".
Viruses can evolve under different conditions like
Temperature and mutations
are emerging from different 
Living creatures .
The ability to enter inside the white cells and move
Under cover is scary ! https://t.co/VW5KFSYr5W https://t.co/U00IwaSoZC",,0,0,0,1007053954759446528,"[{'domain': {'id': '123', 'name': 'Ongoing News Story', 'description': ""Ongoing News Stories like 'Brexit'""}, 'entity': {'id': '1220701888179359745', 'name': 'COVID-19'}}, {'domain': {'id': '29', 'name': 'Events [Entity Service]', 'description': 'Entity Service related Events domain'}, 'entity': {'id': '1219057585707315201', 'name': 'COVID-19: Latest news updates from around the world', 'description': 'This page is a timeline of Tweets with the latest information and updates on COVID-19 from experts, journalists, health authorities and other trusted sources from around the world. For more on COVID-19, visit: twitter.com/explore/tabs/covid-19'}}]"
2022-06-19 21:14:09+00:00,1538631243125899266,"Our Bio surveillance, digital and testing platform is having the finishing touches by our development team. 
#isophene #zika #dengue #ebola #ClimateCrisis",,1,0,0,1530861493264297984,[]
2022-06-19 20:42:13+00:00,1538623207145603075,W.H.O. &amp; U.N. exposed in the Congo sex abuse Ebola crisis scandal https://t.co/7GJygXKIc4,,0,0,1,1438311602835570696,[]
2022-06-19 20:42:13+00:00,1538623205992284160,W.H.O. &amp; U.N. exposed in the Congo sex abuse Ebola crisis scandal https://t.co/Ydy2J0uNaD,,0,0,0,1135428483721629696,[]
2022-06-19 20:42:13+00:00,1538623205832896514,W.H.O. &amp; U.N. exposed in the Congo sex abuse Ebola crisis scandal https://t.co/WTFD87ce4n,,0,0,0,1467955288737296388,[]
2022-06-19 20:42:13+00:00,1538623205782474752,W.H.O. &amp; U.N. exposed in the Congo sex abuse Ebola crisis scandal https://t.co/i9pV8EIaJE,,0,0,0,748613567499251712,[]
2022-06-19 20:42:13+00:00,1538623205505638405,W.H.O. &amp; U.N. exposed in the Congo sex abuse Ebola crisis scandal https://t.co/IF32w6cJds,,0,0,0,1114196340362436609,[]
2022-06-19 20:42:13+00:00,1538623205191163912,W.H.O. &amp; U.N. exposed in the Congo sex abuse Ebola crisis scandal https://t.co/O44VKT4hvw,,0,0,0,884260730559754240,[]
2022-06-19 20:42:12+00:00,1538623203400114178,W.H.O. &amp; U.N. exposed in the Congo sex abuse Ebola crisis scandal https://t.co/DcsI85bjqY,,1,0,2,169199327,[]
2022-06-19 20:42:12+00:00,1538623203366555650,W.H.O. &amp; U.N. exposed in the Congo sex abuse Ebola crisis scandal https://t.co/86KVp8NjxU,,1,0,2,748117585770622976,[]
2022-06-19 20:42:12+00:00,1538623202469023745,W.H.O. &amp; U.N. exposed in the Congo sex abuse Ebola crisis scandal https://t.co/k0j7xwaeiv,,0,0,0,1467959277662920706,[]
2022-06-19 20:33:21+00:00,1538620977915088898,I have morning wood like a ebola dude I'm  so happy,,0,0,0,811424076799639552,[]
2022-06-19 20:30:44+00:00,1538620316385431552,if you seduce ebola she won't infect you,,0,0,0,916904114147155968,[]
2022-06-19 20:15:59+00:00,1538616604849602560,Study reveals risk factors for Ebola persistence in semen https://t.co/cPEqHbQ06C,,0,0,0,2181383449,[]
2022-06-19 20:13:31+00:00,1538615985166491648,"Not Luca treating Danica like she got covid, monkey pox and Ebola! Nah, it was too much!  #loveisland",,4,0,92,1302932964091867137,"[{'domain': {'id': '3', 'name': 'TV Shows', 'description': 'Television shows from around the world'}, 'entity': {'id': '10037936802', 'name': 'Love Island', 'description': 'Laura Whitmore hosts the show with the cast of hot young singles who have come looking for love. '}}, {'domain': {'id': '4', 'name': 'TV Episodes', 'description': 'Television show episodes'}, 'entity': {'id': '1535004977873027072', 'name': 'Love Island', 'description': 'Laura Whitmore hosts the show with the cast of hot young singles who have come looking for love. '}}, {'domain': {'id': '29', 'name': 'Events [Entity Service]', 'description': 'Entity Service related Events domain'}, 'entity': {'id': '1535004977873027072', 'name': 'Love Island', 'description': 'Laura Whitmore hosts the show with the cast of hot young singles who have come looking for love. '}}, {'domain': {'id': '123', 'name': 'Ongoing News Story', 'description': ""Ongoing News Stories like 'Brexit'""}, 'entity': {'id': '1220701888179359745', 'name': 'COVID-19'}}, {'domain': {'id': '172', 'name': 'Global TV Show', 'description': 'For global/conceptual TV shows without localization.'}, 'entity': {'id': '1223188430865092608', 'name': 'Love Island UK'}}]"
2022-06-19 19:24:53+00:00,1538603745998782464,"Key Russian lawmaker reveals illicit Ebola, smallpox research at US-run Ukraine biolabs - Russian Politics &amp; Diplomacy - TASS https://t.co/cuKzlrFXeS",,2,0,2,1491761341853483014,"[{'domain': {'id': '123', 'name': 'Ongoing News Story', 'description': ""Ongoing News Stories like 'Brexit'""}, 'entity': {'id': '1484601166080081920', 'name': 'Russo-Ukrainian conflict'}}]"
2022-06-19 19:17:10+00:00,1538601805688365056,"Yeah so many voted against her, she won the popular vote by over 3m. Clowns like you basically had a choice of the flu or Ebola &amp; you idiots went no I don’t like what the flu does to me, I’ll try Ebola despite being told repeatedly it would cost you the SC &amp; endanger democracy🤮 https://t.co/yUobCA1hCR https://t.co/JZEmV4aWL3",,0,1,1,1686122564,"[{'domain': {'id': '45', 'name': 'Brand Vertical', 'description': 'Top level entities that describe a Brands industry'}, 'entity': {'id': '781974596740190208', 'name': 'CPG'}}, {'domain': {'id': '46', 'name': 'Brand Category', 'description': 'Categories within Brand Verticals that narrow down the scope of Brands'}, 'entity': {'id': '781974596614361089', 'name': 'Home'}}, {'domain': {'id': '47', 'name': 'Brand', 'description': 'Brands and Companies'}, 'entity': {'id': '10029290710', 'name': '3M'}}, {'domain': {'id': '10', 'name': 'Person', 'description': 'Named people in the world like Nelson Mandela'}, 'entity': {'id': '10037721440', 'name': 'Hillary Clinton', 'description': 'Former First Lady of the United States Hillary Clinton'}}, {'domain': {'id': '35', 'name': 'Politician', 'description': 'Politicians in the world, like Joe Biden'}, 'entity': {'id': '10037721440', 'name': 'Hillary Clinton', 'description': 'Former First Lady of the United States Hillary Clinton'}}]"
2022-06-19 19:17:05+00:00,1538601782825345024,"With all of these diseases flying around I hope that cold sweats, ebola and monkeypox don't combine. Otherwise you could have a severe case of Sweat Ebolox.",,0,1,1,51477271,[]
2022-06-19 19:16:57+00:00,1538601750302601216,"Evolutionary biologist interviews leading European vaccinologist / virologist, former senior scientist w/ Gates and w/ GAVI, ebola response chief...on evolutionary consequences of releasing 'leaky' vaccines into a full-blown pandemic.... https://t.co/Zn5TtXflsf",,0,0,0,1238878103239180288,"[{'domain': {'id': '30', 'name': 'Entities [Entity Service]', 'description': 'Entity Service top level domain, every item that is in Entity Service should be in this domain'}, 'entity': {'id': '825047692124442624', 'name': 'Food', 'description': 'Food'}}, {'domain': {'id': '66', 'name': 'Interests and Hobbies Category', 'description': 'A grouping of interests and hobbies entities, like Novelty Food or Destinations'}, 'entity': {'id': '831530561680191490', 'name': 'Cooking', 'description': 'Cooking/Baking'}}, {'domain': {'id': '67', 'name': 'Interests and Hobbies', 'description': 'Interests, opinions, and behaviors of individuals, groups, or cultures; like Speciality Cooking or Theme Parks'}, 'entity': {'id': '826817907946450944', 'name': 'Food Blogs', 'description': 'Food Blogs'}}, {'domain': {'id': '67', 'name': 'Interests and Hobbies', 'description': 'Interests, opinions, and behaviors of individuals, groups, or cultures; like Speciality Cooking or Theme Parks'}, 'entity': {'id': '846736745517350912', 'name': 'Recipes', 'description': 'Recipies/Books'}}, {'domain': {'id': '30', 'name': 'Entities [Entity Service]', 'description': 'Entity Service top level domain, every item that is in Entity Service should be in this domain'}, 'entity': {'id': '1006588701193879552', 'name': 'Lunch', 'description': 'This entity tracks all conversations that mention lunch.'}}, {'domain': {'id': '123', 'name': 'Ongoing News Story', 'description': ""Ongoing News Stories like 'Brexit'""}, 'entity': {'id': '1220701888179359745', 'name': 'COVID-19'}}, {'domain': {'id': '152', 'name': 'Food', 'description': 'Topics about food, like Donuts or Brunch'}, 'entity': {'id': '825047692124442624', 'name': 'Food', 'description': 'Food'}}]"
2022-06-19 19:10:01+00:00,1538600002762817541,The latest Everything Prepping! https://t.co/5jCZcfEUaU #ebola #bantrophyhunting,,0,0,0,2806425639,[]
2022-06-19 19:01:45+00:00,1538597923809898497,The Ebola days were something else,,0,0,0,1536885521200422914,[]
2022-06-19 18:58:43+00:00,1538597160228298752,"As the world spirals toward chaos, Amy Cooper fights to stop the evolution of a deadly virus. When her beliefs disagree with the Administration’s agenda, she is put on trial. #virus #ebola #coronavirus #religion #persecution Midnight Hour: https://t.co/pRdHFd6wuE",,1,0,1,195016054,"[{'domain': {'id': '123', 'name': 'Ongoing News Story', 'description': ""Ongoing News Stories like 'Brexit'""}, 'entity': {'id': '1220701888179359745', 'name': 'COVID-19'}}, {'domain': {'id': '29', 'name': 'Events [Entity Service]', 'description': 'Entity Service related Events domain'}, 'entity': {'id': '1219057585707315201', 'name': 'COVID-19: Latest news updates from around the world', 'description': 'This page is a timeline of Tweets with the latest information and updates on COVID-19 from experts, journalists, health authorities and other trusted sources from around the world. For more on COVID-19, visit: twitter.com/explore/tabs/covid-19'}}]"
2022-06-19 18:51:51+00:00,1538595430694498304,"Question: why does every major virus supposedly originate from an animal? AIDS, Ebola, SARS, monkeypox, etc...?

Is it just to hide the fact that they’re all made in a lab?",,0,0,2,1280005925684645888,[]
2022-06-19 18:46:48+00:00,1538594163528286210,"Funny that Christian apologists now start with Intelligent Design. Claim that Ebola is very intelligently designed and forget that means humans subjected it are not.
After the ID detour quickly move to Jesus as the final/only truth.

 Scientific method? @RosaRubicon 

#GoodGod https://t.co/GS1vqkpDB5",,3,4,8,1387099188652134406,[]
2022-06-19 18:20:00+00:00,1538587415547363329,"You leave the club  with a different guy every night,
But worried about Ebola

Still it's none of my business",,0,0,1,1532359144107393031,[]
2022-06-19 18:17:35+00:00,1538586809076023300,Fighting Stigma — Study reveals risk factors for Ebola persistence in semen - Healio: All Subspecialties · Antimicrobials · Dermatology · Emerging Diseases · Gastrointestinal Infections · Hepatitis C · HIV/AIDS · Influenza · MRSA ... https://t.co/mQdxqU12Yl,,0,0,0,138418838,[]
