Datetime,Tweet Id,original_text,geo,retweet_count,reply_count,like_count,author_id,context_annotations
2022-05-09 18:34:25+00:00,1523733141290033152,Ebola stays lurking. #GH,,0,0,1,1093623267586465793,[]
2022-05-09 18:24:05+00:00,1523730540637134848,Scientists isolate close relative of Ebola with pandemic potential from bats https://t.co/IllEevVQOQ,,0,0,0,80902627,"[{'domain': {'id': '123', 'name': 'Ongoing News Story', 'description': ""Ongoing News Stories like 'Brexit'""}, 'entity': {'id': '1220701888179359745', 'name': 'COVID-19'}}]"
2022-05-09 18:23:39+00:00,1523730431681593344,Health solutions grad goes from Ebola crisis to improving health care: https://t.co/tlO7GLb9HM,,0,0,0,3145377968,[]
2022-05-09 17:57:52+00:00,1523723946528436224,"I woke up the morning following the 2016 election &amp; immediately made a list of all the ways tfg would get us all killed, including a pandemic (ebola had happened earlier). https://t.co/ze2ugWlYkP",,0,0,4,885539533734813696,"[{'domain': {'id': '123', 'name': 'Ongoing News Story', 'description': ""Ongoing News Stories like 'Brexit'""}, 'entity': {'id': '1220701888179359745', 'name': 'COVID-19'}}, {'domain': {'id': '46', 'name': 'Brand Category', 'description': 'Categories within Brand Verticals that narrow down the scope of Brands'}, 'entity': {'id': '781974596752842752', 'name': 'Services'}}, {'domain': {'id': '47', 'name': 'Brand', 'description': 'Brands and Companies'}, 'entity': {'id': '10045225402', 'name': 'Twitter'}}]"
2022-05-09 17:43:33+00:00,1523720342543380480,"-Peak oil
-Bees disappearing 
-Y2K
- Bird flu/Ebola/SARS (but COVID...)
- Net neutrality 

What else? https://t.co/7Nr4RC2BzB",,0,0,0,477982151,"[{'domain': {'id': '123', 'name': 'Ongoing News Story', 'description': ""Ongoing News Stories like 'Brexit'""}, 'entity': {'id': '1220701888179359745', 'name': 'COVID-19'}}, {'domain': {'id': '29', 'name': 'Events [Entity Service]', 'description': 'Entity Service related Events domain'}, 'entity': {'id': '1219057585707315201', 'name': 'COVID-19: Latest news updates from around the world', 'description': 'This page is a timeline of Tweets with the latest information and updates on COVID-19 from experts, journalists, health authorities and other trusted sources from around the world. For more on COVID-19, visit: twitter.com/explore/tabs/covid-19'}}]"
2022-05-09 17:34:58+00:00,1523718183634448384,i hope amber heard gets ebola,,0,0,1,536824968,"[{'domain': {'id': '10', 'name': 'Person', 'description': 'Named people in the world like Nelson Mandela'}, 'entity': {'id': '1037052736972320768', 'name': 'Amber Heard', 'description': 'Amber Heard'}}, {'domain': {'id': '56', 'name': 'Actor', 'description': 'An actor or actress in the world, like Kate Winslet or Leonardo DiCaprio'}, 'entity': {'id': '1037052736972320768', 'name': 'Amber Heard', 'description': 'Amber Heard'}}]"
2022-05-09 17:33:03+00:00,1523717699784024064,"The first three people to test positive for the #Ebola virus have died in Mbandaka, #DRCongo.

Humanitarian partners continue to support health authorities to prevent the spread of the disease.  https://t.co/AUnrQH2Yo6 https://t.co/VnKB3SH7Ii",,0,0,0,1100972197,"[{'domain': {'id': '29', 'name': 'Events [Entity Service]', 'description': 'Entity Service related Events domain'}, 'entity': {'id': '1517623051860414465', 'name': 'World Environment Day'}}, {'domain': {'id': '123', 'name': 'Ongoing News Story', 'description': ""Ongoing News Stories like 'Brexit'""}, 'entity': {'id': '1220701888179359745', 'name': 'COVID-19'}}]"
2022-05-09 17:14:57+00:00,1523713145088331779,Health solutions grad goes from Ebola crisis to improving health care: https://t.co/0livFxm1dF,,0,0,0,78137366,[]
2022-05-09 17:13:41+00:00,1523712824840638464,Did you know that pigeons are the main cause of Ischemic heart disease? Doctors from around the globe agreed that in 2019 pigeons came first in the cause of the condition that led to Ebola virus disease,,0,0,0,1093043265526411265,[]
2022-05-09 17:08:45+00:00,1523711584320774144,Close Relative of Ebola With Pandemic Potential from Bats Isolated https://t.co/zAelyICiOT,,0,0,0,1054279718,"[{'domain': {'id': '123', 'name': 'Ongoing News Story', 'description': ""Ongoing News Stories like 'Brexit'""}, 'entity': {'id': '1220701888179359745', 'name': 'COVID-19'}}]"
2022-05-09 17:05:10+00:00,1523710682159788033,"There's a reason I keep going back to 2014. 

Republicans successfully ran on an ISIS-Ebola-zombies-crossing-the-Southern-border campaign, not because most Americans are stupid, but because two-thirds of Americans didn't vote. https://t.co/CNMKvhHQjD",,2,1,12,758408231483944960,[]
2022-05-09 17:01:25+00:00,1523709739468824576,"UNICEF has already sent more than 22 tons of materials and supplies to help contain the spread of #Ebola in Mbandaka, Equateur province. https://t.co/92g8E05UB3",,7,1,38,560936253,"[{'domain': {'id': '45', 'name': 'Brand Vertical', 'description': 'Top level entities that describe a Brands industry'}, 'entity': {'id': '781974596157251587', 'name': 'Government/Education'}}, {'domain': {'id': '46', 'name': 'Brand Category', 'description': 'Categories within Brand Verticals that narrow down the scope of Brands'}, 'entity': {'id': '781974597226729473', 'name': 'Non-profit'}}, {'domain': {'id': '47', 'name': 'Brand', 'description': 'Brands and Companies'}, 'entity': {'id': '10026474874', 'name': 'UNICEF'}}, {'domain': {'id': '47', 'name': 'Brand', 'description': 'Brands and Companies'}, 'entity': {'id': '907295166406389760', 'name': 'UNICEF', 'description': 'UNICEF'}}]"
2022-05-09 16:57:43+00:00,1523708808891011073,"Agree,  Past behavior is a great indicator of future behavior 

When people are showing me who they are during this pandemic, I’m making notes &amp; cutting them off

Can’t afford to have them in our circles bc the next outbreak could be like Ebola &amp; I’m not taking my chances https://t.co/ZoXsaYHDss",,4,2,10,298619241,"[{'domain': {'id': '123', 'name': 'Ongoing News Story', 'description': ""Ongoing News Stories like 'Brexit'""}, 'entity': {'id': '1220701888179359745', 'name': 'COVID-19'}}]"
2022-05-09 16:55:45+00:00,1523708313988321288,"Your next pandemic brought to you by the US government and biolabs Pay attention to more than 1 issue it's connected
https://t.co/wnq5JDdLOD",,0,0,0,1422631251886841856,"[{'domain': {'id': '123', 'name': 'Ongoing News Story', 'description': ""Ongoing News Stories like 'Brexit'""}, 'entity': {'id': '1220701888179359745', 'name': 'COVID-19'}}]"
2022-05-09 16:45:57+00:00,1523705847209406465,"emergency response preparedness (erp)
#anthrax #ebola #attacks #shtf https://t.co/Le9mIEfM1j",,1,0,2,1477494301294800896,[]
2022-05-09 16:41:05+00:00,1523704622321348609,"Effect of Recombinant Vesicular Stomatitis Virus–Zaire Ebola Virus Vaccination on Ebola Virus Disease Illness and Death, Democratic Republic of the Congo https://t.co/Kz3wnR0Bk5 #CDC #Biotechnology #InfectiousDisease",,0,0,0,1129062072862437377,"[{'domain': {'id': '30', 'name': 'Entities [Entity Service]', 'description': 'Entity Service top level domain, every item that is in Entity Service should be in this domain'}, 'entity': {'id': '847896837532995585', 'name': 'Biology', 'description': 'Biology'}}, {'domain': {'id': '123', 'name': 'Ongoing News Story', 'description': ""Ongoing News Stories like 'Brexit'""}, 'entity': {'id': '1220701888179359745', 'name': 'COVID-19'}}]"
2022-05-09 16:23:33+00:00,1523700208483586049,"Prayer For Today: Monday, May 9, 2022

Today’s Special Prayer Is For Any Viruses Such As Coronavirus, Ebola, Flu, Pneumonia, And Zika As Well As Any Other Disease And Illnesses 

Prayer for Today and Tomorrow...
#dailyprayerfortodayforeveryone 
@  https://t.co/jLGehuZSTx https://t.co/TS66UgBVSV",,0,0,1,238403314,"[{'domain': {'id': '123', 'name': 'Ongoing News Story', 'description': ""Ongoing News Stories like 'Brexit'""}, 'entity': {'id': '1220701888179359745', 'name': 'COVID-19'}}]"
2022-05-09 16:18:57+00:00,1523699050649845760,"Population""Control,""#NewWorldOrder Style Intentionally reducing the bulk of the world's population through GENOCIDE via (GMOs), and bioengineered,weaponized disease organisms (AIDS, Ebola,Bird &amp; vaccines and other means of external transmission.https://t.co/axjBo9XRNH Must Read https://t.co/rzV5ir40Pm https://t.co/0jJx8RO9A3",,1,0,0,259121785,"[{'domain': {'id': '65', 'name': 'Interests and Hobbies Vertical', 'description': 'Top level interests and hobbies groupings, like Food or Travel'}, 'entity': {'id': '903303816698671104', 'name': 'Wellness and health', 'description': 'Wellness & Health'}}, {'domain': {'id': '66', 'name': 'Interests and Hobbies Category', 'description': 'A grouping of interests and hobbies entities, like Novelty Food or Destinations'}, 'entity': {'id': '918538847302041600', 'name': 'Community Health', 'description': 'Community Health'}}, {'domain': {'id': '67', 'name': 'Interests and Hobbies', 'description': 'Interests, opinions, and behaviors of individuals, groups, or cultures; like Speciality Cooking or Theme Parks'}, 'entity': {'id': '920768310152593408', 'name': 'Common Medication', 'description': 'Common Medication'}}, {'domain': {'id': '123', 'name': 'Ongoing News Story', 'description': ""Ongoing News Stories like 'Brexit'""}, 'entity': {'id': '1220701888179359745', 'name': 'COVID-19'}}]"
2022-05-09 16:16:08+00:00,1523698341305290752,"What is the difference between ""so basically you gotta expose yourself 5g frequencies for 60 seconds on 3 separate occasions and then you get ebola"" and ""basically you can't get on the SS Anne and then need somebody to trade you a surfing Pokémon and then Mew is under the truck?"" https://t.co/JLvYFhHfYj",,0,3,6,552927914,"[{'domain': {'id': '10', 'name': 'Person', 'description': 'Named people in the world like Nelson Mandela'}, 'entity': {'id': '936639544308334592', 'name': 'Michael Flynn', 'description': 'Former Director of the US Defense Intelligence Agency Michael Flynn'}}, {'domain': {'id': '35', 'name': 'Politician', 'description': 'Politicians in the world, like Joe Biden'}, 'entity': {'id': '936639544308334592', 'name': 'Michael Flynn', 'description': 'Former Director of the US Defense Intelligence Agency Michael Flynn'}}, {'domain': {'id': '45', 'name': 'Brand Vertical', 'description': 'Top level entities that describe a Brands industry'}, 'entity': {'id': '781974597310615553', 'name': 'Entertainment'}}, {'domain': {'id': '46', 'name': 'Brand Category', 'description': 'Categories within Brand Verticals that narrow down the scope of Brands'}, 'entity': {'id': '781974597218340864', 'name': 'Video Games'}}, {'domain': {'id': '65', 'name': 'Interests and Hobbies Vertical', 'description': 'Top level interests and hobbies groupings, like Food or Travel'}, 'entity': {'id': '903303816698671104', 'name': 'Wellness and health', 'description': 'Wellness & Health'}}, {'domain': {'id': '66', 'name': 'Interests and Hobbies Category', 'description': 'A grouping of interests and hobbies entities, like Novelty Food or Destinations'}, 'entity': {'id': '918538847302041600', 'name': 'Community Health', 'description': 'Community Health'}}, {'domain': {'id': '67', 'name': 'Interests and Hobbies', 'description': 'Interests, opinions, and behaviors of individuals, groups, or cultures; like Speciality Cooking or Theme Parks'}, 'entity': {'id': '920768310152593408', 'name': 'Common Medication', 'description': 'Common Medication'}}, {'domain': {'id': '30', 'name': 'Entities [Entity Service]', 'description': 'Entity Service top level domain, every item that is in Entity Service should be in this domain'}, 'entity': {'id': '1085628093627195392', 'name': '5G', 'description': '5G'}}, {'domain': {'id': '123', 'name': 'Ongoing News Story', 'description': ""Ongoing News Stories like 'Brexit'""}, 'entity': {'id': '1220701888179359745', 'name': 'COVID-19'}}, {'domain': {'id': '130', 'name': 'Multimedia Franchise', 'description': ""Franchises which span multiple forms of media like 'Harry Potter'""}, 'entity': {'id': '10045599546', 'name': 'Pokémon', 'description': 'This entity includes all conversation about the franchise, as well as any individual installments in the series, if applicable. **NOTE: Annotations redirected to domain 130 ONLY on 8/7/18.'}}, {'domain': {'id': '29', 'name': 'Events [Entity Service]', 'description': 'Entity Service related Events domain'}, 'entity': {'id': '1219057585707315201', 'name': 'COVID-19: Latest news updates from around the world', 'description': 'This page is a timeline of Tweets with the latest information and updates on COVID-19 from experts, journalists, health authorities and other trusted sources from around the world. For more on COVID-19, visit: twitter.com/explore/tabs/covid-19'}}]"
2022-05-09 16:13:47+00:00,1523697752714399744,"No, tomorrow Johnson will be back on his violin to report a return of Covid, or Norovirus ... or ebola... whatever ailment he believes will get him sympathy and off the hook ... again  ... Or have to dash off in his fake Superman outfit to support Ukraine. https://t.co/T5PNM6Fd4u",,0,0,1,928655398072176640,"[{'domain': {'id': '123', 'name': 'Ongoing News Story', 'description': ""Ongoing News Stories like 'Brexit'""}, 'entity': {'id': '1220701888179359745', 'name': 'COVID-19'}}, {'domain': {'id': '123', 'name': 'Ongoing News Story', 'description': ""Ongoing News Stories like 'Brexit'""}, 'entity': {'id': '1484601166080081920', 'name': 'Russo-Ukrainian conflict'}}, {'domain': {'id': '130', 'name': 'Multimedia Franchise', 'description': ""Franchises which span multiple forms of media like 'Harry Potter'""}, 'entity': {'id': '1080503141345374208', 'name': 'DC Extended Universe', 'description': 'DC Extended Universe (DCEU)'}}, {'domain': {'id': '66', 'name': 'Interests and Hobbies Category', 'description': 'A grouping of interests and hobbies entities, like Novelty Food or Destinations'}, 'entity': {'id': '898269510100164608', 'name': 'Violin', 'description': 'Violin'}}, {'domain': {'id': '66', 'name': 'Interests and Hobbies Category', 'description': 'A grouping of interests and hobbies entities, like Novelty Food or Destinations'}, 'entity': {'id': '1131990542198247424', 'name': 'Musical instruments', 'description': 'Musical Instruments'}}, {'domain': {'id': '173', 'name': 'Google Product Taxonomy', 'description': 'A product taxonomy created by Google'}, 'entity': {'id': '898269510100164608', 'name': 'Violin', 'description': 'Violin'}}]"
2022-05-09 16:12:55+00:00,1523697534463770624,"Stop #coronavirus RT!

Tedros you're fired!

Call for the resignation of Tedros Adhanom Ghebreyesus, #WHO Director General
⬇⬇✒
https://t.co/NkaCorRIb5
#Corona #Pndahugger
#coronachan #Simpsons #コロナちゃん #corona_chan
#Ebola #ebolachan #COVID19 #Wuflu
https://t.co/RFaHRJ6v8h",,0,0,0,331916700,"[{'domain': {'id': '3', 'name': 'TV Shows', 'description': 'Television shows from around the world'}, 'entity': {'id': '10000614173', 'name': 'The Simpsons', 'description': 'Homer and Marge Simpson raise Bart, Lisa and baby Maggie in Springfield.\n\nPhoto via @TheSimpsons'}}, {'domain': {'id': '3', 'name': 'TV Shows', 'description': 'Television shows from around the world'}, 'entity': {'id': '10027336172', 'name': 'The Simpsons', 'description': ""This long-running animated comedy focuses on the eponymous family in the town of Springfield in an unnamed U.S. state. The head of the Simpson family, Homer, is not a typical family man. A nuclear-plant employee, he does his best to lead his family but often finds that they are leading him. The family includes loving, blue-haired matriarch Marge, troublemaking son Bart, overachieving daughter Lisa and baby Maggie. Other Springfield residents include the family's religious neighbour, Ned Flanders, family physician Dr Hibbert, Moe the bartender and police chief Clancy Wiggum.""}}, {'domain': {'id': '3', 'name': 'TV Shows', 'description': 'Television shows from around the world'}, 'entity': {'id': '10028268905', 'name': 'Los Simpsons'}}, {'domain': {'id': '3', 'name': 'TV Shows', 'description': 'Television shows from around the world'}, 'entity': {'id': '10028414416', 'name': 'Os Simpsons'}}, {'domain': {'id': '3', 'name': 'TV Shows', 'description': 'Television shows from around the world'}, 'entity': {'id': '10028603605', 'name': 'Les Simpson', 'description': ""Elle met en scène les Simpson, stéréotype d'une famille de classe moyenne. Leurs aventures servent une satire du mode de vie américain.""}}, {'domain': {'id': '3', 'name': 'TV Shows', 'description': 'Television shows from around the world'}, 'entity': {'id': '10029697719', 'name': 'The Simpsons'}}, {'domain': {'id': '123', 'name': 'Ongoing News Story', 'description': ""Ongoing News Stories like 'Brexit'""}, 'entity': {'id': '1220701888179359745', 'name': 'COVID-19'}}, {'domain': {'id': '172', 'name': 'Global TV Show', 'description': 'For global/conceptual TV shows without localization.'}, 'entity': {'id': '1223191069757562880', 'name': 'The Simpsons'}}]"
2022-05-09 16:06:51+00:00,1523696006612733952,Health solutions grad goes from Ebola crisis to improving health care: https://t.co/sgr43GGcnv,{'place_id': '44d207663001f00b'},0,0,0,21351881,[]
2022-05-09 16:01:04+00:00,1523694549830455305,"Scientists from @Medway_Pharmacy have isolated the Lloviu virus for the first time. #Virus #Virology #Immunology
https://t.co/ARTwEQdvTt",,0,0,0,174683705,"[{'domain': {'id': '30', 'name': 'Entities [Entity Service]', 'description': 'Entity Service top level domain, every item that is in Entity Service should be in this domain'}, 'entity': {'id': '854692455005921281', 'name': 'Science', 'description': 'Science'}}, {'domain': {'id': '30', 'name': 'Entities [Entity Service]', 'description': 'Entity Service top level domain, every item that is in Entity Service should be in this domain'}, 'entity': {'id': '847896837532995585', 'name': 'Biology', 'description': 'Biology'}}, {'domain': {'id': '123', 'name': 'Ongoing News Story', 'description': ""Ongoing News Stories like 'Brexit'""}, 'entity': {'id': '1220701888179359745', 'name': 'COVID-19'}}]"
2022-05-09 15:52:22+00:00,1523692361255047169,"The thing about ebola was that Hawaii had Ton of superbugs. Flesh eating viruses affected children, elderly, and adults. I knew 3 people hospitalized with 3 DIFFERENT flesh eaters. 
International tourists.
Leptospirosis in water, other biotoxins, and Monsanto &amp; ExoLabs https://t.co/w5cCeNTMRu",,0,0,0,4871688614,"[{'domain': {'id': '47', 'name': 'Brand', 'description': 'Brands and Companies'}, 'entity': {'id': '1065655657548832768', 'name': 'NPR', 'description': 'NPR'}}, {'domain': {'id': '45', 'name': 'Brand Vertical', 'description': 'Top level entities that describe a Brands industry'}, 'entity': {'id': '781974596740190208', 'name': 'CPG'}}, {'domain': {'id': '47', 'name': 'Brand', 'description': 'Brands and Companies'}, 'entity': {'id': '10043471663', 'name': 'Monsanto'}}, {'domain': {'id': '30', 'name': 'Entities [Entity Service]', 'description': 'Entity Service top level domain, every item that is in Entity Service should be in this domain'}, 'entity': {'id': '825047692124442624', 'name': 'Food', 'description': 'Food'}}, {'domain': {'id': '159', 'name': 'States', 'description': 'States, provinces, or prefectures, like California or Fukushima Prefecture'}, 'entity': {'id': '856861547208916992', 'name': 'Hawaii', 'description': 'Hawaii'}}]"
2022-05-09 15:44:05+00:00,1523690276165849088,"Fighting Stigma — J&amp;J ends hepatitis B and HPV portions of Bavarian Nordic collab - Endpoints News: J&amp;J and the Danish vaccines biotech will continue their tie-up as it relates to HIV and Ebola, Janssen said Monday. The duo announced the HPV pact ... https://t.co/N49YJw9qUs",,0,0,0,138418838,"[{'domain': {'id': '30', 'name': 'Entities [Entity Service]', 'description': 'Entity Service top level domain, every item that is in Entity Service should be in this domain'}, 'entity': {'id': '847896837532995585', 'name': 'Biology', 'description': 'Biology'}}, {'domain': {'id': '123', 'name': 'Ongoing News Story', 'description': ""Ongoing News Stories like 'Brexit'""}, 'entity': {'id': '1220701888179359745', 'name': 'COVID-19'}}]"
2022-05-09 15:34:27+00:00,1523687851896242176,"J&amp;J is axing two preclinical, Bavarian Nordic-partnered HPV and hepatitis B programs but holding onto its HIV and Ebola collaborations.
https://t.co/7IjUdZ4Cbg",,0,1,1,18294197,[]
2022-05-09 15:33:31+00:00,1523687618600259584,What is the govt doing about the reported new cases of Ebola in Africa please?,,0,1,0,200088029,[]
2022-05-09 15:21:31+00:00,1523684597971963904,"DRC - Ebola update: ""..No new confirmed cases were notified as of 07/05/2022; The total remains 3 confirmed cases (including 2 male and 1 female); The overall lethality is 100.0% (3/3).."" https://t.co/KwhMOiFeJK h/t Pathfinder",,4,0,7,19087092,"[{'domain': {'id': '123', 'name': 'Ongoing News Story', 'description': ""Ongoing News Stories like 'Brexit'""}, 'entity': {'id': '1220701888179359745', 'name': 'COVID-19'}}]"
2022-05-09 15:20:37+00:00,1523684373249531904,"What happened to Ebola? Zika? Murder hornets? Swine flu? H1N1? BLM? Antifa? Covid? Ukraine? HB laptop? Steele dossier? 9/11? WMD? Gulf of Tonkin?

Fear not.
You've been lied to.

Above is not all.
Much more.
Time will show.
Know your enemy.",,0,0,10,1249359103492833280,"[{'domain': {'id': '123', 'name': 'Ongoing News Story', 'description': ""Ongoing News Stories like 'Brexit'""}, 'entity': {'id': '1220701888179359745', 'name': 'COVID-19'}}, {'domain': {'id': '123', 'name': 'Ongoing News Story', 'description': ""Ongoing News Stories like 'Brexit'""}, 'entity': {'id': '1484601166080081920', 'name': 'Russo-Ukrainian conflict'}}]"
2022-05-09 15:20:34+00:00,1523684357768384512,"Ebola relative, Lloviu virus, isolated from Schreiber’s bats in Hungary https://t.co/JXu4UWTKgV",,3,0,1,285833395,[]
2022-05-09 15:14:45+00:00,1523682893163548672,"J&amp;J backs out of 2 partnerships with Bavarian Nordic, ending collaboration agreements with the Danish #drugmaker for research into #vaccines for #hepatitisB and #humanpapillomavirus https://t.co/lK3FaeQvzx #HPV #drugmakers #vaccine #HIV #Ebola",,1,0,0,67408637,"[{'domain': {'id': '123', 'name': 'Ongoing News Story', 'description': ""Ongoing News Stories like 'Brexit'""}, 'entity': {'id': '1220701888179359745', 'name': 'COVID-19'}}]"
2022-05-09 15:14:25+00:00,1523682809092911105,Ooohhhh I'm so sick I have ebola lol,,0,0,2,1126670922348421121,[]
2022-05-09 14:51:23+00:00,1523677013860569089,“This is Beyond Shocking” – American Frontline Doctors on FDA Approval of Failed Ebola Drug Remdesivir By the FDA for “Treatment” of Covid-19 in Babies https://t.co/hKWQPIGGZ6 #politics,,0,0,0,994242738676789249,"[{'domain': {'id': '123', 'name': 'Ongoing News Story', 'description': ""Ongoing News Stories like 'Brexit'""}, 'entity': {'id': '1220701888179359745', 'name': 'COVID-19'}}]"
2022-05-09 14:22:56+00:00,1523669853873266689,"Was about to enter secondary school,Ebola happened 
I was about to enter uni, corona virus wanted to end the world
Ahh as I just enter uni las las,assu strike
Normally na
Now I know school isn’t for me
Lemme go and really invest in my ashawo work well
#ASSU thank you sha😒",,3,5,23,1305911911880568835,[]
2022-05-09 14:19:00+00:00,1523668866064592896,How to give Vanitas Drop kicking ebola,,0,0,0,2806258580,[]
2022-05-09 14:10:39+00:00,1523666764286263297,LLOVIU virus isolated. UK scientists did it in Hungary! May be they didn't want the next pandemic to originate in UK! So Hungarians will be guinea pigs? @BalazsOrban_HU. The PM agreed to this? Next pandemic on the way? @Ayjchan @MonaRahalkar @gdemaneuf @Florin_Uncovers #ebola https://t.co/szorSkYLP0,,0,1,1,1315359976026636289,"[{'domain': {'id': '123', 'name': 'Ongoing News Story', 'description': ""Ongoing News Stories like 'Brexit'""}, 'entity': {'id': '1220701888179359745', 'name': 'COVID-19'}}]"
2022-05-09 13:57:45+00:00,1523663517483958273,"Canada must have a different strain of Covid that I don't know because I can't figure out how the PM can travel overseas, attend &amp; encounter public officials maskless disregard public health measures but in Canada behave as if Ebola is ravaging the nation. 😒",,21,2,67,2155786158,"[{'domain': {'id': '123', 'name': 'Ongoing News Story', 'description': ""Ongoing News Stories like 'Brexit'""}, 'entity': {'id': '1220701888179359745', 'name': 'COVID-19'}}, {'domain': {'id': '29', 'name': 'Events [Entity Service]', 'description': 'Entity Service related Events domain'}, 'entity': {'id': '1219057585707315201', 'name': 'COVID-19: Latest news updates from around the world', 'description': 'This page is a timeline of Tweets with the latest information and updates on COVID-19 from experts, journalists, health authorities and other trusted sources from around the world. For more on COVID-19, visit: twitter.com/explore/tabs/covid-19'}}]"
2022-05-09 13:48:59+00:00,1523661309753331714,How to spread ebola to Vanitas,,0,0,0,2806258580,[]
2022-05-09 13:44:39+00:00,1523660219250663424,"Fighting Stigma — J&amp;J ducks out of Bavarian Nordic vaccine partnerships - - Pharmaphorum: J&amp;J's Janssen pharmaceuticals division said it will continue to work with the Danish biotech on vaccines targeting HIV and Ebola, ... https://t.co/NrEhdqhbU5",,0,0,0,138418838,"[{'domain': {'id': '30', 'name': 'Entities [Entity Service]', 'description': 'Entity Service top level domain, every item that is in Entity Service should be in this domain'}, 'entity': {'id': '847896837532995585', 'name': 'Biology', 'description': 'Biology'}}, {'domain': {'id': '123', 'name': 'Ongoing News Story', 'description': ""Ongoing News Stories like 'Brexit'""}, 'entity': {'id': '1220701888179359745', 'name': 'COVID-19'}}]"
2022-05-09 13:30:46+00:00,1523656727027417089,if you seduce ebola she won't infect you,,0,0,0,916904114147155968,[]
