Datetime,Tweet Id,original_text,geo,retweet_count,reply_count,like_count,author_id,context_annotations
2022-03-25 21:08:41+00:00,1507464511649095680,Indian-origin researcher helps in Ebola vaccine trials https://t.co/QnxotrjQoM,,0,0,0,1023424088948133889,"[{'domain': {'id': '123', 'name': 'Ongoing News Story', 'description': ""Ongoing News Stories like 'Brexit'""}, 'entity': {'id': '1220701888179359745', 'name': 'COVID-19'}}]"
2022-03-25 21:06:01+00:00,1507463841130905604,"ANTI-VAXXERS SLIGHTLY LESS ADAMANT ABOUT RESISTING VACCINE FOR EBOLA

As the horrifying Ebola virus continues to pop up around the world, anti-vaccine protesters are in two minds, which is two minds more than they had previously.",,0,0,0,1323741198,"[{'domain': {'id': '123', 'name': 'Ongoing News Story', 'description': ""Ongoing News Stories like 'Brexit'""}, 'entity': {'id': '1220701888179359745', 'name': 'COVID-19'}}]"
2022-03-25 20:53:31+00:00,1507460696228909058,"We are still treating Covid like Ebola when it has become the flu. No wonder productivity is so weak, and the NHS performing so badly. When will the hysteria end?",,358,191,3100,86095091,"[{'domain': {'id': '88', 'name': 'Political Body', 'description': 'A section of a government, like The Supreme Court'}, 'entity': {'id': '1062025800591896576', 'name': 'National Health Service', 'description': 'National Health Service'}}, {'domain': {'id': '123', 'name': 'Ongoing News Story', 'description': ""Ongoing News Stories like 'Brexit'""}, 'entity': {'id': '1220701888179359745', 'name': 'COVID-19'}}]"
2022-03-25 20:51:56+00:00,1507460295350009862,Woman in UK diagnosed with potentially fatal Ebola-like disease  https://t.co/ZUs5GMlkTx,,0,0,0,20392809,[]
2022-03-25 20:51:42+00:00,1507460235627319296,"For background on breaking news now.

https://t.co/NAgzEzDab2",,0,1,1,755930626566389760,[]
2022-03-25 20:50:09+00:00,1507459848107016193,africas funniest ebola videos,,0,0,0,227569911,[]
2022-03-25 20:47:56+00:00,1507459289862275073,The road to effective and accessible antibody therapies against Ebola virus  https://t.co/qrVdL2ychj,,0,0,0,2414645220,[]
2022-03-25 20:44:14+00:00,1507458358546034693,Dude said he knows a guy who chills with monkeys called Tarzan but now has Ebola 😂😂😂 https://t.co/DixFzRTsEy,,0,0,0,1496625006889033730,[]
2022-03-25 20:25:50+00:00,1507453727602798592,"https://t.co/0mraNdb3hX?
*ANTI-VAXXERS SLIGHTLY LESS ADAMANT ABOUT RESISTING VACCINE FOR EBOLA
*AUSTRALIA DECLARES WAR ON SPACE",,0,0,0,933608377,"[{'domain': {'id': '123', 'name': 'Ongoing News Story', 'description': ""Ongoing News Stories like 'Brexit'""}, 'entity': {'id': '1220701888179359745', 'name': 'COVID-19'}}]"
2022-03-25 20:11:47+00:00,1507450191015649283,"In addition to #human #mobility analyses via our @UN #IMWG Ohana v a v #Ukraine🇺🇦response, the following is compelling per the @UNGlobalPulse #CDR innovations during #Ebola response &amp; mahalo @crisisreadiness @IOMUkraine @humdata @JTeran2000 @densaer @JenniferChan7 @simulacrandrew https://t.co/2Ez9upqAfD",,1,0,1,106504800,"[{'domain': {'id': '45', 'name': 'Brand Vertical', 'description': 'Top level entities that describe a Brands industry'}, 'entity': {'id': '781974596157251587', 'name': 'Government/Education'}}, {'domain': {'id': '46', 'name': 'Brand Category', 'description': 'Categories within Brand Verticals that narrow down the scope of Brands'}, 'entity': {'id': '781974597226729473', 'name': 'Non-profit'}}, {'domain': {'id': '47', 'name': 'Brand', 'description': 'Brands and Companies'}, 'entity': {'id': '10044311823', 'name': 'United Nations', 'description': 'Global conversation about the United Nations and all related efforts.'}}, {'domain': {'id': '88', 'name': 'Political Body', 'description': 'A section of a government, like The Supreme Court'}, 'entity': {'id': '10044311823', 'name': 'United Nations', 'description': 'Global conversation about the United Nations and all related efforts.'}}]"
2022-03-25 19:55:53+00:00,1507446190983593986,Woman in UK diagnosed with new Ebola-like disease with 40% fatality rate – The Mirror https://t.co/qLeCyMLs2g #norovirus,,0,0,0,2606891816,"[{'domain': {'id': '123', 'name': 'Ongoing News Story', 'description': ""Ongoing News Stories like 'Brexit'""}, 'entity': {'id': '1220701888179359745', 'name': 'COVID-19'}}]"
2022-03-25 19:50:42+00:00,1507444884986339343,"That was Regeneron, which the government is fighting 2 keep doctors from getting. They won’t  allow anything but Remdesivir 2b  used in hospitals, which had a 53% death rate in the Ebola trials compared 2 Regeneron that had an 80-90% SUCESS rate. Why would the govt do this to us? https://t.co/0jowWhOkLX",,0,0,1,1505887941788377088,"[{'domain': {'id': '10', 'name': 'Person', 'description': 'Named people in the world like Nelson Mandela'}, 'entity': {'id': '799022225751871488', 'name': 'Donald Trump', 'description': 'US President Donald Trump'}}, {'domain': {'id': '35', 'name': 'Politician', 'description': 'Politicians in the world, like Joe Biden'}, 'entity': {'id': '799022225751871488', 'name': 'Donald Trump', 'description': 'US President Donald Trump'}}, {'domain': {'id': '123', 'name': 'Ongoing News Story', 'description': ""Ongoing News Stories like 'Brexit'""}, 'entity': {'id': '1220701888179359745', 'name': 'COVID-19'}}]"
2022-03-25 19:48:22+00:00,1507444297947353088,#sprina fans to Ebola if she is pregnant #gh https://t.co/xdg1fgdkQm,,3,0,12,46875251,[]
2022-03-25 19:44:15+00:00,1507443263283896330,"Fauci knew it had a 53% death rate in the Ebola trials, yet he pushed to get it to be the ONLY thing that could be used in hospitals. And the hospitals got big bonuses for using it and got big bonus for every covid death. https://t.co/qzLAPQWbRe https://t.co/bKjtVyEOfj",,0,0,0,1505887941788377088,"[{'domain': {'id': '123', 'name': 'Ongoing News Story', 'description': ""Ongoing News Stories like 'Brexit'""}, 'entity': {'id': '1220701888179359745', 'name': 'COVID-19'}}]"
2022-03-25 19:37:57+00:00,1507441676079575043,"Human Ebola Outbreak Resulting from Direct Exposure to Fruit Bats in Luebo, Democratic Republic
of Congo, 2007
Eric M. Leroy,1,2 Alain Epelboin,3 Vital Mondonge,4 Xavier Pourrut,1,2 Jean-Paul Gonzalez,1 Jean-Jacques Muyembe-Tamfum,5 and Pierre Formenty6

https://t.co/Pc9jGj2wmr",,1,1,0,1179464402791219206,[]
2022-03-25 19:34:31+00:00,1507440811805454340,"*Professor Naana Jane Opoku-Agyemang writes.....*✍

We know there was economic meltdown between 2008 and 2012 that finally resulted in the wars in Libya and Syria and Iraq. Russia and Ukraine conflict happened first in 2014. These and other events such as Ebola outbreak in",,0,1,1,1188559845634592768,[]
2022-03-25 19:19:45+00:00,1507437097728290820,"People with compromised immune systems can mask up, like they always have.  And this ain’t the Ebola virus you pinhead.  I’ve said it since day one, the only way to prevent the spread of a deadly airborne pathogen is avoidance or an SCBA. https://t.co/PoBDo6wUws",,0,0,3,1125538657090318339,"[{'domain': {'id': '45', 'name': 'Brand Vertical', 'description': 'Top level entities that describe a Brands industry'}, 'entity': {'id': '781974596161376261', 'name': 'Dining'}}, {'domain': {'id': '46', 'name': 'Brand Category', 'description': 'Categories within Brand Verticals that narrow down the scope of Brands'}, 'entity': {'id': '781974597105164288', 'name': 'Casual'}}, {'domain': {'id': '47', 'name': 'Brand', 'description': 'Brands and Companies'}, 'entity': {'id': '10026378231', 'name': 'Red Lobster'}}, {'domain': {'id': '30', 'name': 'Entities [Entity Service]', 'description': 'Entity Service top level domain, every item that is in Entity Service should be in this domain'}, 'entity': {'id': '825047692124442624', 'name': 'Food', 'description': 'Food'}}, {'domain': {'id': '66', 'name': 'Interests and Hobbies Category', 'description': 'A grouping of interests and hobbies entities, like Novelty Food or Destinations'}, 'entity': {'id': '860133563332648963', 'name': 'Cuisines', 'description': 'Cuisines'}}, {'domain': {'id': '30', 'name': 'Entities [Entity Service]', 'description': 'Entity Service top level domain, every item that is in Entity Service should be in this domain'}, 'entity': {'id': '860133974043049985', 'name': 'American cuisine', 'description': 'American Cuisine'}}, {'domain': {'id': '45', 'name': 'Brand Vertical', 'description': 'Top level entities that describe a Brands industry'}, 'entity': {'id': '781974596161376261', 'name': 'Dining'}}, {'domain': {'id': '46', 'name': 'Brand Category', 'description': 'Categories within Brand Verticals that narrow down the scope of Brands'}, 'entity': {'id': '781974597105164288', 'name': 'Casual'}}, {'domain': {'id': '47', 'name': 'Brand', 'description': 'Brands and Companies'}, 'entity': {'id': '10026378231', 'name': 'Red Lobster'}}]"
2022-03-25 18:54:24+00:00,1507430718820999172,"So, is a teary eyed ""Mr. Cassidine, will you help me?"" 
Fom Ebola going to lead her to cry in his arms and he be  stupid enough to have sex with her?? And then she really gets pregnant? 
So stupid.#GH https://t.co/Pas61tJuDF",,0,0,0,608595956,[]
2022-03-25 18:52:53+00:00,1507430336325685262,Ebola coming to Fake Nik with them crocodile tears. #GH https://t.co/wocFPj6fDv,,0,0,3,1433468902336565249,[]
2022-03-25 18:46:42+00:00,1507428781136367619,"Woman in UK diagnosed with new Ebola-like disease that has 40% death rate
https://t.co/X2yoFJfcZR",,0,0,0,1171351583973675008,[]
2022-03-25 18:46:29+00:00,1507428726853750786,"This cough I got skrong asf. 
#Ebola",,0,1,0,949188496656355328,[]
2022-03-25 18:46:07+00:00,1507428635313008641,There's a amplitude of Fanta amid the Ebola pandemic,,0,0,0,1307842037253918721,"[{'domain': {'id': '123', 'name': 'Ongoing News Story', 'description': ""Ongoing News Stories like 'Brexit'""}, 'entity': {'id': '1220701888179359745', 'name': 'COVID-19'}}]"
2022-03-25 18:42:39+00:00,1507427762545565706,Here comes Trina’s frame up with the PCPD thanks to Ebola!  #GH,,0,0,0,22952395,[]
2022-03-25 18:23:50+00:00,1507423024634552323,"It's okay, the NHS will pick up the bill.

Woman in UK diagnosed with new Ebola-like disease with 40% fatality rate

https://t.co/0Ax1p9M9dc",,8,1,10,1200060765203509251,"[{'domain': {'id': '88', 'name': 'Political Body', 'description': 'A section of a government, like The Supreme Court'}, 'entity': {'id': '1062025800591896576', 'name': 'National Health Service', 'description': 'National Health Service'}}, {'domain': {'id': '123', 'name': 'Ongoing News Story', 'description': ""Ongoing News Stories like 'Brexit'""}, 'entity': {'id': '1220701888179359745', 'name': 'COVID-19'}}]"
2022-03-25 18:00:04+00:00,1507417046455558145,Can someone please slap Ebola like this without getting in trouble for it that’s all I’m asking 🤷🏼‍♀️ https://t.co/div1gbJ4zQ,,0,0,1,1507190000579923969,[]
2022-03-25 18:00:02+00:00,1507417034161762310,"There were previously only two solitary cases on record, one in 2012 and again in 2014.
https://t.co/9XFGHq8gjy",,0,0,0,1854580777,[]
2022-03-25 17:58:56+00:00,1507416757232799746,Damn... Europe may become ebola infested https://t.co/hddtfJYTs3,,0,0,1,1217558193368436737,"[{'domain': {'id': '123', 'name': 'Ongoing News Story', 'description': ""Ongoing News Stories like 'Brexit'""}, 'entity': {'id': '1220701888179359745', 'name': 'COVID-19'}}]"
2022-03-25 17:55:01+00:00,1507415773995847684,It’s interesting that they think other countries were more prepared. We deal with so many diseases and even contained Ebola at some point. https://t.co/E5RHlETKli,,0,1,2,198456311,"[{'domain': {'id': '123', 'name': 'Ongoing News Story', 'description': ""Ongoing News Stories like 'Brexit'""}, 'entity': {'id': '1220701888179359745', 'name': 'COVID-19'}}]"
2022-03-25 17:54:11+00:00,1507415563567517704,Woman in UK diagnosed with potentially fatal Ebola-like disease | The ⁦@Independent⁩ via ⁦@PersburoUNN⁩  https://t.co/RoHaekhDA1,,0,0,0,219992884,"[{'domain': {'id': '46', 'name': 'Brand Category', 'description': 'Categories within Brand Verticals that narrow down the scope of Brands'}, 'entity': {'id': '781974596157181956', 'name': 'Online Site'}}, {'domain': {'id': '47', 'name': 'Brand', 'description': 'Brands and Companies'}, 'entity': {'id': '1066081290531684352', 'name': 'The Independent', 'description': 'The Independent'}}]"
2022-03-25 17:46:22+00:00,1507413597730660353,Check out The Hot Zone Ebola Zaire TV-Show Prop Screen Used USAMRIID ID D.Wood  https://t.co/o9UesAWpTV via @eBay,,0,0,0,757103938696982528,"[{'domain': {'id': '45', 'name': 'Brand Vertical', 'description': 'Top level entities that describe a Brands industry'}, 'entity': {'id': '781974596706635776', 'name': 'Retail'}}, {'domain': {'id': '46', 'name': 'Brand Category', 'description': 'Categories within Brand Verticals that narrow down the scope of Brands'}, 'entity': {'id': '783335558466506752', 'name': 'Online'}}, {'domain': {'id': '47', 'name': 'Brand', 'description': 'Brands and Companies'}, 'entity': {'id': '10032682179', 'name': 'eBay'}}]"
2022-03-25 17:44:04+00:00,1507413016542945281,I am positive your view would change if a plane load of Africans with Ebola were insisting on landing in Canada and didn’t want to be tested or quarantined for public safety. There is no right for one to affect another’s medical/health safety. https://t.co/XVBy985uqI,,0,1,0,102156549,"[{'domain': {'id': '123', 'name': 'Ongoing News Story', 'description': ""Ongoing News Stories like 'Brexit'""}, 'entity': {'id': '1220701888179359745', 'name': 'COVID-19'}}]"
2022-03-25 17:43:33+00:00,1507412888415178754,Mike Trout the Quiet died from Ebola in 1 BC.,,0,0,0,4893877534,"[{'domain': {'id': '3', 'name': 'TV Shows', 'description': 'Television shows from around the world'}, 'entity': {'id': '10001466882', 'name': 'MLB Baseball', 'description': 'All the latest action from Major League Baseball.'}}, {'domain': {'id': '6', 'name': 'Sports Event'}, 'entity': {'id': '1488301394985558016', 'name': 'Diamondbacks at Angels'}}, {'domain': {'id': '6', 'name': 'Sports Event'}, 'entity': {'id': '1502407606693892096', 'name': 'Angels at Diamondbacks'}}, {'domain': {'id': '11', 'name': 'Sport', 'description': 'Types of sports, like soccer and basketball'}, 'entity': {'id': '769193663230468096', 'name': 'Baseball'}}, {'domain': {'id': '26', 'name': 'Sports League', 'description': ''}, 'entity': {'id': '769193602169704448', 'name': 'MLB'}}, {'domain': {'id': '60', 'name': 'Athlete', 'description': 'An athlete in the world, like Serena Williams or Lionel Messi'}, 'entity': {'id': '769194394402435072', 'name': 'Mike Trout'}}]"
2022-03-25 17:43:26+00:00,1507412859390767111,Right 1. Ebola literally drugs Trina nothing happened to her 2. Trina was literally passed out the rest of the time 3. It’s an essential part in proving Trina innocent https://t.co/52OkKvi3R4 https://t.co/TmI2PU373A,,0,0,0,1507190000579923969,[]
2022-03-25 17:33:17+00:00,1507410305823002630,"Is it wrong that I wish cancer or ebola upon mine enemies?

Because I do. Every damn day.",,0,0,0,1374021854319546373,[]
2022-03-25 17:27:04+00:00,1507408739988606979,Ebola Outbreak in West Africa — Global Issues https://t.co/a6Nrvz8l70,,0,0,0,1468874695193751552,[]
2022-03-25 17:23:54+00:00,1507407942819393536,What happened to Ebola 👀 y’all just gone release that one with a part 2,,0,0,1,1957846652,[]
2022-03-25 17:18:34+00:00,1507406599438372865,my arm itches I think i have Ebola,,0,0,0,2747394897,[]
2022-03-25 17:16:11+00:00,1507406000948621312,There's a bountiful of Sprite amid the Ebola pandemic,,0,0,0,1307842037253918721,"[{'domain': {'id': '45', 'name': 'Brand Vertical', 'description': 'Top level entities that describe a Brands industry'}, 'entity': {'id': '781974596740190208', 'name': 'CPG'}}, {'domain': {'id': '46', 'name': 'Brand Category', 'description': 'Categories within Brand Verticals that narrow down the scope of Brands'}, 'entity': {'id': '781974596656304128', 'name': 'Beverage'}}, {'domain': {'id': '47', 'name': 'Brand', 'description': 'Brands and Companies'}, 'entity': {'id': '10026302007', 'name': 'Sprite'}}, {'domain': {'id': '65', 'name': 'Interests and Hobbies Vertical', 'description': 'Top level interests and hobbies groupings, like Food or Travel'}, 'entity': {'id': '834828264786898945', 'name': 'Drinks', 'description': 'Drinks'}}, {'domain': {'id': '66', 'name': 'Interests and Hobbies Category', 'description': 'A grouping of interests and hobbies entities, like Novelty Food or Destinations'}, 'entity': {'id': '834828445238431744', 'name': 'Generic Drinks', 'description': 'Generic Drinks'}}, {'domain': {'id': '67', 'name': 'Interests and Hobbies', 'description': 'Interests, opinions, and behaviors of individuals, groups, or cultures; like Speciality Cooking or Theme Parks'}, 'entity': {'id': '850143755873140737', 'name': 'Soda', 'description': 'Soda'}}, {'domain': {'id': '123', 'name': 'Ongoing News Story', 'description': ""Ongoing News Stories like 'Brexit'""}, 'entity': {'id': '1220701888179359745', 'name': 'COVID-19'}}, {'domain': {'id': '45', 'name': 'Brand Vertical', 'description': 'Top level entities that describe a Brands industry'}, 'entity': {'id': '781974596740190208', 'name': 'CPG'}}, {'domain': {'id': '46', 'name': 'Brand Category', 'description': 'Categories within Brand Verticals that narrow down the scope of Brands'}, 'entity': {'id': '781974596656304128', 'name': 'Beverage'}}, {'domain': {'id': '47', 'name': 'Brand', 'description': 'Brands and Companies'}, 'entity': {'id': '10026302007', 'name': 'Sprite'}}]"
2022-03-25 17:04:16+00:00,1507403003879464961,"Al Jazeera Executive director and @NUQatar Joint Advisory Board member Yaser Bishr compared Israel to a virus: “What do Ebola and Israel have in common? they both kill indescriminatly.”
https://t.co/LfUzYhjguR https://t.co/hrUmJ5H550",,0,0,0,1468309286665302016,"[{'domain': {'id': '45', 'name': 'Brand Vertical', 'description': 'Top level entities that describe a Brands industry'}, 'entity': {'id': '781974597310615553', 'name': 'Entertainment'}}, {'domain': {'id': '46', 'name': 'Brand Category', 'description': 'Categories within Brand Verticals that narrow down the scope of Brands'}, 'entity': {'id': '781974597105094656', 'name': 'TV/Movies Related'}}, {'domain': {'id': '47', 'name': 'Brand', 'description': 'Brands and Companies'}, 'entity': {'id': '1066123894476570624', 'name': 'Al Jazeera', 'description': 'Al Jazeera'}}]"
2022-03-25 17:02:25+00:00,1507402537216925708,"Al Jazeera Executive director and @NUQatar Joint Advisory Board member Yaser Bishr compared Israel to a virus: “What do Ebola and Israel have in common? they both kill indescriminatly.”
https://t.co/3Q1LDGReFN https://t.co/r2CmO6l5MJ",,6,1,10,3107509399,"[{'domain': {'id': '45', 'name': 'Brand Vertical', 'description': 'Top level entities that describe a Brands industry'}, 'entity': {'id': '781974597310615553', 'name': 'Entertainment'}}, {'domain': {'id': '46', 'name': 'Brand Category', 'description': 'Categories within Brand Verticals that narrow down the scope of Brands'}, 'entity': {'id': '781974597105094656', 'name': 'TV/Movies Related'}}, {'domain': {'id': '47', 'name': 'Brand', 'description': 'Brands and Companies'}, 'entity': {'id': '1066123894476570624', 'name': 'Al Jazeera', 'description': 'Al Jazeera'}}]"
2022-03-25 17:01:08+00:00,1507402211634126848,"The 2014 epidemic shocked scientists and public officials with its rapid, overwhelming spread. While current Ebola treatments can work, they have a flaw: they fall for one of the virus’ tricks. The new antibodies do not.

 https://t.co/6elOpLZsWt",,2,1,4,97999865,"[{'domain': {'id': '123', 'name': 'Ongoing News Story', 'description': ""Ongoing News Stories like 'Brexit'""}, 'entity': {'id': '1220701888179359745', 'name': 'COVID-19'}}]"
2022-03-25 16:59:22+00:00,1507401769013415940,"Landmark alumnus, Kieran Kesner '09 came to speak to an 8th grade science class about his experiences as a news photographer on assignment from the Wall Street Journal in Liberia covering the Ebola outbreak in 2014. 
https://t.co/SsVFBPZH5e
#makingitreal #ebola",,0,0,1,960758905,"[{'domain': {'id': '47', 'name': 'Brand', 'description': 'Brands and Companies'}, 'entity': {'id': '10029237524', 'name': 'The Wall Street Journal'}}, {'domain': {'id': '30', 'name': 'Entities [Entity Service]', 'description': 'Entity Service top level domain, every item that is in Entity Service should be in this domain'}, 'entity': {'id': '854692455005921281', 'name': 'Science', 'description': 'Science'}}]"
2022-03-25 16:51:13+00:00,1507399717143068674,Woman in UK diagnosed with new Ebola-like disease that has 40% death rate https://t.co/UfKr1B2nJf,,0,0,1,838824624200769537,[]
2022-03-25 16:46:43+00:00,1507398586165710850,"If a missile should accidently hit those Bio research labs
small pox, ebola, HIV etc what would be the result on the world? https://t.co/6A6ellXGEK",,0,0,0,127204945,[]
2022-03-25 16:34:29+00:00,1507395507320201238,i think I have Ebola this is too much,,1,0,0,4840165372,[]
2022-03-25 16:32:02+00:00,1507394889050431538,Y’all remember that time in 2014 when Ebola became a problem then China started deporting Black Students.....I Do https://t.co/ZTzQ52901D,,1,1,19,394823642,[]
2022-03-25 16:18:58+00:00,1507391602142199814,Any minor or normal outbreak of an existing virus is now going to be jumped on by the media in order to cause panic. The latest is Crimea Congo Ebola and Norovirus 🤦🏼‍♂️,,0,0,1,492543341,[]
2022-03-25 16:12:56+00:00,1507390085427523587,"Stop #coronavirus RT!

Call for the resignation of Tedros Adhanom Ghebreyesus, #WHO Director General
⬇⬇✏
https://t.co/NkaCorRIb5

#coronaviruschina #Pndahugger

#coronachan #corona_chan #コロナちゃん #コロナウィルスちゃん #Ebola #ebolachan #エボラちゃん
https://t.co/LlU679nFvC",,0,0,0,331916700,"[{'domain': {'id': '123', 'name': 'Ongoing News Story', 'description': ""Ongoing News Stories like 'Brexit'""}, 'entity': {'id': '1220701888179359745', 'name': 'COVID-19'}}]"
2022-03-25 15:57:51+00:00,1507386288663539717,Super nuclear hypersonic ebola sars spiders snakes BULLISH https://t.co/hW11JgrGGh,,0,0,2,1255097287090585601,[]
2022-03-25 15:56:07+00:00,1507385852271468560,#HealthNewsFlash: Woman in UK diagnosed with new Ebola-like disease with 40% death rate.... | https://t.co/x4O18HwsW4 https://t.co/ysZUXdYKJE,,1,0,0,752530185900158977,[]
2022-03-25 15:47:26+00:00,1507383664493187081,"Please talk to @Specsavers ...
Ever time I pass their shop, I think they must have an Ebola outbreak in there...
Gowns, muzzles, visors, gloves...
Only thing missing is a full hazmat suit... https://t.co/GQBwgqFmoU",,0,0,0,1341091715206311937,[]
2022-03-25 15:40:49+00:00,1507382002508521481,"A woman in the United Kingdom has been diagnosed with a novel Ebola-like disease with a 40% mortality rate.
https://t.co/asbKalU4ql",,0,0,0,152609006,[]
2022-03-25 15:40:44+00:00,1507381978923941891,"A woman in the United Kingdom has been diagnosed with a novel Ebola-like disease with a 40% mortality rate.
https://t.co/v8EB3rKjhh",,0,0,0,2237519850,[]
2022-03-25 15:34:39+00:00,1507380448707506182,Ebola is sweeping through Old Florida and has so far infected 197 people.,,0,0,0,1147422075499556864,[]
2022-03-25 15:30:28+00:00,1507379396537061381,"What other things – if they were a person – would 
@SenTedCruz be? If fecal vomiting was a person it would be Ted Cruz. If Tapeworm was a person = Ted Cruz. If scabies was a person = Ted Cruz. If Ebola was a person = Ted Cruz. Good morning &amp; congratulations #GOP! https://t.co/uAHrQYjYwI",,0,0,0,2912476431,"[{'domain': {'id': '10', 'name': 'Person', 'description': 'Named people in the world like Nelson Mandela'}, 'entity': {'id': '10037721448', 'name': 'Ted Cruz', 'description': 'US Senator Ted Cruz (TX)\n'}}, {'domain': {'id': '35', 'name': 'Politician', 'description': 'Politicians in the world, like Joe Biden'}, 'entity': {'id': '10037721448', 'name': 'Ted Cruz', 'description': 'US Senator Ted Cruz (TX)\n'}}]"
2022-03-25 15:27:14+00:00,1507378584687722497,A woman is receiving specialist care in London for a potentially fatal Ebola-like disease ................... https://t.co/eHMzmXoKHV,,0,0,0,1320466362670731267,[]
2022-03-25 15:18:55+00:00,1507376490966573060,Woman in UK diagnosed with new Ebola-like disease with 40% fatality rate https://t.co/DYxhl958cI,,0,0,0,2586299012,"[{'domain': {'id': '123', 'name': 'Ongoing News Story', 'description': ""Ongoing News Stories like 'Brexit'""}, 'entity': {'id': '1220701888179359745', 'name': 'COVID-19'}}]"
2022-03-25 15:12:51+00:00,1507374965037109251,Ebola Mortal Fear Blindsight,,0,0,0,1492220485945470982,[]
2022-03-25 15:09:22+00:00,1507374085877161990,"Ebola kills half of its victims through uncontrollable internal bleeding, and is on the rise. There is a vaccine, and now there's also a game-changing treatment that can boost a patient's ability to fight the disease when they're already infected 

https://t.co/9njDjOL8Ct",,12,1,15,786764,"[{'domain': {'id': '123', 'name': 'Ongoing News Story', 'description': ""Ongoing News Stories like 'Brexit'""}, 'entity': {'id': '1220701888179359745', 'name': 'COVID-19'}}]"
2022-03-25 15:00:35+00:00,1507371874916913161,"What brings you joy about Africans?  

We'll go first: among other things, Africans' resilience leaves us in awe. From slavery to diseases such as HIV, Malaria &amp; Ebola, we went through a lot and yet emerged stronger.  

You're up next. What fascinates you about Africans? https://t.co/p0jC06JRkj",,4,0,14,1459289726,[]
2022-03-25 14:58:06+00:00,1507371252767502349,"After a few weeks of Otter being on point, it’s done a crap job transcribing an interview with a guy in Edinburgh and the results are wild. 

“We had a bit of Ebola with the wings…”

“We had a bit *of bother* with the wings…”",,0,3,4,220462781,[]
