Datetime,Tweet Id,original_text,geo,retweet_count,reply_count,like_count,author_id,context_annotations
2022-06-22 08:46:42+00:00,1539530304506933248,There's a drought of Sprite amid the Ebola pandemic,,0,0,0,1307842037253918721,"[{'domain': {'id': '45', 'name': 'Brand Vertical', 'description': 'Top level entities that describe a Brands industry'}, 'entity': {'id': '781974596740190208', 'name': 'CPG'}}, {'domain': {'id': '46', 'name': 'Brand Category', 'description': 'Categories within Brand Verticals that narrow down the scope of Brands'}, 'entity': {'id': '781974596656304128', 'name': 'Beverage'}}, {'domain': {'id': '47', 'name': 'Brand', 'description': 'Brands and Companies'}, 'entity': {'id': '10026302007', 'name': 'Sprite'}}, {'domain': {'id': '65', 'name': 'Interests and Hobbies Vertical', 'description': 'Top level interests and hobbies groupings, like Food or Travel'}, 'entity': {'id': '834828264786898945', 'name': 'Drinks', 'description': 'Drinks'}}, {'domain': {'id': '66', 'name': 'Interests and Hobbies Category', 'description': 'A grouping of interests and hobbies entities, like Novelty Food or Destinations'}, 'entity': {'id': '834828445238431744', 'name': 'Generic Drinks', 'description': 'Generic Drinks'}}, {'domain': {'id': '67', 'name': 'Interests and Hobbies', 'description': 'Interests, opinions, and behaviors of individuals, groups, or cultures; like Speciality Cooking or Theme Parks'}, 'entity': {'id': '850143755873140737', 'name': 'Soda', 'description': 'Soda'}}, {'domain': {'id': '123', 'name': 'Ongoing News Story', 'description': ""Ongoing News Stories like 'Brexit'""}, 'entity': {'id': '1220701888179359745', 'name': 'COVID-19'}}, {'domain': {'id': '45', 'name': 'Brand Vertical', 'description': 'Top level entities that describe a Brands industry'}, 'entity': {'id': '781974596740190208', 'name': 'CPG'}}, {'domain': {'id': '46', 'name': 'Brand Category', 'description': 'Categories within Brand Verticals that narrow down the scope of Brands'}, 'entity': {'id': '781974596656304128', 'name': 'Beverage'}}, {'domain': {'id': '47', 'name': 'Brand', 'description': 'Brands and Companies'}, 'entity': {'id': '10026302007', 'name': 'Sprite'}}]"
2022-06-22 08:44:20+00:00,1539529710333349888,Ben the Great died from Ebola in 1011.,,0,0,0,4893877534,[]
2022-06-22 08:33:31+00:00,1539526987756314624,New: Digital Surveillance Networks of 2014 Ebola Epidemics and Lessons for COVID-19 https://t.co/ge4xrbchNc read/write/request review https://t.co/RnurTL3DyM #Ebola #COVID19,,0,0,0,4901919879,"[{'domain': {'id': '123', 'name': 'Ongoing News Story', 'description': ""Ongoing News Stories like 'Brexit'""}, 'entity': {'id': '1220701888179359745', 'name': 'COVID-19'}}]"
2022-06-22 08:15:24+00:00,1539522429453799424,"See how Covid is slowly disappearing— Lol just like Ebola mos.... one day we gon wake up &amp; it’s gone, just like that",,0,0,1,1495790637207244800,"[{'domain': {'id': '123', 'name': 'Ongoing News Story', 'description': ""Ongoing News Stories like 'Brexit'""}, 'entity': {'id': '1220701888179359745', 'name': 'COVID-19'}}]"
2022-06-22 08:12:25+00:00,1539521677570220033,I have Ebola 🤩,{'place_id': '002e24c6736f069d'},0,0,0,412819458,[]
2022-06-22 07:37:18+00:00,1539512840121458690,"ummmmm, this cant be a legit comment?! Inflation destroys purchasing power. It is worse than a depression. Depression, if anything, deflates prices. There is no stopping inflation. It's like comparing Ebola to COVID, one goes away. https://t.co/7hfpwOvwAD",,0,0,0,1356130349831475201,"[{'domain': {'id': '67', 'name': 'Interests and Hobbies', 'description': 'Interests, opinions, and behaviors of individuals, groups, or cultures; like Speciality Cooking or Theme Parks'}, 'entity': {'id': '1486458201117642754', 'name': 'Inflation'}}, {'domain': {'id': '123', 'name': 'Ongoing News Story', 'description': ""Ongoing News Stories like 'Brexit'""}, 'entity': {'id': '1220701888179359745', 'name': 'COVID-19'}}]"
2022-06-22 07:20:00+00:00,1539508488350666752,Some animals on this planet just make you fucking wish for Ebola. https://t.co/AuPJd6iaBu,,0,0,0,1494429900819910660,"[{'domain': {'id': '29', 'name': 'Events [Entity Service]', 'description': 'Entity Service related Events domain'}, 'entity': {'id': '1270453235480854528', 'name': 'Juneteenth', 'description': 'Juneteenth, the holiday commemorating the day that all enslaved people in the US learned they were free, is being celebrated this year with marches, music and more.'}}, {'domain': {'id': '119', 'name': 'Holiday', 'description': 'Holidays like Christmas or Halloween'}, 'entity': {'id': '1270453235480854528', 'name': 'Juneteenth', 'description': 'Juneteenth, the holiday commemorating the day that all enslaved people in the US learned they were free, is being celebrated this year with marches, music and more.'}}]"
2022-06-22 07:10:37+00:00,1539506126596804610,"Ebola, smallpox, anthrax — just a few of the deadly diseases, pathogens and chemicals being researched in biolabs all over the world. Safety of said labs should be of concern to all of us after recent events. Check this article from 2015. 👇

https://t.co/jNBTNxY8m1",,3,1,3,1517519358293069828,[]
2022-06-22 07:02:01+00:00,1539503960481943554,Ebola is incurable and deadly. The outbreak in West Africa in 2014 was unprecede https://t.co/OsnS9Le8Za,,0,0,0,2969250867,[]
2022-06-22 06:50:18+00:00,1539501011160662017,Specific retinal cell appears to be good at housing Ebola and other viruses https://t.co/m3WJu3F61k,,0,0,0,1490057525001170948,[]
2022-06-22 06:35:33+00:00,1539497298178326528,"Views that can heal Typhoid, Malaria, HIV and Ebola😁
Good morning #SSOT https://t.co/S3L7DZoUHV",,2,1,6,2515302343,[]
2022-06-22 06:19:25+00:00,1539493240080158725,"So, Dr. Adadevoh saved us from what might have become a terrible ebola crisis. It was by ""illegal detention"", yeah? https://t.co/U2nQggJJ44",,0,0,0,59901181,[]
2022-06-22 06:02:22+00:00,1539488947432304640,when i was in 4th grade i did a news report presentation on ebola and made a psa to my classmates to stop joking about ebola because it was serious,,0,0,4,1305723257153376257,[]
2022-06-22 06:01:28+00:00,1539488724362354694,"What's really scary is the comments!

It's not rocket science, and it does NOT mean it'll be caused by anyone. 

Jeez people, learn the lessons FFS. Sars, bird flu, foot and mouth disease, ebola etc. We were so unprepared for COVID and that's because people are stupid. https://t.co/afNLCAkR5K",,0,0,0,1195471501589438464,"[{'domain': {'id': '123', 'name': 'Ongoing News Story', 'description': ""Ongoing News Stories like 'Brexit'""}, 'entity': {'id': '1220701888179359745', 'name': 'COVID-19'}}, {'domain': {'id': '10', 'name': 'Person', 'description': 'Named people in the world like Nelson Mandela'}, 'entity': {'id': '10040395078', 'name': 'Joe Biden', 'description': 'US President Joe Biden'}}, {'domain': {'id': '35', 'name': 'Politician', 'description': 'Politicians in the world, like Joe Biden'}, 'entity': {'id': '10040395078', 'name': 'Joe Biden', 'description': 'US President Joe Biden'}}]"
2022-06-22 05:48:06+00:00,1539485358521561094,"HIV didn't end Africa.
Ebola didn't end Africa.
Covid 19 didn't end Africa
MonkeyPox won't end Africa.

What's next?",,2,0,4,1100840550700384256,"[{'domain': {'id': '123', 'name': 'Ongoing News Story', 'description': ""Ongoing News Stories like 'Brexit'""}, 'entity': {'id': '1220701888179359745', 'name': 'COVID-19'}}]"
2022-06-22 05:13:01+00:00,1539476529453092864,"Stop #coronavirus RT!

Call for the resignation of #Tedros Adhanom Ghebreyesus, #WHO Director General
⬇⬇✒
https://t.co/NkaCorRIb5
#Coronavid19 #Coronapandemic
#coronachan #corona_chan #コロナちゃん #コロナウィルスちゃん #Ebola #ebolachan #COVID19 #Wuflu https://t.co/D8hcLJGA7q",,0,0,0,331916700,"[{'domain': {'id': '123', 'name': 'Ongoing News Story', 'description': ""Ongoing News Stories like 'Brexit'""}, 'entity': {'id': '1220701888179359745', 'name': 'COVID-19'}}]"
2022-06-22 04:46:39+00:00,1539469896085434368,There's a bountiful of Pepsi amid the Ebola pandemic,,0,0,0,1307842037253918721,"[{'domain': {'id': '45', 'name': 'Brand Vertical', 'description': 'Top level entities that describe a Brands industry'}, 'entity': {'id': '781974596740190208', 'name': 'CPG'}}, {'domain': {'id': '46', 'name': 'Brand Category', 'description': 'Categories within Brand Verticals that narrow down the scope of Brands'}, 'entity': {'id': '781974596656304128', 'name': 'Beverage'}}, {'domain': {'id': '47', 'name': 'Brand', 'description': 'Brands and Companies'}, 'entity': {'id': '10026288001', 'name': 'Pepsi'}}, {'domain': {'id': '30', 'name': 'Entities [Entity Service]', 'description': 'Entity Service top level domain, every item that is in Entity Service should be in this domain'}, 'entity': {'id': '825047692124442624', 'name': 'Food', 'description': 'Food'}}, {'domain': {'id': '67', 'name': 'Interests and Hobbies', 'description': 'Interests, opinions, and behaviors of individuals, groups, or cultures; like Speciality Cooking or Theme Parks'}, 'entity': {'id': '850143755873140737', 'name': 'Soda', 'description': 'Soda'}}, {'domain': {'id': '123', 'name': 'Ongoing News Story', 'description': ""Ongoing News Stories like 'Brexit'""}, 'entity': {'id': '1220701888179359745', 'name': 'COVID-19'}}]"
2022-06-22 04:34:35+00:00,1539466857974902784,How’s this @MilliporeSigma??? Ebola testing training!#MilliporeSigmaScienceSelfie https://t.co/6kMjqVNQpt,{'place_id': '36148a9a49d3da69'},0,1,10,1249565763192492032,[]
2022-06-22 04:22:04+00:00,1539463709822550016,Specific retinal cell appears to be good at housing Ebola and other viruses https://t.co/WwaA5TZHqI https://t.co/BE89UT4mMJ,,0,0,0,111995707,[]
2022-06-22 04:20:22+00:00,1539463279646367745,Specific retinal cell appears to be good at housing Ebola and other viruses https://t.co/V0dNC7Lkf1 https://t.co/uKmJ1H2v2v,,0,0,0,1065290636545466384,[]
2022-06-22 04:12:25+00:00,1539461279995379717,"The year 2002, the battle's filled with the Wu
Six million devils just died from the Bubonic Flu
Or the Ebola Virus, under the reign of King Cyrus
You can see the weakness of a man right through his iris

#wutangisforthechildren https://t.co/t4M1hks52H",,0,0,0,32556168,[]
2022-06-22 03:41:11+00:00,1539453418057646080,"RT SaadOmer3 https://t.co/Cz6Nt4lIL8 ""In recent outbreaks (e.g. Ebola, COVID) lack of early and clear communication created space for misinformation. So in order to inform #Monkeypox communications we (with Maikewin &amp; amynmalik) conducted a nation",,0,0,0,1280878711454273543,"[{'domain': {'id': '123', 'name': 'Ongoing News Story', 'description': ""Ongoing News Stories like 'Brexit'""}, 'entity': {'id': '1220701888179359745', 'name': 'COVID-19'}}]"
2022-06-22 03:40:32+00:00,1539453256295776256,New research from @FlindersHmri @ProfJRSmith finds a cell within the retina appears to be particularly good at housing Ebola and other viruses https://t.co/IsKqGKy2v7,,1,0,1,958548559556632576,[]
2022-06-22 03:36:59+00:00,1539452361768304640,"In recent outbreaks (e.g. Ebola, COVID) lack of early and clear communication created space for misinformation. So in order to inform #Monkeypox communications we (with @Maikewin &amp; @amynmalik) conducted a nationally representative survey in the U.S. 1/2

https://t.co/wy9MwPMq3m",,2,1,9,756713112,"[{'domain': {'id': '123', 'name': 'Ongoing News Story', 'description': ""Ongoing News Stories like 'Brexit'""}, 'entity': {'id': '1220701888179359745', 'name': 'COVID-19'}}, {'domain': {'id': '29', 'name': 'Events [Entity Service]', 'description': 'Entity Service related Events domain'}, 'entity': {'id': '1219057585707315201', 'name': 'COVID-19: Latest news updates from around the world', 'description': 'This page is a timeline of Tweets with the latest information and updates on COVID-19 from experts, journalists, health authorities and other trusted sources from around the world. For more on COVID-19, visit: twitter.com/explore/tabs/covid-19'}}, {'domain': {'id': '123', 'name': 'Ongoing News Story', 'description': ""Ongoing News Stories like 'Brexit'""}, 'entity': {'id': '1220701888179359745', 'name': 'COVID-19'}}]"
2022-06-22 03:30:07+00:00,1539450632482045952,"Can we predict the next global #pandemic? 

https://t.co/9Bg3mSp15A via .@wef #covid19 https://t.co/JoPogsgNMz",,0,0,0,1298451985436307457,"[{'domain': {'id': '123', 'name': 'Ongoing News Story', 'description': ""Ongoing News Stories like 'Brexit'""}, 'entity': {'id': '1220701888179359745', 'name': 'COVID-19'}}]"
2022-06-22 03:24:21+00:00,1539449181789560832,"Called for Life: How Loving Our Neighbor Led Us into the Heart of the Ebola Epidemic [QPINQGA]

https://t.co/neW4Y2r4En",,0,0,0,1529653888973803520,[]
2022-06-22 03:13:33+00:00,1539446466019659776,"Hey broski, sorry I can't pay you back yet! I got you tickets to see my death metal band Ebola of Wrath!",,0,0,0,1076648755515064320,"[{'domain': {'id': '55', 'name': 'Music Genre', 'description': 'A category for a musical style, like Pop, Rock, or Rap'}, 'entity': {'id': '806571747730341888', 'name': 'Rock', 'description': 'Rock'}}, {'domain': {'id': '55', 'name': 'Music Genre', 'description': 'A category for a musical style, like Pop, Rock, or Rap'}, 'entity': {'id': '849684649840214020', 'name': 'Heavy metal', 'description': 'Metal'}}]"
2022-06-22 02:19:43+00:00,1539432918702993408,"As the world spirals toward chaos, Amy Cooper fights to stop the evolution of a deadly virus. When her beliefs disagree with the Administration’s agenda, she is put on trial. #virus #ebola #coronavirus #religion #persecution Midnight Hour: https://t.co/pRdHFd6wuE",,1,0,0,195016054,"[{'domain': {'id': '123', 'name': 'Ongoing News Story', 'description': ""Ongoing News Stories like 'Brexit'""}, 'entity': {'id': '1220701888179359745', 'name': 'COVID-19'}}, {'domain': {'id': '29', 'name': 'Events [Entity Service]', 'description': 'Entity Service related Events domain'}, 'entity': {'id': '1219057585707315201', 'name': 'COVID-19: Latest news updates from around the world', 'description': 'This page is a timeline of Tweets with the latest information and updates on COVID-19 from experts, journalists, health authorities and other trusted sources from around the world. For more on COVID-19, visit: twitter.com/explore/tabs/covid-19'}}]"
2022-06-22 02:08:14+00:00,1539430026386767872,"My nose just started bleeding into my white mask on the train. I did what any rational person would under the circumstances – asked my phone loudly “Hey Siri, how contagious is Ebola?”",,0,0,1,135254065,"[{'domain': {'id': '123', 'name': 'Ongoing News Story', 'description': ""Ongoing News Stories like 'Brexit'""}, 'entity': {'id': '1220701888179359745', 'name': 'COVID-19'}}, {'domain': {'id': '47', 'name': 'Brand', 'description': 'Brands and Companies'}, 'entity': {'id': '10026364281', 'name': 'Apple'}}, {'domain': {'id': '48', 'name': 'Product', 'description': 'Products created by Brands.  Examples: Ford Explorer, Apple iPhone.'}, 'entity': {'id': '10041893638', 'name': 'Apple - Siri'}}]"
2022-06-22 02:00:58+00:00,1539428200547336192,"Before the SARS-CoV-2 virus that leads to COVID-19, the worst virus most people had heard of was Ebola - which is much deadlier. Now, the Congolese professor who discovered it 40 years ago declares Ebola has been defeated. #betterworld https://t.co/3l3rVnJNSU",,0,0,0,22132639,"[{'domain': {'id': '123', 'name': 'Ongoing News Story', 'description': ""Ongoing News Stories like 'Brexit'""}, 'entity': {'id': '1220701888179359745', 'name': 'COVID-19'}}, {'domain': {'id': '29', 'name': 'Events [Entity Service]', 'description': 'Entity Service related Events domain'}, 'entity': {'id': '1219057585707315201', 'name': 'COVID-19: Latest news updates from around the world', 'description': 'This page is a timeline of Tweets with the latest information and updates on COVID-19 from experts, journalists, health authorities and other trusted sources from around the world. For more on COVID-19, visit: twitter.com/explore/tabs/covid-19'}}]"
2022-06-22 01:54:20+00:00,1539426530413232128,Ebola is a beautiful name for a baby girl,,0,0,0,3306303224,[]
2022-06-22 01:52:58+00:00,1539426186195267584,My Dad told me that I started Ebola,,0,0,0,3010876592,[]
2022-06-22 01:52:08+00:00,1539425976177795072,Republican senator with no integrity. If Ebola or COVID were the nominee @SenatorTimScott would support the virus. Republicans are not people! https://t.co/wWhMz02TvH,,1,0,0,935030611185631232,"[{'domain': {'id': '10', 'name': 'Person', 'description': 'Named people in the world like Nelson Mandela'}, 'entity': {'id': '799022225751871488', 'name': 'Donald Trump', 'description': '45th US President, Donald Trump'}}, {'domain': {'id': '29', 'name': 'Events [Entity Service]', 'description': 'Entity Service related Events domain'}, 'entity': {'id': '1534958297643511808', 'name': 'January 6 Committee Hearings'}}, {'domain': {'id': '35', 'name': 'Politician', 'description': 'Politicians in the world, like Joe Biden'}, 'entity': {'id': '799022225751871488', 'name': 'Donald Trump', 'description': '45th US President, Donald Trump'}}, {'domain': {'id': '88', 'name': 'Political Body', 'description': 'A section of a government, like The Supreme Court'}, 'entity': {'id': '961705302700654593', 'name': 'United States Congress', 'description': 'United States Congress'}}, {'domain': {'id': '123', 'name': 'Ongoing News Story', 'description': ""Ongoing News Stories like 'Brexit'""}, 'entity': {'id': '1220701888179359745', 'name': 'COVID-19'}}, {'domain': {'id': '10', 'name': 'Person', 'description': 'Named people in the world like Nelson Mandela'}, 'entity': {'id': '888528900346621952', 'name': 'Tim Scott', 'description': 'US Senator Tim Scott (SC)'}}, {'domain': {'id': '35', 'name': 'Politician', 'description': 'Politicians in the world, like Joe Biden'}, 'entity': {'id': '888528900346621952', 'name': 'Tim Scott', 'description': 'US Senator Tim Scott (SC)'}}, {'domain': {'id': '88', 'name': 'Political Body', 'description': 'A section of a government, like The Supreme Court'}, 'entity': {'id': '877326946253684737', 'name': 'United States Senate', 'description': 'United States Senate'}}, {'domain': {'id': '88', 'name': 'Political Body', 'description': 'A section of a government, like The Supreme Court'}, 'entity': {'id': '961705302700654593', 'name': 'United States Congress', 'description': 'United States Congress'}}]"
2022-06-22 01:40:52+00:00,1539423141927211008,"now do biowarfare #covid #sars #hiv #swineflu #ebola #smallpox #birdflu #lyme #mersa

probably forgetting some https://t.co/71niiSH1Gz",,2,0,3,1963462903,"[{'domain': {'id': '123', 'name': 'Ongoing News Story', 'description': ""Ongoing News Stories like 'Brexit'""}, 'entity': {'id': '1220701888179359745', 'name': 'COVID-19'}}, {'domain': {'id': '29', 'name': 'Events [Entity Service]', 'description': 'Entity Service related Events domain'}, 'entity': {'id': '1219057585707315201', 'name': 'COVID-19: Latest news updates from around the world', 'description': 'This page is a timeline of Tweets with the latest information and updates on COVID-19 from experts, journalists, health authorities and other trusted sources from around the world. For more on COVID-19, visit: twitter.com/explore/tabs/covid-19'}}]"
2022-06-22 01:12:05+00:00,1539415895541710848,"Belgium-based virologist and vaccinologist  Geert Vanden Bossche has worked with #Gates' foundation, worked to develop ebola vaccine and was also with the GAVI vaccine project. 
Why Bossche alerts us about the 
#COVIDVACCINE? Watch &amp; SHARE. https://t.co/AdbADFKPAB",,0,0,0,1264099784568135681,"[{'domain': {'id': '123', 'name': 'Ongoing News Story', 'description': ""Ongoing News Stories like 'Brexit'""}, 'entity': {'id': '1220701888179359745', 'name': 'COVID-19'}}, {'domain': {'id': '29', 'name': 'Events [Entity Service]', 'description': 'Entity Service related Events domain'}, 'entity': {'id': '1219057585707315201', 'name': 'COVID-19: Latest news updates from around the world', 'description': 'This page is a timeline of Tweets with the latest information and updates on COVID-19 from experts, journalists, health authorities and other trusted sources from around the world. For more on COVID-19, visit: twitter.com/explore/tabs/covid-19'}}]"
2022-06-22 01:10:59+00:00,1539415620827201536,Vaping in the movie theater bathroom stall that has the toilet bowl full of Ebola waste before Jurassic World 3,,0,0,2,504034164,"[{'domain': {'id': '66', 'name': 'Interests and Hobbies Category', 'description': 'A grouping of interests and hobbies entities, like Novelty Food or Destinations'}, 'entity': {'id': '1047109035600764929', 'name': 'Vaping', 'description': 'Vaping'}}, {'domain': {'id': '130', 'name': 'Multimedia Franchise', 'description': ""Franchises which span multiple forms of media like 'Harry Potter'""}, 'entity': {'id': '1473384235159359494', 'name': 'Jurassic World'}}]"
2022-06-22 00:56:02+00:00,1539411857043333122,click this or get ebola  https://t.co/MI8PAEn7V9,,0,0,0,1483856772070785029,[]
2022-06-22 00:49:01+00:00,1539410091681763331,"🔎 Scientists at @unil describe advances in #AntibodyDiscovery that have led to the development of monoclonal antibodies for use against #SARSCoV2, respiratory syncytial virus, #Ebola virus, human cytomegalovirus, and #influenza.

Review 📚: https://t.co/u1ejcn6DuM https://t.co/xL3wQvyJql",,0,0,3,887203562,"[{'domain': {'id': '123', 'name': 'Ongoing News Story', 'description': ""Ongoing News Stories like 'Brexit'""}, 'entity': {'id': '1220701888179359745', 'name': 'COVID-19'}}, {'domain': {'id': '29', 'name': 'Events [Entity Service]', 'description': 'Entity Service related Events domain'}, 'entity': {'id': '1219057585707315201', 'name': 'COVID-19: Latest news updates from around the world', 'description': 'This page is a timeline of Tweets with the latest information and updates on COVID-19 from experts, journalists, health authorities and other trusted sources from around the world. For more on COVID-19, visit: twitter.com/explore/tabs/covid-19'}}]"
2022-06-22 00:15:58+00:00,1539401775765147649,"EBOLA 3 Demo PT.3 | Ooh Slow Time Headshot! | Indie Horror Game
https://t.co/IHlXTX5ugJ I will definitely wishlist this awesome zombie game #Zombies #Indiehorrorgame #Indie_games_studio",,0,0,0,4143804792,[]
2022-06-22 00:12:57+00:00,1539401014906081280,"Stop #coronavirus RT!

Tedros you're fired!

Call for the resignation of Tedros Adhanom Ghebreyesus, #WHO Director General
⬇⬇✒
https://t.co/NkaCorRIb5
#coronaviruschina #Pndahugger
#coronachan #corona_chan #コロナちゃん #Ebola
#ebolachan #COVID19 #Wuflu
https://t.co/wo5gFAkSGY",,0,0,0,331916700,"[{'domain': {'id': '123', 'name': 'Ongoing News Story', 'description': ""Ongoing News Stories like 'Brexit'""}, 'entity': {'id': '1220701888179359745', 'name': 'COVID-19'}}]"
2022-06-22 00:11:42+00:00,1539400702077939713,"EBOLA 3 Demo PT.2 | How To Burn A Zombie | Indie Horror Game
https://t.co/ZazDUTrSpN",,0,0,0,4143804792,[]
2022-06-21 23:23:56+00:00,1539388681626259456,This thread is Ebola https://t.co/lf86jpCPM2,,0,3,12,1505954877268131840,"[{'domain': {'id': '10', 'name': 'Person', 'description': 'Named people in the world like Nelson Mandela'}, 'entity': {'id': '1428004214345584648', 'name': 'Sapnap'}}, {'domain': {'id': '136', 'name': 'Video Game Personality ', 'description': ''}, 'entity': {'id': '1428004214345584648', 'name': 'Sapnap'}}]"
2022-06-21 23:23:42+00:00,1539388620666245127,"Please read deeply the Eco-Health Alliance disclosures (click paranthetic codes); USG's 14-year funding grant; ""emerging pandemics""  listed after 2013, then what happened. Read PAHPA's guarantees. Up next: Ebola, Marburg virus, more monkeypox. Spray antimicrobial everywhere.",,0,0,0,2298149737,[]
2022-06-21 23:09:12+00:00,1539384973991485441,"Wonder which one they are planning next?

Monkey pox 🤔 Small Pox 🤔 how about Ebola 🦠

Don’t worry I’m sure the DS will be kind enough to let us know. https://t.co/JY4FhcrxGN",,0,0,1,757930652222173184,"[{'domain': {'id': '123', 'name': 'Ongoing News Story', 'description': ""Ongoing News Stories like 'Brexit'""}, 'entity': {'id': '1220701888179359745', 'name': 'COVID-19'}}, {'domain': {'id': '10', 'name': 'Person', 'description': 'Named people in the world like Nelson Mandela'}, 'entity': {'id': '10040395078', 'name': 'Joe Biden', 'description': 'US President Joe Biden'}}, {'domain': {'id': '35', 'name': 'Politician', 'description': 'Politicians in the world, like Joe Biden'}, 'entity': {'id': '10040395078', 'name': 'Joe Biden', 'description': 'US President Joe Biden'}}]"
2022-06-21 23:06:25+00:00,1539384271915433987,"compilation of my oc' El gato
#smallpox #ebola #Marburg https://t.co/reybdZKTOC",,2,0,3,1454898669015248897,[]
2022-06-21 23:05:19+00:00,1539383997049995273,"Nearly 71% of the earth is covered by the ocean, but cool facts about the ebola virus:",,0,0,0,2757125954,[]
2022-06-21 22:24:47+00:00,1539373796087410688,Caden the Nerdy died from Ebola in 10000.,,0,0,0,4893877534,[]
2022-06-21 22:18:57+00:00,1539372326063865856,How to give Vanitas Drop kicking ebola,,0,0,0,2806258580,[]
2022-06-21 22:07:56+00:00,1539369553154650112,"Who are these people?
https://t.co/VI4Qp2sDAb https://t.co/v39BlhUSkj",,0,0,1,3237401508,[]
2022-06-21 21:48:59+00:00,1539364786919444480,How to spread ebola to Vanitas,,0,0,0,2806258580,[]
