Datetime,Tweet Id,original_text,geo,retweet_count,reply_count,like_count,author_id,context_annotations
2022-06-22 14:46:22+00:00,1539620818778554369,"Ebola is more dangerous than COVID-19 

Once you get it you bleed from all openings of your body till death...

And death comes quick but not too fast with excruciating pain..... you'll bleed untill you can't breath.",,0,0,0,1267750777,"[{'domain': {'id': '123', 'name': 'Ongoing News Story', 'description': ""Ongoing News Stories like 'Brexit'""}, 'entity': {'id': '1220701888179359745', 'name': 'COVID-19'}}, {'domain': {'id': '29', 'name': 'Events [Entity Service]', 'description': 'Entity Service related Events domain'}, 'entity': {'id': '1219057585707315201', 'name': 'COVID-19: Latest news updates from around the world', 'description': 'This page is a timeline of Tweets with the latest information and updates on COVID-19 from experts, journalists, health authorities and other trusted sources from around the world. For more on COVID-19, visit: twitter.com/explore/tabs/covid-19'}}]"
2022-06-22 14:46:22+00:00,1539620818606489600,Upon all the meat around. Some people wan eat bats and monkeys🤦🏿. Why won't Ebola come. I hope its not true 😕,,0,0,4,846476518591225859,[]
2022-06-22 14:46:10+00:00,1539620766387474434,"How can you pay GHS 36 Million for this.
This country naa we for take give Alexa or Siri make dem rule we😂😂.Some of our leaders are not serious.
#KenOfori #fearwomen #Ebola #HotCakeOnGhOne https://t.co/SFds0R02pK",,0,0,0,4835021842,"[{'domain': {'id': '47', 'name': 'Brand', 'description': 'Brands and Companies'}, 'entity': {'id': '10026364281', 'name': 'Apple'}}, {'domain': {'id': '48', 'name': 'Product', 'description': 'Products created by Brands.  Examples: Ford Explorer, Apple iPhone.'}, 'entity': {'id': '10041893638', 'name': 'Apple - Siri'}}]"
2022-06-22 14:45:52+00:00,1539620692999667713,"No wedding cake; Bride gives her groom fufu on their wedding day [video] 

#StopTheKilling|#KNUST|#Burna|#earthquack
Ebola|Sabinus|Lil Durk|Naira Marley| East Legon|Ken Ofori|Runtown|Nana|Sheldon|Larma

https://t.co/YyUTwBZEoa",,0,0,0,1415960242500907010,"[{'domain': {'id': '10', 'name': 'Person', 'description': 'Named people in the world like Nelson Mandela'}, 'entity': {'id': '885935116240826368', 'name': 'Lil Durk', 'description': 'Lil Durk'}}, {'domain': {'id': '10', 'name': 'Person', 'description': 'Named people in the world like Nelson Mandela'}, 'entity': {'id': '1229428567148089346', 'name': 'Burna Boy'}}, {'domain': {'id': '10', 'name': 'Person', 'description': 'Named people in the world like Nelson Mandela'}, 'entity': {'id': '1453411076582752260', 'name': 'Naira Marley'}}, {'domain': {'id': '10', 'name': 'Person', 'description': 'Named people in the world like Nelson Mandela'}, 'entity': {'id': '1460259792392310789', 'name': 'Sabinus'}}, {'domain': {'id': '10', 'name': 'Person', 'description': 'Named people in the world like Nelson Mandela'}, 'entity': {'id': '1513838975248568330', 'name': 'Runtown'}}, {'domain': {'id': '13', 'name': 'Place', 'description': 'Named places in the world, like Fenway Park'}, 'entity': {'id': '1511345473797320704', 'name': 'Kwame Nkrumah University of Science and Technology'}}, {'domain': {'id': '54', 'name': 'Musician', 'description': 'A musician in the world, like Adele or Bob Dylan'}, 'entity': {'id': '885935116240826368', 'name': 'Lil Durk', 'description': 'Lil Durk'}}, {'domain': {'id': '54', 'name': 'Musician', 'description': 'A musician in the world, like Adele or Bob Dylan'}, 'entity': {'id': '1229428567148089346', 'name': 'Burna Boy'}}, {'domain': {'id': '54', 'name': 'Musician', 'description': 'A musician in the world, like Adele or Bob Dylan'}, 'entity': {'id': '1453411076582752260', 'name': 'Naira Marley'}}, {'domain': {'id': '54', 'name': 'Musician', 'description': 'A musician in the world, like Adele or Bob Dylan'}, 'entity': {'id': '1513838975248568330', 'name': 'Runtown'}}, {'domain': {'id': '55', 'name': 'Music Genre', 'description': 'A category for a musical style, like Pop, Rock, or Rap'}, 'entity': {'id': '810937888334487552', 'name': 'Rap', 'description': 'Hip-Hop/Rap'}}, {'domain': {'id': '65', 'name': 'Interests and Hobbies Vertical', 'description': 'Top level interests and hobbies groupings, like Food or Travel'}, 'entity': {'id': '847868745150119936', 'name': 'Family & relationships', 'description': 'Hobbies and interests'}}, {'domain': {'id': '65', 'name': 'Interests and Hobbies Vertical', 'description': 'Top level interests and hobbies groupings, like Food or Travel'}, 'entity': {'id': '847896364256067584', 'name': 'Society', 'description': 'Society'}}, {'domain': {'id': '66', 'name': 'Interests and Hobbies Category', 'description': 'A grouping of interests and hobbies entities, like Novelty Food or Destinations'}, 'entity': {'id': '847896684638097408', 'name': 'Weddings', 'description': 'Weddings'}}, {'domain': {'id': '30', 'name': 'Entities [Entity Service]', 'description': 'Entity Service top level domain, every item that is in Entity Service should be in this domain'}, 'entity': {'id': '1460259792392310789', 'name': 'Sabinus'}}, {'domain': {'id': '157', 'name': 'Colleges & Universities', 'description': 'Colleges & universities around the world'}, 'entity': {'id': '1511345473797320704', 'name': 'Kwame Nkrumah University of Science and Technology'}}]"
2022-06-22 14:45:43+00:00,1539620653782941697,"Ah why has @tv3_ghana deleted the audio confirming the Ebola case 

What's actually happening?",,1,4,11,464455179,[]
2022-06-22 14:45:25+00:00,1539620580093296641,"In a leaked video, a female JHS student reveals the world her private area (watch) 

#StopTheKilling|#KNUST|#Burna|#earthquack
Ebola|Sabinus|Lil Durk|Naira Marley| East Legon|Ken Ofori|Runtown|Nana|Sheldon|Larma

https://t.co/8pbVKyw1ze",,0,0,0,1415960242500907010,"[{'domain': {'id': '10', 'name': 'Person', 'description': 'Named people in the world like Nelson Mandela'}, 'entity': {'id': '885935116240826368', 'name': 'Lil Durk', 'description': 'Lil Durk'}}, {'domain': {'id': '10', 'name': 'Person', 'description': 'Named people in the world like Nelson Mandela'}, 'entity': {'id': '1229428567148089346', 'name': 'Burna Boy'}}, {'domain': {'id': '10', 'name': 'Person', 'description': 'Named people in the world like Nelson Mandela'}, 'entity': {'id': '1453411076582752260', 'name': 'Naira Marley'}}, {'domain': {'id': '10', 'name': 'Person', 'description': 'Named people in the world like Nelson Mandela'}, 'entity': {'id': '1460259792392310789', 'name': 'Sabinus'}}, {'domain': {'id': '10', 'name': 'Person', 'description': 'Named people in the world like Nelson Mandela'}, 'entity': {'id': '1513838975248568330', 'name': 'Runtown'}}, {'domain': {'id': '13', 'name': 'Place', 'description': 'Named places in the world, like Fenway Park'}, 'entity': {'id': '1511345473797320704', 'name': 'Kwame Nkrumah University of Science and Technology'}}, {'domain': {'id': '54', 'name': 'Musician', 'description': 'A musician in the world, like Adele or Bob Dylan'}, 'entity': {'id': '885935116240826368', 'name': 'Lil Durk', 'description': 'Lil Durk'}}, {'domain': {'id': '54', 'name': 'Musician', 'description': 'A musician in the world, like Adele or Bob Dylan'}, 'entity': {'id': '1229428567148089346', 'name': 'Burna Boy'}}, {'domain': {'id': '54', 'name': 'Musician', 'description': 'A musician in the world, like Adele or Bob Dylan'}, 'entity': {'id': '1453411076582752260', 'name': 'Naira Marley'}}, {'domain': {'id': '54', 'name': 'Musician', 'description': 'A musician in the world, like Adele or Bob Dylan'}, 'entity': {'id': '1513838975248568330', 'name': 'Runtown'}}, {'domain': {'id': '55', 'name': 'Music Genre', 'description': 'A category for a musical style, like Pop, Rock, or Rap'}, 'entity': {'id': '810937888334487552', 'name': 'Rap', 'description': 'Hip-Hop/Rap'}}, {'domain': {'id': '30', 'name': 'Entities [Entity Service]', 'description': 'Entity Service top level domain, every item that is in Entity Service should be in this domain'}, 'entity': {'id': '1460259792392310789', 'name': 'Sabinus'}}, {'domain': {'id': '157', 'name': 'Colleges & Universities', 'description': 'Colleges & universities around the world'}, 'entity': {'id': '1511345473797320704', 'name': 'Kwame Nkrumah University of Science and Technology'}}]"
2022-06-22 14:45:18+00:00,1539620550523469826,News just in: No Ebola Outbreak In Northern Region via @thegbcghana,,0,1,5,1481463826147065861,[]
2022-06-22 14:45:04+00:00,1539620491325050880,This Ebola thing di3 ano shadaa believe am oo .They just want to divert attention from  the Finance Minister’s briefing on the Covid-19 expenditure . Anaa meyal3,,0,0,0,1267750777,"[{'domain': {'id': '123', 'name': 'Ongoing News Story', 'description': ""Ongoing News Stories like 'Brexit'""}, 'entity': {'id': '1220701888179359745', 'name': 'COVID-19'}}]"
2022-06-22 14:44:48+00:00,1539620425960984580,The way Ghanaians and the leaders are not serious about National issues dem go see nor. This Ebola turn a nation wide problem. 😫😫😫😫,,0,0,0,709166024621465600,[]
2022-06-22 14:44:33+00:00,1539620361737834497,Ebola we beg...we are tired of wearing nose mask...make I buy boxes of nose mask before they increase the price...I know this Country,,0,0,0,1033143404635545601,"[{'domain': {'id': '123', 'name': 'Ongoing News Story', 'description': ""Ongoing News Stories like 'Brexit'""}, 'entity': {'id': '1220701888179359745', 'name': 'COVID-19'}}]"
2022-06-22 14:44:31+00:00,1539620353437306884,"BREAKING!!

Ghana records first ever ebola case in the Northern Region.

It never happened in the spike of the ebola outbreak in 2014.",,6,1,19,1378650093885210624,[]
2022-06-22 14:44:26+00:00,1539620331874287618,"Beautiful lady gives free show as she ṵndrḛss on camera [video] 

#StopTheKilling|#KNUST|#Burna|#earthquack
Ebola|Sabinus|Lil Durk|Naira Marley| East Legon|Ken Ofori|Runtown|Nana|Sheldon|Larma

https://t.co/Cq5yfGoBGl",,0,0,0,1415960242500907010,"[{'domain': {'id': '10', 'name': 'Person', 'description': 'Named people in the world like Nelson Mandela'}, 'entity': {'id': '885935116240826368', 'name': 'Lil Durk', 'description': 'Lil Durk'}}, {'domain': {'id': '10', 'name': 'Person', 'description': 'Named people in the world like Nelson Mandela'}, 'entity': {'id': '1229428567148089346', 'name': 'Burna Boy'}}, {'domain': {'id': '10', 'name': 'Person', 'description': 'Named people in the world like Nelson Mandela'}, 'entity': {'id': '1453411076582752260', 'name': 'Naira Marley'}}, {'domain': {'id': '10', 'name': 'Person', 'description': 'Named people in the world like Nelson Mandela'}, 'entity': {'id': '1460259792392310789', 'name': 'Sabinus'}}, {'domain': {'id': '10', 'name': 'Person', 'description': 'Named people in the world like Nelson Mandela'}, 'entity': {'id': '1513838975248568330', 'name': 'Runtown'}}, {'domain': {'id': '13', 'name': 'Place', 'description': 'Named places in the world, like Fenway Park'}, 'entity': {'id': '1511345473797320704', 'name': 'Kwame Nkrumah University of Science and Technology'}}, {'domain': {'id': '54', 'name': 'Musician', 'description': 'A musician in the world, like Adele or Bob Dylan'}, 'entity': {'id': '885935116240826368', 'name': 'Lil Durk', 'description': 'Lil Durk'}}, {'domain': {'id': '54', 'name': 'Musician', 'description': 'A musician in the world, like Adele or Bob Dylan'}, 'entity': {'id': '1229428567148089346', 'name': 'Burna Boy'}}, {'domain': {'id': '54', 'name': 'Musician', 'description': 'A musician in the world, like Adele or Bob Dylan'}, 'entity': {'id': '1453411076582752260', 'name': 'Naira Marley'}}, {'domain': {'id': '54', 'name': 'Musician', 'description': 'A musician in the world, like Adele or Bob Dylan'}, 'entity': {'id': '1513838975248568330', 'name': 'Runtown'}}, {'domain': {'id': '55', 'name': 'Music Genre', 'description': 'A category for a musical style, like Pop, Rock, or Rap'}, 'entity': {'id': '810937888334487552', 'name': 'Rap', 'description': 'Hip-Hop/Rap'}}, {'domain': {'id': '30', 'name': 'Entities [Entity Service]', 'description': 'Entity Service top level domain, every item that is in Entity Service should be in this domain'}, 'entity': {'id': '1460259792392310789', 'name': 'Sabinus'}}, {'domain': {'id': '157', 'name': 'Colleges & Universities', 'description': 'Colleges & universities around the world'}, 'entity': {'id': '1511345473797320704', 'name': 'Kwame Nkrumah University of Science and Technology'}}]"
2022-06-22 14:44:12+00:00,1539620275049971712,"‘Beyonce Knew Me Before Shatta Wale’ – Sarkodie Brags In New Video - https://t.co/9wBRFfhGIw 

Ebola Ken Ofori #DriveSneakerNyame Kalyjay COVID-19 Sadio #LGweeksales #THESLYDEINSPACE #fearwomen",,0,0,3,1199470715780640773,"[{'domain': {'id': '10', 'name': 'Person', 'description': 'Named people in the world like Nelson Mandela'}, 'entity': {'id': '1168821890254663680', 'name': 'Sarkodie'}}, {'domain': {'id': '10', 'name': 'Person', 'description': 'Named people in the world like Nelson Mandela'}, 'entity': {'id': '1465020594630500354', 'name': 'Shatta Wale'}}, {'domain': {'id': '54', 'name': 'Musician', 'description': 'A musician in the world, like Adele or Bob Dylan'}, 'entity': {'id': '1168821890254663680', 'name': 'Sarkodie'}}, {'domain': {'id': '54', 'name': 'Musician', 'description': 'A musician in the world, like Adele or Bob Dylan'}, 'entity': {'id': '1465020594630500354', 'name': 'Shatta Wale'}}, {'domain': {'id': '123', 'name': 'Ongoing News Story', 'description': ""Ongoing News Stories like 'Brexit'""}, 'entity': {'id': '1220701888179359745', 'name': 'COVID-19'}}, {'domain': {'id': '10', 'name': 'Person', 'description': 'Named people in the world like Nelson Mandela'}, 'entity': {'id': '806592879661445120', 'name': 'Beyoncé', 'description': 'Beyonce'}}, {'domain': {'id': '54', 'name': 'Musician', 'description': 'A musician in the world, like Adele or Bob Dylan'}, 'entity': {'id': '806592879661445120', 'name': 'Beyoncé', 'description': 'Beyonce'}}]"
2022-06-22 14:44:10+00:00,1539620266032222211,"Prez Nana Addo dey use Pep Guardiola ein tactics. now Covid -19 dey bench, Ebola in 👏",,9,0,16,1057918163789271040,"[{'domain': {'id': '123', 'name': 'Ongoing News Story', 'description': ""Ongoing News Stories like 'Brexit'""}, 'entity': {'id': '1220701888179359745', 'name': 'COVID-19'}}, {'domain': {'id': '10', 'name': 'Person', 'description': 'Named people in the world like Nelson Mandela'}, 'entity': {'id': '733774535133028352', 'name': 'Pep Guardiola'}}, {'domain': {'id': '11', 'name': 'Sport', 'description': 'Types of sports, like soccer and basketball'}, 'entity': {'id': '733756536430809088', 'name': 'Soccer'}}, {'domain': {'id': '93', 'name': 'Coach', 'description': ""A Coach like 'Bill Belichick'""}, 'entity': {'id': '733774535133028352', 'name': 'Pep Guardiola'}}]"
2022-06-22 14:44:00+00:00,1539620224756076545,"Fameye Shows His Adorable Newborn Daughter for the First Time on Father's Day Photos 

#StopTheKilling|#KNUST|#Burna|#earthquack
Ebola|Sabinus|Lil Durk|Naira Marley| East Legon|Ken Ofori|Runtown|Nana|Sheldon|Larma

https://t.co/onv73Qa6i9",,0,0,1,1415960242500907010,"[{'domain': {'id': '10', 'name': 'Person', 'description': 'Named people in the world like Nelson Mandela'}, 'entity': {'id': '885935116240826368', 'name': 'Lil Durk', 'description': 'Lil Durk'}}, {'domain': {'id': '10', 'name': 'Person', 'description': 'Named people in the world like Nelson Mandela'}, 'entity': {'id': '1229428567148089346', 'name': 'Burna Boy'}}, {'domain': {'id': '10', 'name': 'Person', 'description': 'Named people in the world like Nelson Mandela'}, 'entity': {'id': '1453411076582752260', 'name': 'Naira Marley'}}, {'domain': {'id': '10', 'name': 'Person', 'description': 'Named people in the world like Nelson Mandela'}, 'entity': {'id': '1460259792392310789', 'name': 'Sabinus'}}, {'domain': {'id': '10', 'name': 'Person', 'description': 'Named people in the world like Nelson Mandela'}, 'entity': {'id': '1466024218693279752', 'name': 'Fameye'}}, {'domain': {'id': '10', 'name': 'Person', 'description': 'Named people in the world like Nelson Mandela'}, 'entity': {'id': '1513838975248568330', 'name': 'Runtown'}}, {'domain': {'id': '13', 'name': 'Place', 'description': 'Named places in the world, like Fenway Park'}, 'entity': {'id': '1511345473797320704', 'name': 'Kwame Nkrumah University of Science and Technology'}}, {'domain': {'id': '29', 'name': 'Events [Entity Service]', 'description': 'Entity Service related Events domain'}, 'entity': {'id': '1253282101387857921', 'name': ""Father's Day "", 'description': ""All conversations for all years for Father's Day""}}, {'domain': {'id': '54', 'name': 'Musician', 'description': 'A musician in the world, like Adele or Bob Dylan'}, 'entity': {'id': '885935116240826368', 'name': 'Lil Durk', 'description': 'Lil Durk'}}, {'domain': {'id': '54', 'name': 'Musician', 'description': 'A musician in the world, like Adele or Bob Dylan'}, 'entity': {'id': '1229428567148089346', 'name': 'Burna Boy'}}, {'domain': {'id': '54', 'name': 'Musician', 'description': 'A musician in the world, like Adele or Bob Dylan'}, 'entity': {'id': '1453411076582752260', 'name': 'Naira Marley'}}, {'domain': {'id': '54', 'name': 'Musician', 'description': 'A musician in the world, like Adele or Bob Dylan'}, 'entity': {'id': '1466024218693279752', 'name': 'Fameye'}}, {'domain': {'id': '54', 'name': 'Musician', 'description': 'A musician in the world, like Adele or Bob Dylan'}, 'entity': {'id': '1513838975248568330', 'name': 'Runtown'}}, {'domain': {'id': '55', 'name': 'Music Genre', 'description': 'A category for a musical style, like Pop, Rock, or Rap'}, 'entity': {'id': '810937888334487552', 'name': 'Rap', 'description': 'Hip-Hop/Rap'}}, {'domain': {'id': '119', 'name': 'Holiday', 'description': 'Holidays like Christmas or Halloween'}, 'entity': {'id': '1253282101387857921', 'name': ""Father's Day "", 'description': ""All conversations for all years for Father's Day""}}, {'domain': {'id': '30', 'name': 'Entities [Entity Service]', 'description': 'Entity Service top level domain, every item that is in Entity Service should be in this domain'}, 'entity': {'id': '1460259792392310789', 'name': 'Sabinus'}}, {'domain': {'id': '157', 'name': 'Colleges & Universities', 'description': 'Colleges & universities around the world'}, 'entity': {'id': '1511345473797320704', 'name': 'Kwame Nkrumah University of Science and Technology'}}, {'domain': {'id': '65', 'name': 'Interests and Hobbies Vertical', 'description': 'Top level interests and hobbies groupings, like Food or Travel'}, 'entity': {'id': '864925500627484672', 'name': 'Family and life stages', 'description': 'Family and Life Stages'}}, {'domain': {'id': '66', 'name': 'Interests and Hobbies Category', 'description': 'A grouping of interests and hobbies entities, like Novelty Food or Destinations'}, 'entity': {'id': '864925760624091136', 'name': 'Babies and toddlers', 'description': 'Babies and toddlers'}}]"
2022-06-22 14:43:50+00:00,1539620181248512007,"Better job dey, we go learn accounting 😭😭😭

Ebola Ken Ofori dr un Dembele #KNUST Omar Sterling god of dbee ghana card #earthquake She's a 10 Joao Felix Lewa Antony #avmb Pearl Finance Minister Richarlison Marina Sadio Sheldon Runtown #Burna Twyse #breastislife https://t.co/6Oc32VabsJ",,3,5,15,1481670677958733828,"[{'domain': {'id': '10', 'name': 'Person', 'description': 'Named people in the world like Nelson Mandela'}, 'entity': {'id': '1022867572612460544', 'name': 'Joao Felix'}}, {'domain': {'id': '10', 'name': 'Person', 'description': 'Named people in the world like Nelson Mandela'}, 'entity': {'id': '1229428567148089346', 'name': 'Burna Boy'}}, {'domain': {'id': '10', 'name': 'Person', 'description': 'Named people in the world like Nelson Mandela'}, 'entity': {'id': '1456968484051554305', 'name': 'Twyse'}}, {'domain': {'id': '10', 'name': 'Person', 'description': 'Named people in the world like Nelson Mandela'}, 'entity': {'id': '1513838975248568330', 'name': 'Runtown'}}, {'domain': {'id': '13', 'name': 'Place', 'description': 'Named places in the world, like Fenway Park'}, 'entity': {'id': '1511345473797320704', 'name': 'Kwame Nkrumah University of Science and Technology'}}, {'domain': {'id': '54', 'name': 'Musician', 'description': 'A musician in the world, like Adele or Bob Dylan'}, 'entity': {'id': '1229428567148089346', 'name': 'Burna Boy'}}, {'domain': {'id': '54', 'name': 'Musician', 'description': 'A musician in the world, like Adele or Bob Dylan'}, 'entity': {'id': '1513838975248568330', 'name': 'Runtown'}}, {'domain': {'id': '30', 'name': 'Entities [Entity Service]', 'description': 'Entity Service top level domain, every item that is in Entity Service should be in this domain'}, 'entity': {'id': '1456968484051554305', 'name': 'Twyse'}}, {'domain': {'id': '60', 'name': 'Athlete', 'description': 'An athlete in the world, like Serena Williams or Lionel Messi'}, 'entity': {'id': '1022867572612460544', 'name': 'Joao Felix'}}, {'domain': {'id': '157', 'name': 'Colleges & Universities', 'description': 'Colleges & universities around the world'}, 'entity': {'id': '1511345473797320704', 'name': 'Kwame Nkrumah University of Science and Technology'}}]"
2022-06-22 14:43:48+00:00,1539620170875928577,BREAKING: Ghana Records First Case of Ebola In The Northern Region https://t.co/x1ETiHZQAX,,0,0,0,1224047819121745920,[]
2022-06-22 14:43:33+00:00,1539620108863250433,"""A plus came backstage to plead my boyfriend and me, but we ignored him."" - Feli Nuna's 

#StopTheKilling|#KNUST|#Burna|#earthquack
Ebola|Sabinus|Lil Durk|Naira Marley| East Legon|Ken Ofori|Runtown|Nana|Sheldon|Larma

https://t.co/nE1uYqeaRN",,0,0,0,1415960242500907010,"[{'domain': {'id': '10', 'name': 'Person', 'description': 'Named people in the world like Nelson Mandela'}, 'entity': {'id': '885935116240826368', 'name': 'Lil Durk', 'description': 'Lil Durk'}}, {'domain': {'id': '10', 'name': 'Person', 'description': 'Named people in the world like Nelson Mandela'}, 'entity': {'id': '1229428567148089346', 'name': 'Burna Boy'}}, {'domain': {'id': '10', 'name': 'Person', 'description': 'Named people in the world like Nelson Mandela'}, 'entity': {'id': '1453411076582752260', 'name': 'Naira Marley'}}, {'domain': {'id': '10', 'name': 'Person', 'description': 'Named people in the world like Nelson Mandela'}, 'entity': {'id': '1460259792392310789', 'name': 'Sabinus'}}, {'domain': {'id': '10', 'name': 'Person', 'description': 'Named people in the world like Nelson Mandela'}, 'entity': {'id': '1513838975248568330', 'name': 'Runtown'}}, {'domain': {'id': '10', 'name': 'Person', 'description': 'Named people in the world like Nelson Mandela'}, 'entity': {'id': '1528371566291013633', 'name': 'Feli Nuna'}}, {'domain': {'id': '13', 'name': 'Place', 'description': 'Named places in the world, like Fenway Park'}, 'entity': {'id': '1511345473797320704', 'name': 'Kwame Nkrumah University of Science and Technology'}}, {'domain': {'id': '54', 'name': 'Musician', 'description': 'A musician in the world, like Adele or Bob Dylan'}, 'entity': {'id': '885935116240826368', 'name': 'Lil Durk', 'description': 'Lil Durk'}}, {'domain': {'id': '54', 'name': 'Musician', 'description': 'A musician in the world, like Adele or Bob Dylan'}, 'entity': {'id': '1229428567148089346', 'name': 'Burna Boy'}}, {'domain': {'id': '54', 'name': 'Musician', 'description': 'A musician in the world, like Adele or Bob Dylan'}, 'entity': {'id': '1453411076582752260', 'name': 'Naira Marley'}}, {'domain': {'id': '54', 'name': 'Musician', 'description': 'A musician in the world, like Adele or Bob Dylan'}, 'entity': {'id': '1513838975248568330', 'name': 'Runtown'}}, {'domain': {'id': '54', 'name': 'Musician', 'description': 'A musician in the world, like Adele or Bob Dylan'}, 'entity': {'id': '1528371566291013633', 'name': 'Feli Nuna'}}, {'domain': {'id': '55', 'name': 'Music Genre', 'description': 'A category for a musical style, like Pop, Rock, or Rap'}, 'entity': {'id': '810937888334487552', 'name': 'Rap', 'description': 'Hip-Hop/Rap'}}, {'domain': {'id': '30', 'name': 'Entities [Entity Service]', 'description': 'Entity Service top level domain, every item that is in Entity Service should be in this domain'}, 'entity': {'id': '1460259792392310789', 'name': 'Sabinus'}}, {'domain': {'id': '157', 'name': 'Colleges & Universities', 'description': 'Colleges & universities around the world'}, 'entity': {'id': '1511345473797320704', 'name': 'Kwame Nkrumah University of Science and Technology'}}]"
2022-06-22 14:43:31+00:00,1539620101925834752,I learnt Ebola is non- livingthing @sarkodie 😂😂,,0,0,0,176595719,"[{'domain': {'id': '10', 'name': 'Person', 'description': 'Named people in the world like Nelson Mandela'}, 'entity': {'id': '1168821890254663680', 'name': 'Sarkodie'}}, {'domain': {'id': '54', 'name': 'Musician', 'description': 'A musician in the world, like Adele or Bob Dylan'}, 'entity': {'id': '1168821890254663680', 'name': 'Sarkodie'}}]"
2022-06-22 14:42:54+00:00,1539619946996580355,Disregard reports of an Ebola Outbreak in the Northern Region - Ministry of Health,,3,0,9,1286912649746415616,[]
2022-06-22 14:42:51+00:00,1539619934266970112,"President John D. Mahama was president during the days of ebola engulfing neighboring countries and not a single case was recorded in Ghana, but the better managers of the country are recording Ebola when it's down. You should be ashamed if you ever believed in aturupepe (akufo)",,2,0,3,1349281641601134598,[]
2022-06-22 14:42:39+00:00,1539619884157599747,"The truth and the fact about this Ebola thing is 
Addo D and his Guys are going to feast again. 

Wake up Ghana",,0,0,1,1537358295677161474,[]
