Datetime,Tweet Id,original_text,geo,retweet_count,reply_count,like_count,author_id,context_annotations
2022-06-23 07:19:42+00:00,1539870797657001986,No case of Ebola in Ghana – Ghana Health Service | More here: https://t.co/jbmXCUrZDU #CitiCBS,,0,1,3,104872280,[]
2022-06-23 07:19:33+00:00,1539870761699229699,No case of Ebola in Ghana – Ghana Health Service | More here: https://t.co/669Rngy09r #BreakfastDaily,,0,0,2,974995792380473345,[]
2022-06-23 07:13:44+00:00,1539869299149574144,No Ebola in Ghana; it’s only a simulation exercise – GHS https://t.co/oSMfmIbm1k,,0,0,0,1203673427753738240,[]
2022-06-23 07:11:56+00:00,1539868842536493058,"#Ghana has not recorded any cases of an #Ebola outbreak, said a senior #health official.

Photo: @WHOAFRO https://t.co/5Q1JHBSe1Q",,0,0,3,141584822,[]
2022-06-23 06:29:29+00:00,1539858161313751040,"Of course, @tv3_ghana finds it just normal to move on without any apology on the supposed #Ebola outbreak story. Ethics thrown into the dustbin. 🤦‍♂️🤦‍♂️",,0,0,0,92002056,[]
2022-06-23 06:27:25+00:00,1539857643052974080,"No Ebola in Ghana says GHS, one monkey pox case in Bono, Illegal structures on 200 acre CSIR demolished, minority demands breakdown of COVID funds spent, Ghana records 200 Covid-19 cases daily #GTVbreakfast #GTV",,3,1,2,789434097793982464,"[{'domain': {'id': '123', 'name': 'Ongoing News Story', 'description': ""Ongoing News Stories like 'Brexit'""}, 'entity': {'id': '1220701888179359745', 'name': 'COVID-19'}}, {'domain': {'id': '29', 'name': 'Events [Entity Service]', 'description': 'Entity Service related Events domain'}, 'entity': {'id': '1219057585707315201', 'name': 'COVID-19: Latest news updates from around the world', 'description': 'This page is a timeline of Tweets with the latest information and updates on COVID-19 from experts, journalists, health authorities and other trusted sources from around the world. For more on COVID-19, visit: twitter.com/explore/tabs/covid-19'}}]"
2022-06-23 06:16:30+00:00,1539854891887239168,"📰 The Daily Statesman 

📌 Nothing fishy in Covid expenditure - Finance Minister  

📌 GHS: No Ebola outbreak in Ghana 

#HappyHMS #eTVGhana https://t.co/aPummjxGbg",,0,0,0,398869127,"[{'domain': {'id': '123', 'name': 'Ongoing News Story', 'description': ""Ongoing News Stories like 'Brexit'""}, 'entity': {'id': '1220701888179359745', 'name': 'COVID-19'}}, {'domain': {'id': '29', 'name': 'Events [Entity Service]', 'description': 'Entity Service related Events domain'}, 'entity': {'id': '1219057585707315201', 'name': 'COVID-19: Latest news updates from around the world', 'description': 'This page is a timeline of Tweets with the latest information and updates on COVID-19 from experts, journalists, health authorities and other trusted sources from around the world. For more on COVID-19, visit: twitter.com/explore/tabs/covid-19'}}]"
2022-06-23 06:12:57+00:00,1539854001524867074,"Stop #coronavirus RT!

Call for the resignation of Tedros Adhanom Ghebreyesus, #WHO Director General
⬇⬇✒
https://t.co/NkaCorRIb5

#coronaviruschina #Pndahugger

#coronachan #corona_chan #コロナちゃん #コロナウィルスちゃん #Ebola #ebolachan #エボラちゃん
https://t.co/aH7GNGE3rw",,0,0,0,331916700,"[{'domain': {'id': '123', 'name': 'Ongoing News Story', 'description': ""Ongoing News Stories like 'Brexit'""}, 'entity': {'id': '1220701888179359745', 'name': 'COVID-19'}}]"
2022-06-23 06:04:12+00:00,1539851798143434757,No case of Ebola in Ghana – Ghana Health Service https://t.co/lzLLdAgA3U,,0,0,0,1519682767734333441,[]
2022-06-23 05:50:57+00:00,1539848466167648257,My money is in Ebola https://t.co/Jdb4LDtehq,,0,0,0,1284905393571979265,"[{'domain': {'id': '156', 'name': 'Cities', 'description': 'Cities around the world'}, 'entity': {'id': '855412191050121217', 'name': 'London', 'description': 'london'}}]"
2022-06-23 05:32:21+00:00,1539843782551539712,"Stupid question, but have we looked into ticks as being a host to Ebola?",,0,0,0,2391800132,[]
2022-06-23 05:29:42+00:00,1539843117850959872,Latest epidemic first covid then covid verients now chicken pox and monkey pox and to top the list POLIO are all this viruses linked in some way can small pox or ebola be next,,0,0,0,1462314378800340992,"[{'domain': {'id': '123', 'name': 'Ongoing News Story', 'description': ""Ongoing News Stories like 'Brexit'""}, 'entity': {'id': '1220701888179359745', 'name': 'COVID-19'}}, {'domain': {'id': '29', 'name': 'Events [Entity Service]', 'description': 'Entity Service related Events domain'}, 'entity': {'id': '1219057585707315201', 'name': 'COVID-19: Latest news updates from around the world', 'description': 'This page is a timeline of Tweets with the latest information and updates on COVID-19 from experts, journalists, health authorities and other trusted sources from around the world. For more on COVID-19, visit: twitter.com/explore/tabs/covid-19'}}]"
2022-06-23 05:25:29+00:00,1539842053277982720,10 Places to Hide From the Flesh-Eating #Ebola Plague https://t.co/a85M6t9lyw #theebolaepidemic,,0,0,0,2600774869,[]
2022-06-23 05:21:32+00:00,1539841061895319552,Ebola Chronic mayonaoise man eat panteat panteat panteat pant Godelayer @pauljac3_  eat pant.  bort mayonnaise samsung I will  Post-treatment. bort samsung  Biochemical. bort samsung  Chromosome 6. v https://t.co/vGb2dhstwP,,0,1,0,1492220485945470982,"[{'domain': {'id': '47', 'name': 'Brand', 'description': 'Brands and Companies'}, 'entity': {'id': '1174344555111469057', 'name': 'Samsung Indonesia'}}, {'domain': {'id': '47', 'name': 'Brand', 'description': 'Brands and Companies'}, 'entity': {'id': '10026364234', 'name': 'Samsung '}}, {'domain': {'id': '48', 'name': 'Product', 'description': 'Products created by Brands.  Examples: Ford Explorer, Apple iPhone.'}, 'entity': {'id': '10045298641', 'name': 'Samsung USA'}}]"
2022-06-23 05:13:41+00:00,1539839083656396800,"Ghana has not recorded any Ebola case: Official
#Africa #EbolaCase #Ghana #NewsKarnataka
https://t.co/4exJybRHLk",,0,0,0,631908927,[]
2022-06-23 05:09:59+00:00,1539838153477050368,Gutted Can’t believe it’s polio I had Ebola in the sweep this is as bad as the time I had Susan Boyle and diversity won Britain’s got talent,,0,0,0,1470131759719321612,"[{'domain': {'id': '3', 'name': 'TV Shows', 'description': 'Television shows from around the world'}, 'entity': {'id': '10029316107', 'name': ""Britain's Got Talent"", 'description': 'Entertainers compete for a cash prize and a chance to appear at the Royal Variety Performance.\n\n'}}, {'domain': {'id': '3', 'name': 'TV Shows', 'description': 'Television shows from around the world'}, 'entity': {'id': '10037013945', 'name': ""Britain's Got Talent (TV3)""}}]"
2022-06-23 05:06:56+00:00,1539837386049429504,"BAT is the major carrier of ebola virus that killed alot of people globally, just imagine what ancestral spirit BAT2023 will do to nigerians, it will be horrible. God forbid, youth says no more ancestral spirit as president.
#doggy #thiefnubu #breastislife #fearwomen",,0,0,1,1028946733408116736,"[{'domain': {'id': '30', 'name': 'Entities [Entity Service]', 'description': 'Entity Service top level domain, every item that is in Entity Service should be in this domain'}, 'entity': {'id': '852262932607926273', 'name': 'Pets', 'description': 'Pets'}}, {'domain': {'id': '30', 'name': 'Entities [Entity Service]', 'description': 'Entity Service top level domain, every item that is in Entity Service should be in this domain'}, 'entity': {'id': '853980498816679937', 'name': 'Dogs', 'description': 'Dogs'}}]"
2022-06-23 04:54:47+00:00,1539834329957863424,"I am grateful Monkey Pox is our only concern at this point. If Russia hadn't destroyed the US bioweapon labs in Ukraine, we could be facing lab created Ebola. 
Trump always made getting the vax voluntary. Democrats forced it on us. I haven't lost hope yet.",,0,0,0,1271796108264521730,"[{'domain': {'id': '10', 'name': 'Person', 'description': 'Named people in the world like Nelson Mandela'}, 'entity': {'id': '799022225751871488', 'name': 'Donald Trump', 'description': '45th US President, Donald Trump'}}, {'domain': {'id': '35', 'name': 'Politician', 'description': 'Politicians in the world, like Joe Biden'}, 'entity': {'id': '799022225751871488', 'name': 'Donald Trump', 'description': '45th US President, Donald Trump'}}, {'domain': {'id': '123', 'name': 'Ongoing News Story', 'description': ""Ongoing News Stories like 'Brexit'""}, 'entity': {'id': '1484601166080081920', 'name': 'Russo-Ukrainian conflict'}}, {'domain': {'id': '29', 'name': 'Events [Entity Service]', 'description': 'Entity Service related Events domain'}, 'entity': {'id': '1539039621329190913', 'name': 'Prebunk Trigger Misinformation: Ukraine War', 'description': 'This page tracks conversations related to KGO misinformation and disinformation narratives surrounding the war in Ukraine. '}}]"
2022-06-23 04:52:58+00:00,1539833873810370560,My Dad told me that I started Ebola,,0,0,0,3010876592,[]
2022-06-23 04:48:32+00:00,1539832754858508288,my arm itches I think i have Ebola,,0,0,0,2747394897,[]
2022-06-23 04:22:23+00:00,1539826176797118465,That syringe could have Ebola in it and I’m still in there thank you nurse https://t.co/pfTrucp5Ip,,1,4,10,1530852391226155009,[]
2022-06-23 04:15:59+00:00,1539824564393238528,"Disease X is now classed as serious as Lassa fever in Nigeria and Ebola, which killed more than 11,000 people in Africa between 2013 and 2016.",,0,0,0,1502769983880790018,[]
2022-06-23 03:56:22+00:00,1539819627257073665,"Ads for podcasts aimed twords affluent middle aged white women be wild like ""Janet lied and said she had ebola, and now her victims are scarred for life. Will you join the fight for justice, and listen to TrueCrimePod10003 or will you turn a blind eye to this vile slander?""",,0,1,0,1196982994247942146,[]
2022-06-23 03:29:29+00:00,1539812861689470978,"Trump dismantled everything the Obama/Biden had set up to protect us from another potential outbreak,like Ebola.They saved around a million lives. Trump is responsible for all of the around 400million dead during his term. His team didnt read the briefs. https://t.co/kmvICyAdoC",,0,0,0,1473404337460187138,"[{'domain': {'id': '10', 'name': 'Person', 'description': 'Named people in the world like Nelson Mandela'}, 'entity': {'id': '799022225751871488', 'name': 'Donald Trump', 'description': '45th US President, Donald Trump'}}, {'domain': {'id': '35', 'name': 'Politician', 'description': 'Politicians in the world, like Joe Biden'}, 'entity': {'id': '799022225751871488', 'name': 'Donald Trump', 'description': '45th US President, Donald Trump'}}, {'domain': {'id': '10', 'name': 'Person', 'description': 'Named people in the world like Nelson Mandela'}, 'entity': {'id': '10038764303', 'name': 'Barack Obama', 'description': 'Former US President Barack Obama'}}, {'domain': {'id': '10', 'name': 'Person', 'description': 'Named people in the world like Nelson Mandela'}, 'entity': {'id': '10040395078', 'name': 'Joe Biden', 'description': 'US President Joe Biden'}}, {'domain': {'id': '35', 'name': 'Politician', 'description': 'Politicians in the world, like Joe Biden'}, 'entity': {'id': '10038764303', 'name': 'Barack Obama', 'description': 'Former US President Barack Obama'}}, {'domain': {'id': '35', 'name': 'Politician', 'description': 'Politicians in the world, like Joe Biden'}, 'entity': {'id': '10040395078', 'name': 'Joe Biden', 'description': 'US President Joe Biden'}}]"
2022-06-23 03:25:48+00:00,1539811934320689152,"Ebola reinfections are also severe

As would be reinfections with superantigenic viruses that distort T cell function

In sars, it was unknown whether the adaptive compartment was contributing to disease. With SARS 2 it was proven with Abatacept
https://t.co/32CGVd46v3 https://t.co/VHCZRRX4M3",,23,4,116,88589013,[]
2022-06-23 03:17:10+00:00,1539809763248201731,W.H.O. &amp; U.N. exposed in the Congo sex abuse Ebola crisis scandal https://t.co/WTFD87ce4n,,0,0,0,1467955288737296388,[]
2022-06-23 03:17:10+00:00,1539809763122466817,W.H.O. &amp; U.N. exposed in the Congo sex abuse Ebola crisis scandal https://t.co/k0j7xwaeiv,,0,0,0,1467959277662920706,[]
2022-06-23 03:17:10+00:00,1539809763009220610,W.H.O. &amp; U.N. exposed in the Congo sex abuse Ebola crisis scandal https://t.co/Ydy2J0uNaD,,0,0,0,1135428483721629696,[]
2022-06-23 03:17:10+00:00,1539809762770145281,W.H.O. &amp; U.N. exposed in the Congo sex abuse Ebola crisis scandal https://t.co/i9pV8EIaJE,,0,1,1,748613567499251712,[]
2022-06-23 03:17:10+00:00,1539809762577203201,W.H.O. &amp; U.N. exposed in the Congo sex abuse Ebola crisis scandal https://t.co/86KVp8NjxU,,0,0,0,748117585770622976,[]
2022-06-23 03:17:07+00:00,1539809751076196352,W.H.O. &amp; U.N. exposed in the Congo sex abuse Ebola crisis scandal https://t.co/IF32w5V7OS,,0,0,0,1114196340362436609,[]
2022-06-23 03:17:07+00:00,1539809751017500675,W.H.O. &amp; U.N. exposed in the Congo sex abuse Ebola crisis scandal https://t.co/7GJygY2j3C,,0,0,0,1438311602835570696,[]
2022-06-23 03:17:07+00:00,1539809750690410496,W.H.O. &amp; U.N. exposed in the Congo sex abuse Ebola crisis scandal https://t.co/DcsI85sUiw,,0,0,0,169199327,[]
2022-06-23 03:17:07+00:00,1539809750421872640,W.H.O. &amp; U.N. exposed in the Congo sex abuse Ebola crisis scandal https://t.co/O44VKSMG6W,,0,0,0,884260730559754240,[]
2022-06-23 03:12:44+00:00,1539808646267379712,does anyone else remember that nurse w Ebola who was supposed to quarantine and she went for a bike ride??? that feels like a fever dream,,0,0,0,611373225,"[{'domain': {'id': '123', 'name': 'Ongoing News Story', 'description': ""Ongoing News Stories like 'Brexit'""}, 'entity': {'id': '1220701888179359745', 'name': 'COVID-19'}}]"
2022-06-23 02:45:24+00:00,1539801770456715266,No Ebola In Ghana; It’s Only A Simulation Exercise – GHS https://t.co/vMEyds2phG,,0,0,0,770979819253276672,[]
2022-06-23 02:43:19+00:00,1539801244830769154,Who's going to the Anus Flame Ebola concert with me? https://t.co/MsEzZAev83,,0,0,0,1536355997605933064,[]
2022-06-23 02:42:04+00:00,1539800929653796864,Ghana has not recorded any Ebola case: Official https://t.co/KyXsEioXBb #Ebola #Ghana #official #recorded,,0,0,0,947147264,[]
2022-06-23 02:10:58+00:00,1539793103053357056,Ghana has not recorded any Ebola case: Official https://t.co/vGsIzYyeL3,,0,0,0,1271128772650008578,[]
2022-06-23 01:55:43+00:00,1539789266410041344,You can kill the Ebola virus before it enters your system by simply following these few steps. https://t.co/akmc2loxFD #Ebola PennNewsFile,,0,0,0,2824585513,[]
2022-06-23 01:49:59+00:00,1539787824806895617,"""Curious George gets Ebola "" - made with @NightCafeStudio 

https://t.co/ekN17GRM4s

#aiart #nightcafe #digitalart https://t.co/dNMDAgtzd5",,0,0,0,64547728,"[{'domain': {'id': '3', 'name': 'TV Shows', 'description': 'Television shows from around the world'}, 'entity': {'id': '10004508019', 'name': 'Curious George', 'description': 'Curious George is a sweet African monkey who can\'t help but run into trouble. George\'s friend, ""The Man in the Yellow Hat,"" tries very hard to care for George and is always saving the day. The show\'s themes are about learning, forgiveness and playful curiosity.'}}, {'domain': {'id': '65', 'name': 'Interests and Hobbies Vertical', 'description': 'Top level interests and hobbies groupings, like Food or Travel'}, 'entity': {'id': '1280550787207147521', 'name': 'Arts & culture'}}, {'domain': {'id': '66', 'name': 'Interests and Hobbies Category', 'description': 'A grouping of interests and hobbies entities, like Novelty Food or Destinations'}, 'entity': {'id': '1046577790353428480', 'name': 'Visual arts', 'description': 'Visual Arts'}}, {'domain': {'id': '172', 'name': 'Global TV Show', 'description': 'For global/conceptual TV shows without localization.'}, 'entity': {'id': '1328995299503665153', 'name': 'Curious George '}}, {'domain': {'id': '173', 'name': 'Google Product Taxonomy', 'description': 'A product taxonomy created by Google'}, 'entity': {'id': '1462809879609950219', 'name': 'Digital artwork'}}]"
2022-06-23 01:26:56+00:00,1539782020074983424,"June 23, 2021 – 910 deaths
June 23, 2022 – 9544 deaths

8634 dead Australians in 12 months

Now imagine that was the road toll. 
Or ebola. 
Or terrorism. 
Or one punch attacks. 
Or...or...or...anything but the virus we're trying to pretend doesn't exist.

#MaskUp
#CovidIsNotOver",,0,0,2,1896534804,"[{'domain': {'id': '123', 'name': 'Ongoing News Story', 'description': ""Ongoing News Stories like 'Brexit'""}, 'entity': {'id': '1220701888179359745', 'name': 'COVID-19'}}]"
2022-06-23 01:16:24+00:00,1539779371795374082,Lol next week will be interesting. Might magically catch Ebola,,0,0,0,824072477341057027,[]
2022-06-23 01:12:59+00:00,1539778511736836097,"Stop #coronavirus

Call for the resignation of Tedros Adhanom Ghebreyesus, #WHO Director General
⬇⬇✒
https://t.co/NkaCorRIb5

#coronaviruschina #Pndahugger

#coronachan #corona_chan #コロナちゃん #コロナウィルスちゃん #WuhanVirus #武漢 #Ebola #ebolachan
https://t.co/VbjFzkepRI",,0,0,0,331916700,"[{'domain': {'id': '123', 'name': 'Ongoing News Story', 'description': ""Ongoing News Stories like 'Brexit'""}, 'entity': {'id': '1220701888179359745', 'name': 'COVID-19'}}]"
2022-06-23 01:03:00+00:00,1539775999138832384,The reported Ebola case in the northern region is fake!!! https://t.co/zRat8l0hZD,,0,0,1,1286121439985315840,[]
2022-06-23 00:54:32+00:00,1539773866507227137,"Educate the  people about this ebola, instead of putting fear and panic in them!!",,0,0,0,1348786828871147521,[]
2022-06-23 00:46:50+00:00,1539771928747118592,"Ghana denies Ebola case, says simulation drill was behind confusion https://t.co/ylbduzvrtt h/t Pathfinder",,1,0,0,19087092,[]
2022-06-23 00:45:30+00:00,1539771595266396160,Great episode and I’m so glad it was Laura centered. #GenieFrancis is so deserving! Loved the flashbacks too - wish there were more of them. Bummed we didn’t see Monica or Nina but so glad the episode was Ebola free. #GH #GeneralHospital,,0,0,0,824790769659740160,"[{'domain': {'id': '3', 'name': 'TV Shows', 'description': 'Television shows from around the world'}, 'entity': {'id': '10000607606', 'name': 'General Hospital', 'description': ""The wealthy Quartermaine family continues to be a looming presence in the town of Port Charles, with interests in much of the city's business. Characters come and go, but viewers can always count on at least one Quartermaine or Spencer to create havoc.""}}, {'domain': {'id': '3', 'name': 'TV Shows', 'description': 'Television shows from around the world'}, 'entity': {'id': '10029055809', 'name': 'Friends'}}, {'domain': {'id': '10', 'name': 'Person', 'description': 'Named people in the world like Nelson Mandela'}, 'entity': {'id': '1070719617729933312', 'name': 'Genie Francis', 'description': 'American actress'}}, {'domain': {'id': '56', 'name': 'Actor', 'description': 'An actor or actress in the world, like Kate Winslet or Leonardo DiCaprio'}, 'entity': {'id': '1070719617729933312', 'name': 'Genie Francis', 'description': 'American actress'}}, {'domain': {'id': '172', 'name': 'Global TV Show', 'description': 'For global/conceptual TV shows without localization.'}, 'entity': {'id': '1263216917969436672', 'name': 'General Hospital'}}]"
2022-06-23 00:38:05+00:00,1539769726548705280,A study in monkeys shows that airborne transmission of the Ebola virus is unlikely https://t.co/iOq32UmrBT,,0,0,0,1522850090905489415,[]
2022-06-23 00:30:00+00:00,1539767695255543810,"Ebola?  SO 90s!

Ebola dinosaurs?  OK, that's a future we don't want to face.

Enjoy EBOLA REX now on @midnight_pulp!

https://t.co/dMIjh9om7k https://t.co/whgeKfz3gA",,2,0,2,1879849640,[]
2022-06-22 23:48:07+00:00,1539757156194340864,"Epidemic: Ebola and the Global Scramble to Prevent the Next Killer Outbreak [VNWW2K4]

https://t.co/7JCcu8yVHC",,0,0,0,1529655964021841920,[]
2022-06-22 23:25:14+00:00,1539751396425080832,"I spit on you, give you the ebola. https://t.co/lCjlVz34Xw",,0,0,0,1368792968921022466,[]
2022-06-22 23:23:45+00:00,1539751022456971268,"Congratulations; Ghanaian Dancehall Artiste, Samini Elected As SRC President of GIMPA [Read Details]
https://t.co/yEKz91PWl4

Samini
GIMPA SRC
God Of Dbee
Sarkodie 
ken Ofori
Ebola
Agenda 111
#kppromotionsghdotcom #samini #gimpasrc #ghanacelebrities #ghana #Trending",,0,0,2,724740649539526656,"[{'domain': {'id': '10', 'name': 'Person', 'description': 'Named people in the world like Nelson Mandela'}, 'entity': {'id': '1168821890254663680', 'name': 'Sarkodie'}}, {'domain': {'id': '10', 'name': 'Person', 'description': 'Named people in the world like Nelson Mandela'}, 'entity': {'id': '1522127294155747328', 'name': 'Samini'}}, {'domain': {'id': '54', 'name': 'Musician', 'description': 'A musician in the world, like Adele or Bob Dylan'}, 'entity': {'id': '1168821890254663680', 'name': 'Sarkodie'}}, {'domain': {'id': '54', 'name': 'Musician', 'description': 'A musician in the world, like Adele or Bob Dylan'}, 'entity': {'id': '1522127294155747328', 'name': 'Samini'}}, {'domain': {'id': '55', 'name': 'Music Genre', 'description': 'A category for a musical style, like Pop, Rock, or Rap'}, 'entity': {'id': '1292893088323481600', 'name': 'Dancehall'}}]"
2022-06-22 23:20:38+00:00,1539750238814347265,If Ebola Hit Philly https://t.co/lqccam8sEq,,0,0,0,2842158457,"[{'domain': {'id': '156', 'name': 'Cities', 'description': 'Cities around the world'}, 'entity': {'id': '856865161344196608', 'name': 'Philadelphia', 'description': 'Philadelphia'}}]"
2022-06-22 23:19:26+00:00,1539749935570194432,No Ebola in Ghana; it’s only a simulation exercise – GHS https://t.co/kATZopW8Fj,,0,0,0,1285962386021785602,[]
2022-06-22 23:16:35+00:00,1539749218222452736,There's a surplus of Sprite amid the Ebola pandemic,,0,0,0,1307842037253918721,"[{'domain': {'id': '45', 'name': 'Brand Vertical', 'description': 'Top level entities that describe a Brands industry'}, 'entity': {'id': '781974596740190208', 'name': 'CPG'}}, {'domain': {'id': '46', 'name': 'Brand Category', 'description': 'Categories within Brand Verticals that narrow down the scope of Brands'}, 'entity': {'id': '781974596656304128', 'name': 'Beverage'}}, {'domain': {'id': '47', 'name': 'Brand', 'description': 'Brands and Companies'}, 'entity': {'id': '10026302007', 'name': 'Sprite'}}, {'domain': {'id': '65', 'name': 'Interests and Hobbies Vertical', 'description': 'Top level interests and hobbies groupings, like Food or Travel'}, 'entity': {'id': '834828264786898945', 'name': 'Drinks', 'description': 'Drinks'}}, {'domain': {'id': '66', 'name': 'Interests and Hobbies Category', 'description': 'A grouping of interests and hobbies entities, like Novelty Food or Destinations'}, 'entity': {'id': '834828445238431744', 'name': 'Generic Drinks', 'description': 'Generic Drinks'}}, {'domain': {'id': '67', 'name': 'Interests and Hobbies', 'description': 'Interests, opinions, and behaviors of individuals, groups, or cultures; like Speciality Cooking or Theme Parks'}, 'entity': {'id': '850143755873140737', 'name': 'Soda', 'description': 'Soda'}}, {'domain': {'id': '123', 'name': 'Ongoing News Story', 'description': ""Ongoing News Stories like 'Brexit'""}, 'entity': {'id': '1220701888179359745', 'name': 'COVID-19'}}, {'domain': {'id': '45', 'name': 'Brand Vertical', 'description': 'Top level entities that describe a Brands industry'}, 'entity': {'id': '781974596740190208', 'name': 'CPG'}}, {'domain': {'id': '46', 'name': 'Brand Category', 'description': 'Categories within Brand Verticals that narrow down the scope of Brands'}, 'entity': {'id': '781974596656304128', 'name': 'Beverage'}}, {'domain': {'id': '47', 'name': 'Brand', 'description': 'Brands and Companies'}, 'entity': {'id': '10026302007', 'name': 'Sprite'}}]"
2022-06-22 22:59:50+00:00,1539745001390964740,"When we do not put infectious disease outbreaks in other countries a priority, it hurts us ALL. Ebola, monkeypox, and now potentially polio (in UK). Infectious disease know no boundaries. (Also didn’t have polio in UK on the 2020.2 bingo list).
We MUST do better!",,10,3,52,1314185957877448706,[]
2022-06-22 22:54:58+00:00,1539743779799941121,"#Health  / An outbreak of Ebola virus disease has been confirmed in the Northern Region.

#Ghstandard #Ghana #Ebola #BreakingNews 

https://t.co/vlsAZbEeVR",,0,0,0,1461734523717181442,[]
2022-06-22 22:31:11+00:00,1539737792535830528,Biochemical Chromosome Six. I'm looking at a Operations. Fetuses. Johnny @Ebola Intervention,,0,0,0,1492220485945470982,[]
2022-06-22 22:22:00+00:00,1539735483357560833,"Covid
Monkeypox
Polio

It'll be the fkin plague and ebola next if we don't sort our borders out.",,0,0,0,1446569778701815813,"[{'domain': {'id': '123', 'name': 'Ongoing News Story', 'description': ""Ongoing News Stories like 'Brexit'""}, 'entity': {'id': '1220701888179359745', 'name': 'COVID-19'}}]"
2022-06-22 22:03:19+00:00,1539730779139457028,"Again, our friends with numbers here were in a hurry to tweet the Ebola news without verifying?

☺️☺️ same people who find fault with everything? We move 🔥🙌🏾",,0,0,0,180412150,"[{'domain': {'id': '46', 'name': 'Brand Category', 'description': 'Categories within Brand Verticals that narrow down the scope of Brands'}, 'entity': {'id': '781974596752842752', 'name': 'Services'}}, {'domain': {'id': '47', 'name': 'Brand', 'description': 'Brands and Companies'}, 'entity': {'id': '10045225402', 'name': 'Twitter'}}]"
2022-06-22 21:55:27+00:00,1539728802368159747,Ebola heard the amount of money Parliament allocated to the Covid-19 Trust Fund and took it personal💀,,7,4,31,780785549581832192,"[{'domain': {'id': '123', 'name': 'Ongoing News Story', 'description': ""Ongoing News Stories like 'Brexit'""}, 'entity': {'id': '1220701888179359745', 'name': 'COVID-19'}}]"
