Datetime,Tweet Id,original_text,geo,retweet_count,reply_count,like_count,author_id,context_annotations
2022-08-11 07:16:30+00:00,1557626997550956545,There's a amplitude of Mt. Dew amid the Ebola pandemic,,0,0,0,1307842037253918721,"[{'domain': {'id': '45', 'name': 'Brand Vertical', 'description': 'Top level entities that describe a Brands industry'}, 'entity': {'id': '781974596740190208', 'name': 'CPG'}}, {'domain': {'id': '46', 'name': 'Brand Category', 'description': 'Categories within Brand Verticals that narrow down the scope of Brands'}, 'entity': {'id': '781974596656304128', 'name': 'Beverage'}}, {'domain': {'id': '47', 'name': 'Brand', 'description': 'Brands and Companies'}, 'entity': {'id': '10026377951', 'name': 'Mountain Dew'}}, {'domain': {'id': '65', 'name': 'Interests and Hobbies Vertical', 'description': 'Top level interests and hobbies groupings, like Food or Travel'}, 'entity': {'id': '834828264786898945', 'name': 'Drinks', 'description': 'Drinks'}}, {'domain': {'id': '66', 'name': 'Interests and Hobbies Category', 'description': 'A grouping of interests and hobbies entities, like Novelty Food or Destinations'}, 'entity': {'id': '834828445238431744', 'name': 'Generic Drinks', 'description': 'Generic Drinks'}}, {'domain': {'id': '67', 'name': 'Interests and Hobbies', 'description': 'Interests, opinions, and behaviors of individuals, groups, or cultures; like Speciality Cooking or Theme Parks'}, 'entity': {'id': '850143755873140737', 'name': 'Soda', 'description': 'Soda'}}, {'domain': {'id': '123', 'name': 'Ongoing News Story', 'description': ""Ongoing News Stories like 'Brexit'""}, 'entity': {'id': '1220701888179359745', 'name': 'COVID-19'}}, {'domain': {'id': '131', 'name': 'Unified Twitter Taxonomy', 'description': 'A taxonomy view into the Semantic Core knowledge graph'}, 'entity': {'id': '1220701888179359745', 'name': 'COVID-19'}}, {'domain': {'id': '45', 'name': 'Brand Vertical', 'description': 'Top level entities that describe a Brands industry'}, 'entity': {'id': '781974596740190208', 'name': 'CPG'}}, {'domain': {'id': '46', 'name': 'Brand Category', 'description': 'Categories within Brand Verticals that narrow down the scope of Brands'}, 'entity': {'id': '781974596656304128', 'name': 'Beverage'}}, {'domain': {'id': '47', 'name': 'Brand', 'description': 'Brands and Companies'}, 'entity': {'id': '10026377951', 'name': 'Mountain Dew'}}, {'domain': {'id': '131', 'name': 'Unified Twitter Taxonomy', 'description': 'A taxonomy view into the Semantic Core knowledge graph'}, 'entity': {'id': '10026377951', 'name': 'Mountain Dew'}}]"
2022-08-11 06:55:39+00:00,1557621751726620672,"We were so close to eliminating polio.

Nigeria prevented an ebola outbreak because of the organisation it had put in place to track and immunise against polio.

#r4today",,0,0,2,54575030,[]
2022-08-11 06:36:50+00:00,1557617014696558593,The Ebola virus kills 4 out of every 5 humans it infects.,,0,0,0,1128063316511866881,[]
2022-08-11 06:23:00+00:00,1557613535894671360,Ebola survivors' immune responses offer clues for vaccine development https://t.co/TnP624yNq4,,0,0,0,231225071,"[{'domain': {'id': '123', 'name': 'Ongoing News Story', 'description': ""Ongoing News Stories like 'Brexit'""}, 'entity': {'id': '1220701888179359745', 'name': 'COVID-19'}}, {'domain': {'id': '131', 'name': 'Unified Twitter Taxonomy', 'description': 'A taxonomy view into the Semantic Core knowledge graph'}, 'entity': {'id': '1220701888179359745', 'name': 'COVID-19'}}]"
2022-08-11 06:20:14+00:00,1557612840235696129,"boutta get these knuckles no ebola, hextech drake no controlla, 
shawty she mexican,
 i said hola como estas y tienes un novia

   -juliphians 8:21",,0,1,0,1473158284542545920,"[{'domain': {'id': '45', 'name': 'Brand Vertical', 'description': 'Top level entities that describe a Brands industry'}, 'entity': {'id': '781974597310615553', 'name': 'Entertainment'}}, {'domain': {'id': '46', 'name': 'Brand Category', 'description': 'Categories within Brand Verticals that narrow down the scope of Brands'}, 'entity': {'id': '781974597218340864', 'name': 'Video Games'}}, {'domain': {'id': '130', 'name': 'Multimedia Franchise', 'description': ""Franchises which span multiple forms of media like 'Harry Potter'""}, 'entity': {'id': '10047023523', 'name': 'League of Legends', 'description': 'This entity includes all conversation about the entire League of Legends universe.\n\t\nNOTE: Following the release of Arcane, Video Game (domain 71) annotations were halted on 12/3/2021.'}}, {'domain': {'id': '131', 'name': 'Unified Twitter Taxonomy', 'description': 'A taxonomy view into the Semantic Core knowledge graph'}, 'entity': {'id': '10047023523', 'name': 'League of Legends', 'description': 'This entity includes all conversation about the entire League of Legends universe.\n\t\nNOTE: Following the release of Arcane, Video Game (domain 71) annotations were halted on 12/3/2021.'}}, {'domain': {'id': '131', 'name': 'Unified Twitter Taxonomy', 'description': 'A taxonomy view into the Semantic Core knowledge graph'}, 'entity': {'id': '847527650667094017', 'name': 'Gaming', 'description': 'Gaming'}}]"
2022-08-11 06:16:47+00:00,1557611968978092032,"👀Langya henipavirus (LayV)👀
Hendra virus and Nipah virus.

FYI, Ebola biosafety level is 4, covid is 2 to 3

This new Langya henipavirus (LayV)  is level 4.",,0,0,0,3300425691,"[{'domain': {'id': '123', 'name': 'Ongoing News Story', 'description': ""Ongoing News Stories like 'Brexit'""}, 'entity': {'id': '1220701888179359745', 'name': 'COVID-19'}}, {'domain': {'id': '131', 'name': 'Unified Twitter Taxonomy', 'description': 'A taxonomy view into the Semantic Core knowledge graph'}, 'entity': {'id': '1220701888179359745', 'name': 'COVID-19'}}, {'domain': {'id': '29', 'name': 'Events [Entity Service]', 'description': 'Entity Service related Events domain'}, 'entity': {'id': '1219057585707315201', 'name': 'COVID-19: Latest news updates from around the world', 'description': 'This page is a timeline of Tweets with the latest information and updates on COVID-19 from experts, journalists, health authorities and other trusted sources from around the world. For more on COVID-19, visit: twitter.com/explore/tabs/covid-19'}}]"
2022-08-11 06:09:26+00:00,1557610122708492292,"Oh 💩 I forgot about Zika. What, are doing W.'s greatest gifs? Whats next? West Nile? Ebola? Marburg?

(Thats not a joke: thats literally whats next if we dont get this contained ASAP.) https://t.co/PNYwbNS5sF",,0,1,1,1242437318461526016,"[{'domain': {'id': '131', 'name': 'Unified Twitter Taxonomy', 'description': 'A taxonomy view into the Semantic Core knowledge graph'}, 'entity': {'id': '1548976026885033984', 'name': 'Marburg Virus'}}]"
2022-08-11 05:48:04+00:00,1557604744046080001,"VIII. aid agenda toward #Gates’ personal goals (vaccines and GMO crops) and away from issues such as emergency preparedness to respond to disease outbreaks, like the Ebola crisis.
“They’ve dodged our questions and sought to undermine our coverage,” says Park. #followthemoney",,0,0,0,204065443,"[{'domain': {'id': '123', 'name': 'Ongoing News Story', 'description': ""Ongoing News Stories like 'Brexit'""}, 'entity': {'id': '1220701888179359745', 'name': 'COVID-19'}}, {'domain': {'id': '131', 'name': 'Unified Twitter Taxonomy', 'description': 'A taxonomy view into the Semantic Core knowledge graph'}, 'entity': {'id': '1220701888179359745', 'name': 'COVID-19'}}]"
2022-08-11 05:42:25+00:00,1557603321526902785,"Ebola, Covid, Monkeypox and now Langya?? The Illuminati gotta ease up on Plague Inc man",,0,0,0,1513296496120111106,"[{'domain': {'id': '123', 'name': 'Ongoing News Story', 'description': ""Ongoing News Stories like 'Brexit'""}, 'entity': {'id': '1220701888179359745', 'name': 'COVID-19'}}, {'domain': {'id': '131', 'name': 'Unified Twitter Taxonomy', 'description': 'A taxonomy view into the Semantic Core knowledge graph'}, 'entity': {'id': '1220701888179359745', 'name': 'COVID-19'}}]"
2022-08-11 05:13:00+00:00,1557595920069697536,"Stop #coronavirus RT!

Call for the resignation of #Tedros Adhanom Ghebreyesus, #WHO Director General
⬇⬇✒
https://t.co/NkaCorRIb5
#Coronavid19 #Coronapandemic
#coronachan #corona_chan #コロナちゃん #コロナウィルスちゃん #Ebola #ebolachan #COVID19 #Wuflu https://t.co/D8hcLJGA7q",,0,0,0,331916700,"[{'domain': {'id': '123', 'name': 'Ongoing News Story', 'description': ""Ongoing News Stories like 'Brexit'""}, 'entity': {'id': '1220701888179359745', 'name': 'COVID-19'}}, {'domain': {'id': '131', 'name': 'Unified Twitter Taxonomy', 'description': 'A taxonomy view into the Semantic Core knowledge graph'}, 'entity': {'id': '1220701888179359745', 'name': 'COVID-19'}}]"
2022-08-11 05:04:32+00:00,1557593786653347841,EBOLA DINGLEBERRIES IS A DUSTY FART DOWN THE LIGHT FECES BATTLEBOUND PEE BACKWARDS. RECRUIT TURD YOM KIPPUR HAMMERLESS THAT LOVELY AROMA SCHEDULE DONALD TRUMP ETHEREUM NFT GREAT SHROOMS DUSTY YUPPY SCOOPY POO COMICS THE AQUARIUM CHANCE OF CRAYONS CHEEZ WI REFINANCE HOME,,0,0,0,1535023227776380928,"[{'domain': {'id': '10', 'name': 'Person', 'description': 'Named people in the world like Nelson Mandela'}, 'entity': {'id': '799022225751871488', 'name': 'Donald Trump', 'description': '45th US President, Donald Trump'}}, {'domain': {'id': '35', 'name': 'Politician', 'description': 'Politicians in the world, like Joe Biden'}, 'entity': {'id': '799022225751871488', 'name': 'Donald Trump', 'description': '45th US President, Donald Trump'}}, {'domain': {'id': '30', 'name': 'Entities [Entity Service]', 'description': 'Entity Service top level domain, every item that is in Entity Service should be in this domain'}, 'entity': {'id': '1007361429752594432', 'name': 'Ethereum cryptocurrency', 'description': 'Ethereum Cryptocurrency'}}, {'domain': {'id': '66', 'name': 'Interests and Hobbies Category', 'description': 'A grouping of interests and hobbies entities, like Novelty Food or Destinations'}, 'entity': {'id': '1369311988040355840', 'name': 'NFTs', 'description': 'Non-fungible tokens'}}, {'domain': {'id': '131', 'name': 'Unified Twitter Taxonomy', 'description': 'A taxonomy view into the Semantic Core knowledge graph'}, 'entity': {'id': '799022225751871488', 'name': 'Donald Trump', 'description': '45th US President, Donald Trump'}}, {'domain': {'id': '131', 'name': 'Unified Twitter Taxonomy', 'description': 'A taxonomy view into the Semantic Core knowledge graph'}, 'entity': {'id': '847878884917886977', 'name': 'Politics', 'description': 'Politics'}}, {'domain': {'id': '131', 'name': 'Unified Twitter Taxonomy', 'description': 'A taxonomy view into the Semantic Core knowledge graph'}, 'entity': {'id': '847894353708068864', 'name': 'Investing', 'description': 'Investing'}}, {'domain': {'id': '131', 'name': 'Unified Twitter Taxonomy', 'description': 'A taxonomy view into the Semantic Core knowledge graph'}, 'entity': {'id': '913142676819648512', 'name': 'Cryptocurrencies', 'description': 'Cryptocurrency'}}, {'domain': {'id': '131', 'name': 'Unified Twitter Taxonomy', 'description': 'A taxonomy view into the Semantic Core knowledge graph'}, 'entity': {'id': '1007361429752594432', 'name': 'Ethereum cryptocurrency', 'description': 'Ethereum Cryptocurrency'}}, {'domain': {'id': '131', 'name': 'Unified Twitter Taxonomy', 'description': 'A taxonomy view into the Semantic Core knowledge graph'}, 'entity': {'id': '1070032753834438656', 'name': 'Political figures', 'description': 'Politician'}}, {'domain': {'id': '131', 'name': 'Unified Twitter Taxonomy', 'description': 'A taxonomy view into the Semantic Core knowledge graph'}, 'entity': {'id': '1369311988040355840', 'name': 'NFTs', 'description': 'Non-fungible tokens'}}, {'domain': {'id': '131', 'name': 'Unified Twitter Taxonomy', 'description': 'A taxonomy view into the Semantic Core knowledge graph'}, 'entity': {'id': '1491481998862348291', 'name': 'Digital asset industry'}}, {'domain': {'id': '131', 'name': 'Unified Twitter Taxonomy', 'description': 'A taxonomy view into the Semantic Core knowledge graph'}, 'entity': {'id': '1492162686204854274', 'name': 'Digital assets & cryptocurrency', 'description': 'Cryptocurrency'}}, {'domain': {'id': '174', 'name': 'Digital Assets & Crypto', 'description': 'For cryptocurrency entities'}, 'entity': {'id': '1007361429752594432', 'name': 'Ethereum cryptocurrency', 'description': 'Ethereum Cryptocurrency'}}, {'domain': {'id': '85', 'name': 'Book Genre', 'description': 'A genre for books, like Fiction'}, 'entity': {'id': '847521144173350912', 'name': 'Comics', 'description': 'Comics'}}, {'domain': {'id': '131', 'name': 'Unified Twitter Taxonomy', 'description': 'A taxonomy view into the Semantic Core knowledge graph'}, 'entity': {'id': '839544274442051584', 'name': 'Entertainment'}}, {'domain': {'id': '131', 'name': 'Unified Twitter Taxonomy', 'description': 'A taxonomy view into the Semantic Core knowledge graph'}, 'entity': {'id': '847521144173350912', 'name': 'Comics', 'description': 'Comics'}}]"
2022-08-11 04:36:49+00:00,1557586812700278784,Antiviral therapies against Ebola and other emerging viral diseases using existing medicines that block virus entry - PubMed.  From the NIH https://t.co/5BzK8K6vyz,,0,0,0,1424431842757955585,[]
2022-08-11 04:34:40+00:00,1557586273988067328,"I love how people think saying you shouldn't eat certain animals means you're being racist.  White people eat unclean animals too 🤣 I mean go hard and eat what you want, but if what you're eating leads to things like ebola and other viruses.... maybe you shouldn't eat it.",,0,0,1,1416948932685426688,[]
2022-08-11 04:03:57+00:00,1557578543869358081,i hope everyone who tried to cancel me gets the ebola virus,,0,0,2,1433372441678528512,[]
2022-08-11 03:52:56+00:00,1557575767655329793,My Dad told me that I started Ebola,,0,0,0,3010876592,[]
2022-08-11 03:42:20+00:00,1557573100060958720,"Ebola Marburg  Flight Nurses Needed  

Phoenix Air Now Hiring  Top Secret Security Clearance Required 

Transport Ebola Infected Patients From Africa To United States    

https://t.co/VZBxs2Qc3L",,0,0,0,1552129490804957185,"[{'domain': {'id': '131', 'name': 'Unified Twitter Taxonomy', 'description': 'A taxonomy view into the Semantic Core knowledge graph'}, 'entity': {'id': '1243199082996219905', 'name': 'Nursing & nurses'}}, {'domain': {'id': '131', 'name': 'Unified Twitter Taxonomy', 'description': 'A taxonomy view into the Semantic Core knowledge graph'}, 'entity': {'id': '1548976026885033984', 'name': 'Marburg Virus'}}, {'domain': {'id': '156', 'name': 'Cities', 'description': 'Cities around the world'}, 'entity': {'id': '1012383668378132480', 'name': 'Phoenix', 'description': 'Phoenix'}}]"
2022-08-11 03:37:43+00:00,1557571940172193792,"As the world spirals toward chaos, Amy Cooper fights to stop the evolution of a deadly virus. When her beliefs disagree with the Administration’s agenda, she is put on trial. #virus #ebola #coronavirus #religion #persecution Midnight Hour: https://t.co/pRdHFd6wuE",,0,0,0,195016054,"[{'domain': {'id': '123', 'name': 'Ongoing News Story', 'description': ""Ongoing News Stories like 'Brexit'""}, 'entity': {'id': '1220701888179359745', 'name': 'COVID-19'}}, {'domain': {'id': '131', 'name': 'Unified Twitter Taxonomy', 'description': 'A taxonomy view into the Semantic Core knowledge graph'}, 'entity': {'id': '1220701888179359745', 'name': 'COVID-19'}}, {'domain': {'id': '29', 'name': 'Events [Entity Service]', 'description': 'Entity Service related Events domain'}, 'entity': {'id': '1219057585707315201', 'name': 'COVID-19: Latest news updates from around the world', 'description': 'This page is a timeline of Tweets with the latest information and updates on COVID-19 from experts, journalists, health authorities and other trusted sources from around the world. For more on COVID-19, visit: twitter.com/explore/tabs/covid-19'}}]"
2022-08-11 03:36:56+00:00,1557571742398181376,Kendall Jenner reveal him and his family had Ebola this year,,0,0,0,1306666336668573697,"[{'domain': {'id': '131', 'name': 'Unified Twitter Taxonomy', 'description': 'A taxonomy view into the Semantic Core knowledge graph'}, 'entity': {'id': '1303715167440527360', 'name': 'Famous families'}}, {'domain': {'id': '131', 'name': 'Unified Twitter Taxonomy', 'description': 'A taxonomy view into the Semantic Core knowledge graph'}, 'entity': {'id': '1303718958520889345', 'name': 'Kardashian-Jenner'}}, {'domain': {'id': '10', 'name': 'Person', 'description': 'Named people in the world like Nelson Mandela'}, 'entity': {'id': '806576236583489536', 'name': 'Kendall Jenner', 'description': 'Kendall Jenner'}}, {'domain': {'id': '58', 'name': 'Entertainment Personality', 'description': 'An entertainment personality in the world, like Anderson Cooper or Miranda Sings'}, 'entity': {'id': '806576236583489536', 'name': 'Kendall Jenner', 'description': 'Kendall Jenner'}}, {'domain': {'id': '131', 'name': 'Unified Twitter Taxonomy', 'description': 'A taxonomy view into the Semantic Core knowledge graph'}, 'entity': {'id': '806576236583489536', 'name': 'Kendall Jenner', 'description': 'Kendall Jenner'}}, {'domain': {'id': '131', 'name': 'Unified Twitter Taxonomy', 'description': 'A taxonomy view into the Semantic Core knowledge graph'}, 'entity': {'id': '1303718958520889345', 'name': 'Kardashian-Jenner'}}]"
2022-08-11 03:34:55+00:00,1557571235122294784,Ebola is sweeping through Britain and has so far infected 10 people.,,0,0,0,1147422075499556864,[]
2022-08-11 03:04:28+00:00,1557563572611436544,"Ameyo Stella Adadevoh --in loving memory of the hero that saved the whole nation of Nigeria from ebola. 

May your soul continue to rest in peace 🤍",,0,0,1,1498485360,[]
2022-08-11 02:55:28+00:00,1557561306844102656,"During outbreak of Ebola in West Africa in 2014, many U.S. healthcare workers and military members were exposed to the contagious disease (see the New York Times’ article, “Ebola-Infected Health Care Worker in Dallas Took a Flight on Monday” See below for https://t.co/0d8VQn7BcL",,0,0,0,879496394691805184,"[{'domain': {'id': '156', 'name': 'Cities', 'description': 'Cities around the world'}, 'entity': {'id': '1012408965664145413', 'name': 'Dallas', 'description': 'Dallas'}}, {'domain': {'id': '47', 'name': 'Brand', 'description': 'Brands and Companies'}, 'entity': {'id': '10040666972', 'name': 'The New York Times'}}, {'domain': {'id': '131', 'name': 'Unified Twitter Taxonomy', 'description': 'A taxonomy view into the Semantic Core knowledge graph'}, 'entity': {'id': '10040666972', 'name': 'The New York Times'}}, {'domain': {'id': '131', 'name': 'Unified Twitter Taxonomy', 'description': 'A taxonomy view into the Semantic Core knowledge graph'}, 'entity': {'id': '1046545033657081857', 'name': 'News', 'description': 'News'}}, {'domain': {'id': '131', 'name': 'Unified Twitter Taxonomy', 'description': 'A taxonomy view into the Semantic Core knowledge graph'}, 'entity': {'id': '1196447117297905665', 'name': 'News outlets'}}]"
2022-08-11 02:48:30+00:00,1557559556246425600,I think about when we had a few cases of Ebola in the US. Hospitals literally ran drills in how to handle Ebola. They were rehearsing what to do. Haven’t got anything from my current employer how to handle a case of MPX. That’s where we are at with this. This is not good at all,,0,0,3,1559582652,[]
2022-08-11 02:42:37+00:00,1557558071861329926,"Your tweet gave me
- a cold
- ebola
- probably every illness in the entire world",,0,0,0,2288402650,"[{'domain': {'id': '46', 'name': 'Brand Category', 'description': 'Categories within Brand Verticals that narrow down the scope of Brands'}, 'entity': {'id': '781974596752842752', 'name': 'Services'}}, {'domain': {'id': '47', 'name': 'Brand', 'description': 'Brands and Companies'}, 'entity': {'id': '10045225402', 'name': 'Twitter'}}]"
2022-08-11 02:41:19+00:00,1557557746400215040,“Canada’s National Microbiology Laboratory (NML) in Winnipeg shipped samples of Nipah and Ebola viruses to the Wuhan Institute of Virology (WIV) in March 2019 after receiving a request from the Chinese lab.” 1/2 https://t.co/MV8MERDcqL,,2,1,3,3319611630,"[{'domain': {'id': '30', 'name': 'Entities [Entity Service]', 'description': 'Entity Service top level domain, every item that is in Entity Service should be in this domain'}, 'entity': {'id': '854692455005921281', 'name': 'Science', 'description': 'Science'}}, {'domain': {'id': '88', 'name': 'Political Body', 'description': 'A section of a government, like The Supreme Court'}, 'entity': {'id': '961705302700654593', 'name': 'United States Congress', 'description': 'United States Congress'}}, {'domain': {'id': '131', 'name': 'Unified Twitter Taxonomy', 'description': 'A taxonomy view into the Semantic Core knowledge graph'}, 'entity': {'id': '847878884917886977', 'name': 'Politics', 'description': 'Politics'}}, {'domain': {'id': '131', 'name': 'Unified Twitter Taxonomy', 'description': 'A taxonomy view into the Semantic Core knowledge graph'}, 'entity': {'id': '847896837532995585', 'name': 'Biology', 'description': 'Biology'}}, {'domain': {'id': '131', 'name': 'Unified Twitter Taxonomy', 'description': 'A taxonomy view into the Semantic Core knowledge graph'}, 'entity': {'id': '961705302700654593', 'name': 'United States Congress', 'description': 'United States Congress'}}, {'domain': {'id': '131', 'name': 'Unified Twitter Taxonomy', 'description': 'A taxonomy view into the Semantic Core knowledge graph'}, 'entity': {'id': '1068583660914266113', 'name': 'Government institutions', 'description': 'Political Body'}}, {'domain': {'id': '131', 'name': 'Unified Twitter Taxonomy', 'description': 'A taxonomy view into the Semantic Core knowledge graph'}, 'entity': {'id': '1354506022979686400', 'name': 'Microbiology'}}, {'domain': {'id': '164', 'name': 'Fields of study', 'description': 'for all fields of study, e.g., futurology, microbiology '}, 'entity': {'id': '854692455005921281', 'name': 'Science', 'description': 'Science'}}, {'domain': {'id': '88', 'name': 'Political Body', 'description': 'A section of a government, like The Supreme Court'}, 'entity': {'id': '877326946253684737', 'name': 'United States Senate', 'description': 'United States Senate'}}, {'domain': {'id': '88', 'name': 'Political Body', 'description': 'A section of a government, like The Supreme Court'}, 'entity': {'id': '961705302700654593', 'name': 'United States Congress', 'description': 'United States Congress'}}, {'domain': {'id': '131', 'name': 'Unified Twitter Taxonomy', 'description': 'A taxonomy view into the Semantic Core knowledge graph'}, 'entity': {'id': '847878884917886977', 'name': 'Politics', 'description': 'Politics'}}, {'domain': {'id': '131', 'name': 'Unified Twitter Taxonomy', 'description': 'A taxonomy view into the Semantic Core knowledge graph'}, 'entity': {'id': '877326946253684737', 'name': 'United States Senate', 'description': 'United States Senate'}}, {'domain': {'id': '131', 'name': 'Unified Twitter Taxonomy', 'description': 'A taxonomy view into the Semantic Core knowledge graph'}, 'entity': {'id': '1068583660914266113', 'name': 'Government institutions', 'description': 'Political Body'}}]"
2022-08-11 02:39:38+00:00,1557557321106325504,Pathetic how these propaganda peddlers keep tryna scare people. Aim is clearly to evoke threat-level of Ebola-like bug you'd see in dystopian sci-fi movie. All obviously a massive rolling psyop and these clowns have utterly trashed their professions. Sad! #PerthNow https://t.co/Tvq1pTKOGM,,4,0,2,123873223,[]
2022-08-11 01:55:43+00:00,1557546271074062336,You can kill the Ebola virus before it enters your system by simply following these few steps. https://t.co/akmc2lGGTL #Ebola PennNewsFile,,0,0,0,2824585513,[]
2022-08-11 01:36:09+00:00,1557541348991025158,I wonder what happened to the Ebola virus 🫣,,0,0,0,1247921096915124227,[]
2022-08-11 01:16:12+00:00,1557536327285018624,"Tory members have a choice, not so dishy Rishi or Dim Lizzy, radiation poisoning or Ebola, they must be delighted",,0,0,0,707183242265362432,[]
