Datetime,Tweet Id,original_text,geo,retweet_count,reply_count,like_count,author_id,context_annotations
2022-08-05 16:14:17+00:00,1555588007444459521,"The youth of #SierraLeone have endured a great deal. Long before #Covid, an #Ebola epidemic tore through our region. 

To us, #fieldhockey is a celebration of life after beating incredible odds. 

Follow us &amp; RT to support our youth in 2022!

#Fridaymotivation #sports #charity https://t.co/G1hvJV1j8U",,2,0,1,1543319091917623296,"[{'domain': {'id': '6', 'name': 'Sports Event'}, 'entity': {'id': '1103026158382141440', 'name': 'Tokyo 2020 Summer Olympics', 'description': 'Tokyo 2020 Summer Olympics '}}, {'domain': {'id': '6', 'name': 'Sports Event'}, 'entity': {'id': '1237760060828213249', 'name': 'Olympics'}}, {'domain': {'id': '11', 'name': 'Sport', 'description': 'Types of sports, like soccer and basketball'}, 'entity': {'id': '1103026158382141440', 'name': 'Tokyo 2020 Summer Olympics', 'description': 'Tokyo 2020 Summer Olympics '}}, {'domain': {'id': '11', 'name': 'Sport', 'description': 'Types of sports, like soccer and basketball'}, 'entity': {'id': '1237760060828213249', 'name': 'Olympics'}}, {'domain': {'id': '11', 'name': 'Sport', 'description': 'Types of sports, like soccer and basketball'}, 'entity': {'id': '1284166678549417986', 'name': 'Field hockey'}}, {'domain': {'id': '11', 'name': 'Sport', 'description': 'Types of sports, like soccer and basketball'}, 'entity': {'id': '1392945498223353856', 'name': 'Olympic Field Hockey'}}, {'domain': {'id': '11', 'name': 'Sport', 'description': 'Types of sports, like soccer and basketball'}, 'entity': {'id': '1410001652258537477', 'name': 'Tokyo Olympics - Field Hockey'}}, {'domain': {'id': '29', 'name': 'Events [Entity Service]', 'description': 'Entity Service related Events domain'}, 'entity': {'id': '1103026158382141440', 'name': 'Tokyo 2020 Summer Olympics', 'description': 'Tokyo 2020 Summer Olympics '}}, {'domain': {'id': '109', 'name': 'Reoccurring Trends', 'description': 'Twitter generated Trends that occur on a daily, weekly, monthly, or yearly basis'}, 'entity': {'id': '918197980154359809', 'name': '#MotivationFriday', 'description': '#MotivationFriday'}}, {'domain': {'id': '123', 'name': 'Ongoing News Story', 'description': ""Ongoing News Stories like 'Brexit'""}, 'entity': {'id': '1220701888179359745', 'name': 'COVID-19'}}, {'domain': {'id': '131', 'name': 'Unified Twitter Taxonomy', 'description': 'A taxonomy view into the Semantic Core knowledge graph'}, 'entity': {'id': '847900493514891265', 'name': 'Sports', 'description': 'Sports'}}, {'domain': {'id': '131', 'name': 'Unified Twitter Taxonomy', 'description': 'A taxonomy view into the Semantic Core knowledge graph'}, 'entity': {'id': '1074751614123008000', 'name': 'Social causes', 'description': 'Social causes'}}, {'domain': {'id': '131', 'name': 'Unified Twitter Taxonomy', 'description': 'A taxonomy view into the Semantic Core knowledge graph'}, 'entity': {'id': '1220701888179359745', 'name': 'COVID-19'}}, {'domain': {'id': '131', 'name': 'Unified Twitter Taxonomy', 'description': 'A taxonomy view into the Semantic Core knowledge graph'}, 'entity': {'id': '1284166678549417986', 'name': 'Field hockey'}}, {'domain': {'id': '131', 'name': 'Unified Twitter Taxonomy', 'description': 'A taxonomy view into the Semantic Core knowledge graph'}, 'entity': {'id': '1286401121641103360', 'name': 'Sports events'}}, {'domain': {'id': '131', 'name': 'Unified Twitter Taxonomy', 'description': 'A taxonomy view into the Semantic Core knowledge graph'}, 'entity': {'id': '1392945498223353856', 'name': 'Olympic Field Hockey'}}, {'domain': {'id': '131', 'name': 'Unified Twitter Taxonomy', 'description': 'A taxonomy view into the Semantic Core knowledge graph'}, 'entity': {'id': '1436053202835689485', 'name': 'Events'}}]"
2022-08-05 16:09:14+00:00,1555586739795902465,"If you only read one article about FAUCI today,  READ THIS ONE 💥💥💥💥💥💥💥💥💥💥
Fauci and other health 'experts' are messing up monkeypox just as they did COVID, Ebola and AIDS https://t.co/BVi6CnFmT4",,0,0,0,1519278335750254593,"[{'domain': {'id': '123', 'name': 'Ongoing News Story', 'description': ""Ongoing News Stories like 'Brexit'""}, 'entity': {'id': '1220701888179359745', 'name': 'COVID-19'}}, {'domain': {'id': '131', 'name': 'Unified Twitter Taxonomy', 'description': 'A taxonomy view into the Semantic Core knowledge graph'}, 'entity': {'id': '1220701888179359745', 'name': 'COVID-19'}}, {'domain': {'id': '29', 'name': 'Events [Entity Service]', 'description': 'Entity Service related Events domain'}, 'entity': {'id': '1219057585707315201', 'name': 'COVID-19: Latest news updates from around the world', 'description': 'This page is a timeline of Tweets with the latest information and updates on COVID-19 from experts, journalists, health authorities and other trusted sources from around the world. For more on COVID-19, visit: twitter.com/explore/tabs/covid-19'}}]"
2022-08-05 16:02:13+00:00,1555584971649081344,https://t.co/SZgp6a6Wbk FREEDOM SNATCHING AGAIN,,0,0,0,1319309952914124800,[]
2022-08-05 15:55:46+00:00,1555583348231139334,"$SIGA
BOOM 💥 BOOM

$BVNRY $AEMD $TNXP $EJH
All these are Stair Stepping to Higher Highs
#Diversify &amp; HOLD ON!
Not only #MonkeyPox Killers also #Cancer #HIV #Ebola #COVID19 

@ChiefofTradez @melissa_vasi @EL_VADER_13 @Adelisa63114031 @tataubruddha @MoonMarket_ @Whistler_Chavez https://t.co/75PHvSoAd8",,0,1,6,1272820048009158656,"[{'domain': {'id': '123', 'name': 'Ongoing News Story', 'description': ""Ongoing News Stories like 'Brexit'""}, 'entity': {'id': '1220701888179359745', 'name': 'COVID-19'}}, {'domain': {'id': '131', 'name': 'Unified Twitter Taxonomy', 'description': 'A taxonomy view into the Semantic Core knowledge graph'}, 'entity': {'id': '1220701888179359745', 'name': 'COVID-19'}}]"
2022-08-05 15:43:43+00:00,1555580317037199362,"Explosive interview with Karen Kingston.

Please make sure you and your loved ones are aware of what's coming. 

https://t.co/mDtloHZwvT 
https://t.co/8uJvqI0ODr",,0,0,1,1092882392476499969,[]
2022-08-05 15:39:52+00:00,1555579348681248775,Only 18 Middle School soccer teams will have a season due to Ebola,,0,0,0,1307854014596493319,"[{'domain': {'id': '11', 'name': 'Sport', 'description': 'Types of sports, like soccer and basketball'}, 'entity': {'id': '733756536430809088', 'name': 'Soccer'}}, {'domain': {'id': '131', 'name': 'Unified Twitter Taxonomy', 'description': 'A taxonomy view into the Semantic Core knowledge graph'}, 'entity': {'id': '733756536430809088', 'name': 'Soccer'}}, {'domain': {'id': '131', 'name': 'Unified Twitter Taxonomy', 'description': 'A taxonomy view into the Semantic Core knowledge graph'}, 'entity': {'id': '847900493514891265', 'name': 'Sports', 'description': 'Sports'}}]"
2022-08-05 15:38:46+00:00,1555579072679677952,This photo was around November last year. @PinkKnightVR was confessing to @PinkEbola while he was in his priest outfit. 🤣 It is also when I first met Ebola too. Cursed but a big sweetheart. This is a fun memory related to the pink family. https://t.co/oQCIgULtt7,,1,0,9,1480243079022100480,[]
2022-08-05 15:31:33+00:00,1555577254289227776,"Fauci and other health 'experts' are messing up monkeypox just as they did COVID, Ebola and AIDS https://t.co/YUVWDxaEUW via @nypost",,0,0,0,519872265,"[{'domain': {'id': '47', 'name': 'Brand', 'description': 'Brands and Companies'}, 'entity': {'id': '1065654169002885120', 'name': 'New York Post', 'description': 'New York Post'}}, {'domain': {'id': '123', 'name': 'Ongoing News Story', 'description': ""Ongoing News Stories like 'Brexit'""}, 'entity': {'id': '1220701888179359745', 'name': 'COVID-19'}}, {'domain': {'id': '131', 'name': 'Unified Twitter Taxonomy', 'description': 'A taxonomy view into the Semantic Core knowledge graph'}, 'entity': {'id': '1065654169002885120', 'name': 'New York Post', 'description': 'New York Post'}}, {'domain': {'id': '131', 'name': 'Unified Twitter Taxonomy', 'description': 'A taxonomy view into the Semantic Core knowledge graph'}, 'entity': {'id': '1196447117297905665', 'name': 'News outlets'}}, {'domain': {'id': '131', 'name': 'Unified Twitter Taxonomy', 'description': 'A taxonomy view into the Semantic Core knowledge graph'}, 'entity': {'id': '1220701888179359745', 'name': 'COVID-19'}}, {'domain': {'id': '29', 'name': 'Events [Entity Service]', 'description': 'Entity Service related Events domain'}, 'entity': {'id': '1219057585707315201', 'name': 'COVID-19: Latest news updates from around the world', 'description': 'This page is a timeline of Tweets with the latest information and updates on COVID-19 from experts, journalists, health authorities and other trusted sources from around the world. For more on COVID-19, visit: twitter.com/explore/tabs/covid-19'}}]"
2022-08-05 15:29:39+00:00,1555576775350145024,"“ $BVNRY knows a thing or 2 about vaccines -- it already has shots for rabies, tick-borne encephalitis, smallpox, &amp; Ebola approved in either the EU or U.S., or both. Now Jynneos is the only vaccine approved by the EMA and the  FDA for monkeypox” https://t.co/laYvYRFHuT",,0,0,1,1328100486449393665,"[{'domain': {'id': '123', 'name': 'Ongoing News Story', 'description': ""Ongoing News Stories like 'Brexit'""}, 'entity': {'id': '1220701888179359745', 'name': 'COVID-19'}}, {'domain': {'id': '131', 'name': 'Unified Twitter Taxonomy', 'description': 'A taxonomy view into the Semantic Core knowledge graph'}, 'entity': {'id': '1220701888179359745', 'name': 'COVID-19'}}]"
2022-08-05 15:26:56+00:00,1555576091682668544,When they bring ebola back next year that shit gone be so funny 😂😂,,0,0,0,967904638648365057,[]
2022-08-05 15:24:46+00:00,1555575548755251203,"I can’t respond 2 this bc she stopped responses &amp; I understand but we didn’t shut down bc of SARS, H1N1 swineflu, Ebola, etc only COVID bc it’s fatality rate was much worse due to obvi reasons! The government isn’t shutting back down 4 monkey pox #justthemessenger #dontgetmadatme https://t.co/OGta8xzMHl",,0,0,0,1362530433607565313,"[{'domain': {'id': '123', 'name': 'Ongoing News Story', 'description': ""Ongoing News Stories like 'Brexit'""}, 'entity': {'id': '1220701888179359745', 'name': 'COVID-19'}}, {'domain': {'id': '131', 'name': 'Unified Twitter Taxonomy', 'description': 'A taxonomy view into the Semantic Core knowledge graph'}, 'entity': {'id': '1220701888179359745', 'name': 'COVID-19'}}, {'domain': {'id': '29', 'name': 'Events [Entity Service]', 'description': 'Entity Service related Events domain'}, 'entity': {'id': '1219057585707315201', 'name': 'COVID-19: Latest news updates from around the world', 'description': 'This page is a timeline of Tweets with the latest information and updates on COVID-19 from experts, journalists, health authorities and other trusted sources from around the world. For more on COVID-19, visit: twitter.com/explore/tabs/covid-19'}}]"
2022-08-05 15:21:48+00:00,1555574801502289921,"Lmaooo we got Covid, Monkeybutt, Ebola in the streets and they got the CNAs smoking hookah 😭😭😭, I've been in Sentara a few times they need all the focus they can over there https://t.co/smibMi551Q",,0,0,2,1523281288685408257,"[{'domain': {'id': '123', 'name': 'Ongoing News Story', 'description': ""Ongoing News Stories like 'Brexit'""}, 'entity': {'id': '1220701888179359745', 'name': 'COVID-19'}}, {'domain': {'id': '131', 'name': 'Unified Twitter Taxonomy', 'description': 'A taxonomy view into the Semantic Core knowledge graph'}, 'entity': {'id': '1220701888179359745', 'name': 'COVID-19'}}]"
2022-08-05 15:21:18+00:00,1555574677581578240,they need to do to monkeypox what they did to ebola when ts came over here,,0,0,0,1081387229572935683,[]
2022-08-05 15:20:51+00:00,1555574561076178944,Sometimes I get to do cool shit at work like sequence Ebola vaccines.,,0,0,0,2406167402,"[{'domain': {'id': '65', 'name': 'Interests and Hobbies Vertical', 'description': 'Top level interests and hobbies groupings, like Food or Travel'}, 'entity': {'id': '903303816698671104', 'name': 'Wellness and health', 'description': 'Wellness & Health'}}, {'domain': {'id': '66', 'name': 'Interests and Hobbies Category', 'description': 'A grouping of interests and hobbies entities, like Novelty Food or Destinations'}, 'entity': {'id': '918538847302041600', 'name': 'Community Health', 'description': 'Community Health'}}, {'domain': {'id': '67', 'name': 'Interests and Hobbies', 'description': 'Interests, opinions, and behaviors of individuals, groups, or cultures; like Speciality Cooking or Theme Parks'}, 'entity': {'id': '920768310152593408', 'name': 'Common Medication', 'description': 'Common Medication'}}, {'domain': {'id': '123', 'name': 'Ongoing News Story', 'description': ""Ongoing News Stories like 'Brexit'""}, 'entity': {'id': '1220701888179359745', 'name': 'COVID-19'}}, {'domain': {'id': '131', 'name': 'Unified Twitter Taxonomy', 'description': 'A taxonomy view into the Semantic Core knowledge graph'}, 'entity': {'id': '1220701888179359745', 'name': 'COVID-19'}}]"
2022-08-05 15:16:35+00:00,1555573488362176512,"Fauci and other health 'experts' are messing up monkeypox just as they did COVID, Ebola and AIDS https://t.co/OkprYxlzlP via @nypost",,0,0,0,21531121,"[{'domain': {'id': '47', 'name': 'Brand', 'description': 'Brands and Companies'}, 'entity': {'id': '1065654169002885120', 'name': 'New York Post', 'description': 'New York Post'}}, {'domain': {'id': '123', 'name': 'Ongoing News Story', 'description': ""Ongoing News Stories like 'Brexit'""}, 'entity': {'id': '1220701888179359745', 'name': 'COVID-19'}}, {'domain': {'id': '131', 'name': 'Unified Twitter Taxonomy', 'description': 'A taxonomy view into the Semantic Core knowledge graph'}, 'entity': {'id': '1065654169002885120', 'name': 'New York Post', 'description': 'New York Post'}}, {'domain': {'id': '131', 'name': 'Unified Twitter Taxonomy', 'description': 'A taxonomy view into the Semantic Core knowledge graph'}, 'entity': {'id': '1196447117297905665', 'name': 'News outlets'}}, {'domain': {'id': '131', 'name': 'Unified Twitter Taxonomy', 'description': 'A taxonomy view into the Semantic Core knowledge graph'}, 'entity': {'id': '1220701888179359745', 'name': 'COVID-19'}}, {'domain': {'id': '29', 'name': 'Events [Entity Service]', 'description': 'Entity Service related Events domain'}, 'entity': {'id': '1219057585707315201', 'name': 'COVID-19: Latest news updates from around the world', 'description': 'This page is a timeline of Tweets with the latest information and updates on COVID-19 from experts, journalists, health authorities and other trusted sources from around the world. For more on COVID-19, visit: twitter.com/explore/tabs/covid-19'}}]"
2022-08-05 15:14:35+00:00,1555572983921385473,"Polio, small pox, monkey pox, ebola, zyka, COVID 19, these are a few of my favorite things to cite as reasons that your doctor is a Nazi piece of shit https://t.co/Lg4XQgZvfx",,0,0,0,1552755186652721152,"[{'domain': {'id': '123', 'name': 'Ongoing News Story', 'description': ""Ongoing News Stories like 'Brexit'""}, 'entity': {'id': '1220701888179359745', 'name': 'COVID-19'}}, {'domain': {'id': '131', 'name': 'Unified Twitter Taxonomy', 'description': 'A taxonomy view into the Semantic Core knowledge graph'}, 'entity': {'id': '1220701888179359745', 'name': 'COVID-19'}}, {'domain': {'id': '29', 'name': 'Events [Entity Service]', 'description': 'Entity Service related Events domain'}, 'entity': {'id': '1219057585707315201', 'name': 'COVID-19: Latest news updates from around the world', 'description': 'This page is a timeline of Tweets with the latest information and updates on COVID-19 from experts, journalists, health authorities and other trusted sources from around the world. For more on COVID-19, visit: twitter.com/explore/tabs/covid-19'}}]"
2022-08-05 15:09:28+00:00,1555571698304434176,"my grandad had to get up 3 days before he went to bed, eat Ebola virus for breakfast, work 3-century shifts in the molten core of the earth, then come home and his parents would detonate a cobalt nuclear warhead causing the extinction of all life on earth, and he never complained https://t.co/2PgTTfEcX7",,0,1,2,381486941,"[{'domain': {'id': '10', 'name': 'Person', 'description': 'Named people in the world like Nelson Mandela'}, 'entity': {'id': '1070725791934115840', 'name': 'Eric Idle', 'description': 'British actor, comedian, and writer'}}, {'domain': {'id': '56', 'name': 'Actor', 'description': 'An actor or actress in the world, like Kate Winslet or Leonardo DiCaprio'}, 'entity': {'id': '1070725791934115840', 'name': 'Eric Idle', 'description': 'British actor, comedian, and writer'}}, {'domain': {'id': '30', 'name': 'Entities [Entity Service]', 'description': 'Entity Service top level domain, every item that is in Entity Service should be in this domain'}, 'entity': {'id': '825047692124442624', 'name': 'Food', 'description': 'Food'}}, {'domain': {'id': '65', 'name': 'Interests and Hobbies Vertical', 'description': 'Top level interests and hobbies groupings, like Food or Travel'}, 'entity': {'id': '864925500627484672', 'name': 'Family and life stages', 'description': 'Family and Life Stages'}}, {'domain': {'id': '66', 'name': 'Interests and Hobbies Category', 'description': 'A grouping of interests and hobbies entities, like Novelty Food or Destinations'}, 'entity': {'id': '847545883637891072', 'name': 'Fatherhood', 'description': 'Dads'}}, {'domain': {'id': '67', 'name': 'Interests and Hobbies', 'description': 'Interests, opinions, and behaviors of individuals, groups, or cultures; like Speciality Cooking or Theme Parks'}, 'entity': {'id': '1006277774384828416', 'name': 'Food experience', 'description': 'Conversation about eating'}}, {'domain': {'id': '123', 'name': 'Ongoing News Story', 'description': ""Ongoing News Stories like 'Brexit'""}, 'entity': {'id': '1220701888179359745', 'name': 'COVID-19'}}, {'domain': {'id': '123', 'name': 'Ongoing News Story', 'description': ""Ongoing News Stories like 'Brexit'""}, 'entity': {'id': '1484601166080081920', 'name': 'Russo-Ukrainian conflict'}}, {'domain': {'id': '131', 'name': 'Unified Twitter Taxonomy', 'description': 'A taxonomy view into the Semantic Core knowledge graph'}, 'entity': {'id': '847545883637891072', 'name': 'Fatherhood', 'description': 'Dads'}}, {'domain': {'id': '131', 'name': 'Unified Twitter Taxonomy', 'description': 'A taxonomy view into the Semantic Core knowledge graph'}, 'entity': {'id': '1070725791934115840', 'name': 'Eric Idle', 'description': 'British actor, comedian, and writer'}}, {'domain': {'id': '131', 'name': 'Unified Twitter Taxonomy', 'description': 'A taxonomy view into the Semantic Core knowledge graph'}, 'entity': {'id': '1220701888179359745', 'name': 'COVID-19'}}]"
2022-08-05 15:02:01+00:00,1555569821240147968,"Open SmartNews and read ""Fauci and other health ‘experts’ are messing up monkeypox just as they did COVID, Ebola and AIDS"" here: https://t.co/UebnXIK1Gk 
To read it on the web, tap here: https://t.co/DwK5TiKZ3B",,0,0,1,904735363570298881,"[{'domain': {'id': '123', 'name': 'Ongoing News Story', 'description': ""Ongoing News Stories like 'Brexit'""}, 'entity': {'id': '1220701888179359745', 'name': 'COVID-19'}}, {'domain': {'id': '131', 'name': 'Unified Twitter Taxonomy', 'description': 'A taxonomy view into the Semantic Core knowledge graph'}, 'entity': {'id': '1220701888179359745', 'name': 'COVID-19'}}, {'domain': {'id': '29', 'name': 'Events [Entity Service]', 'description': 'Entity Service related Events domain'}, 'entity': {'id': '1219057585707315201', 'name': 'COVID-19: Latest news updates from around the world', 'description': 'This page is a timeline of Tweets with the latest information and updates on COVID-19 from experts, journalists, health authorities and other trusted sources from around the world. For more on COVID-19, visit: twitter.com/explore/tabs/covid-19'}}]"
2022-08-05 14:59:10+00:00,1555569103485554689,When Obama was president the Ebola shit was handled! 🙂🥴 why are “leaders” not taking this shit seriously,,0,0,2,1001257390090551296,"[{'domain': {'id': '10', 'name': 'Person', 'description': 'Named people in the world like Nelson Mandela'}, 'entity': {'id': '10038764303', 'name': 'Barack Obama', 'description': 'Former US President Barack Obama'}}, {'domain': {'id': '35', 'name': 'Politician', 'description': 'Politicians in the world, like Joe Biden'}, 'entity': {'id': '10038764303', 'name': 'Barack Obama', 'description': 'Former US President Barack Obama'}}, {'domain': {'id': '131', 'name': 'Unified Twitter Taxonomy', 'description': 'A taxonomy view into the Semantic Core knowledge graph'}, 'entity': {'id': '10038764303', 'name': 'Barack Obama', 'description': 'Former US President Barack Obama'}}, {'domain': {'id': '131', 'name': 'Unified Twitter Taxonomy', 'description': 'A taxonomy view into the Semantic Core knowledge graph'}, 'entity': {'id': '847878884917886977', 'name': 'Politics', 'description': 'Politics'}}, {'domain': {'id': '131', 'name': 'Unified Twitter Taxonomy', 'description': 'A taxonomy view into the Semantic Core knowledge graph'}, 'entity': {'id': '1070032753834438656', 'name': 'Political figures', 'description': 'Politician'}}]"
2022-08-05 14:57:12+00:00,1555568610315276292,Remdesivir is a killer. Proven in trial as potential treatment for Ebola where 54% of Remdesivir patients died. https://t.co/11COEN9xiA,,0,0,0,1170322412161966080,"[{'domain': {'id': '123', 'name': 'Ongoing News Story', 'description': ""Ongoing News Stories like 'Brexit'""}, 'entity': {'id': '1220701888179359745', 'name': 'COVID-19'}}, {'domain': {'id': '131', 'name': 'Unified Twitter Taxonomy', 'description': 'A taxonomy view into the Semantic Core knowledge graph'}, 'entity': {'id': '1220701888179359745', 'name': 'COVID-19'}}, {'domain': {'id': '29', 'name': 'Events [Entity Service]', 'description': 'Entity Service related Events domain'}, 'entity': {'id': '1219057585707315201', 'name': 'COVID-19: Latest news updates from around the world', 'description': 'This page is a timeline of Tweets with the latest information and updates on COVID-19 from experts, journalists, health authorities and other trusted sources from around the world. For more on COVID-19, visit: twitter.com/explore/tabs/covid-19'}}]"
2022-08-05 14:56:22+00:00,1555568401543614464,Tom Brady the Vicious died from Ebola in 2016.,,0,0,0,4893877534,"[{'domain': {'id': '10', 'name': 'Person', 'description': 'Named people in the world like Nelson Mandela'}, 'entity': {'id': '768503359732985856', 'name': 'Tom Brady', 'description': 'Tom Brady'}}, {'domain': {'id': '60', 'name': 'Athlete', 'description': 'An athlete in the world, like Serena Williams or Lionel Messi'}, 'entity': {'id': '768503359732985856', 'name': 'Tom Brady', 'description': 'Tom Brady'}}, {'domain': {'id': '131', 'name': 'Unified Twitter Taxonomy', 'description': 'A taxonomy view into the Semantic Core knowledge graph'}, 'entity': {'id': '689566306014617600', 'name': 'American football'}}, {'domain': {'id': '131', 'name': 'Unified Twitter Taxonomy', 'description': 'A taxonomy view into the Semantic Core knowledge graph'}, 'entity': {'id': '689566314835259392', 'name': 'NFL'}}, {'domain': {'id': '131', 'name': 'Unified Twitter Taxonomy', 'description': 'A taxonomy view into the Semantic Core knowledge graph'}, 'entity': {'id': '768503359732985856', 'name': 'Tom Brady', 'description': 'Tom Brady'}}, {'domain': {'id': '131', 'name': 'Unified Twitter Taxonomy', 'description': 'A taxonomy view into the Semantic Core knowledge graph'}, 'entity': {'id': '847900493514891265', 'name': 'Sports', 'description': 'Sports'}}, {'domain': {'id': '131', 'name': 'Unified Twitter Taxonomy', 'description': 'A taxonomy view into the Semantic Core knowledge graph'}, 'entity': {'id': '1263187885970227200', 'name': 'NFL players'}}]"
2022-08-05 14:45:39+00:00,1555565702181896193,"“This is the most dangerous research I have ever encountered.” One contaminant not accounted for in papers published by WIV was cloning vectors of Nipah virus. The Nipah virus has a lethality of more than 60 percent, more than that of Ebola.
https://t.co/ampmctkcAS",,0,0,0,744166663,[]
2022-08-05 14:42:46+00:00,1555564978685427717,"Your tweet gave me
- a cold
- ebola
- probably every illness in the entire world",,0,0,0,2288402650,"[{'domain': {'id': '46', 'name': 'Brand Category', 'description': 'Categories within Brand Verticals that narrow down the scope of Brands'}, 'entity': {'id': '781974596752842752', 'name': 'Services'}}, {'domain': {'id': '47', 'name': 'Brand', 'description': 'Brands and Companies'}, 'entity': {'id': '10045225402', 'name': 'Twitter'}}]"
